subtype,title,authors_raw,page_range,doi,article_url,pdf_url,abstract_id,abstract_objective,abstract_design,abstract_setting,abstract_patients_participants,abstract_intervention,abstract_measurements,abstract_conclusion,abstract_full_text,source,parse_timestamp,title_normalized,author_count,author_name_first,author_name_last,first_author_normalized,last_author_normalized,abstract_text,affiliation_raw,is_rct,sample_size,is_academic,is_us_based,abstract_hash,keywords_str,all_authors_str
Conference abstract,Effects of Relugolix-CT on Uterine Fibroid (UF) and Uterine Volume through 52 Weeks: Liberty Long-Term Extension (LTE) Post Hoc Analysis,"A Al-Hendy, R Venturella, A Lukes, R McLean, D Zhai",Page S5,https://doi.org/10.1016/j.jmig.2023.08.016,https://www.sciencedirect.com/science/article/pii/S1553465023003448,https://www.sciencedirect.com/science/article/pii/S1553465023003448/pdfft?md5=63b30973bcc25714e055d57e847b25e1&pid=1-s2.0-S1553465023003448-main.pdf,AAGL2023_009,NA,NA,NA,NA,NA,NA,NA,"Study ObjectiveEvaluate baseline UF and uterine volume impact on outcomes with relugolix combination therapy (Relugolix-CT) in women with UF-associated heavy menstrual bleeding (HMB) in the LIBERTY LTE study.DesignPhase 3, open-label, 28-week LTE study.Setting149 research centers globally.Patients or ParticipantsPremenopausal women with UF-associated HMB who completed the 24-week LIBERTY 1/2 studies were eligible to enroll in the LTE.InterventionsRelugolix-CT (relugolix 40mg, estradiol 1mg, norethindrone acetate 0.5mg).Measurements and Main ResultsProportion of women experiencing a clinically meaningful reduction in UF or uterine volume (>25% or >50%) through 52 weeks in the Relugolix-CT group was assessed. Subgroup analyses summarized impact of UF and uterine volume at baseline (<25cm3 or ≥25cm3; <300cm3 or ≥300cm3, respectively) on change in UF and uterine volume.In total, 163 women received Relugolix-CT continuously up to 52 weeks; baseline mean volume of the largest UF was 80.0cm3; mean uterine volume was 386.7cm3.At Week 24, 52.6% and 30.3% of women experienced >25% and >50% reduction in UF volume, respectively, increasing to 61.1% and 36.6% at Week 52. For uterine volume, 36.1% and 4.5% experienced a >25% and >50% reduction at Week 24, increasing to 41.2% and 9.6% at Week 52.At Week 52, of 81 women with baseline UF volume of <25cm3, 52.4% and 27.0% experienced a >25% and >50% reduction in UF volume; 69.1% and 45.6% of 81 women with baseline UF volume of ≥25cm3 experienced >25% and >50% reductions in UF volume. Of 96 women with baseline uterine volume of <300cm3, 38.5% and 6.4% experienced a >25% and >50% reduction in uterine volume; 44.8% and 13.8% of 67 women with baseline uterine volume of ≥300cm3 experienced >25% and >50% reductions in uterine volume.ConclusionWomen with larger baseline UF and uterine volume may be more likely to experience substantial reductions of UF and uterine volume with Relugolix-CT.",sciencedirect,2026-04-13T21:17:16.841Z,effects of relugolix ct on uterine fibroid uf and uterine volume through 52 weeks liberty long term extension lte post hoc analysis,5,A Al-Hendy,D Zhai,al-hendy A,zhai D,"Study ObjectiveEvaluate baseline UF and uterine volume impact on outcomes with relugolix combination therapy (Relugolix-CT) in women with UF-associated heavy menstrual bleeding (HMB) in the LIBERTY LTE study.DesignPhase 3, open-label, 28-week LTE study.Setting149 research centers globally.Patients or ParticipantsPremenopausal women with UF-associated HMB who completed the 24-week LIBERTY 1/2 studies were eligible to enroll in the LTE.InterventionsRelugolix-CT (relugolix 40mg, estradiol 1mg, norethindrone acetate 0.5mg).Measurements and Main ResultsProportion of women experiencing a clinically meaningful reduction in UF or uterine volume (>25% or >50%) through 52 weeks in the Relugolix-CT group was assessed. Subgroup analyses summarized impact of UF and uterine volume at baseline (<25cm3 or ≥25cm3; <300cm3 or ≥300cm3, respectively) on change in UF and uterine volume.In total, 163 women received Relugolix-CT continuously up to 52 weeks; baseline mean volume of the largest UF was 80.0cm3; mean uterine volume was 386.7cm3.At Week 24, 52.6% and 30.3% of women experienced >25% and >50% reduction in UF volume, respectively, increasing to 61.1% and 36.6% at Week 52. For uterine volume, 36.1% and 4.5% experienced a >25% and >50% reduction at Week 24, increasing to 41.2% and 9.6% at Week 52.At Week 52, of 81 women with baseline UF volume of <25cm3, 52.4% and 27.0% experienced a >25% and >50% reduction in UF volume; 69.1% and 45.6% of 81 women with baseline UF volume of ≥25cm3 experienced >25% and >50% reductions in UF volume. Of 96 women with baseline uterine volume of <300cm3, 38.5% and 6.4% experienced a >25% and >50% reduction in uterine volume; 44.8% and 13.8% of 67 women with baseline uterine volume of ≥300cm3 experienced >25% and >50% reductions in uterine volume.ConclusionWomen with larger baseline UF and uterine volume may be more likely to experience substantial reductions of UF and uterine volume with Relugolix-CT.",NA,FALSE,386,FALSE,TRUE,aebe5044f811b15b7b0b85626e5d523a,volume; uterine; women; baseline; week; experienced; relugolix; reduction; 25cm3; 300cm3,al-hendy A; venturella R; lukes A; mclean R; zhai D
Conference abstract,Development and Validation of a Simulation Model for Robotic Myomectomy,"R Schneyer, S Scheib, I Green, A Molina, ... M Truong",Page S5,https://doi.org/10.1016/j.jmig.2023.08.017,https://www.sciencedirect.com/science/article/pii/S155346502300345X,https://www.sciencedirect.com/science/article/pii/S155346502300345X/pdfft?md5=8a422234c71687cec4760f53b29af2d7&pid=1-s2.0-S155346502300345X-main.pdf,AAGL2023_010,NA,NA,NA,NA,NA,NA,NA,"Study ObjectiveTo describe a low-cost, low-fidelity robotic myomectomy model and to assess its validity for surgical simulation training.DesignThe model was created using <$5 worth of materials: a foam cylinder, felt, a stress ball, bandage wrap, and multipurpose sealing wrap.SettingSurgical simulation lab.Patients or ParticipantsFour fellowship-trained minimally invasive gynecologic surgeons (experts) and 12 obstetrics and gynecology residents (novices) were recruited from August 2021 to April 2023.InterventionsParticipants performed a simulation task involving two steps: fibroid enucleation and hysterotomy repair. Video recordings were scored by two blinded reviewers using the validated Global Evaluative Assessment of Robotic Skills (GEARS) scale (5-25 points) and a modified GEARS scale (5-40 points), incorporating three novel domains specific to minimally invasive myomectomy. Performance was also scored using predefined task errors. Participants completed a post-task survey regarding the model's utility and educational effect. Interrater reliability of scoring was assessed using the intraclass correlation coefficient (ICC).Measurements and Main ResultsMedian time to task completion was shorter for experts compared to novices (9.7 vs. 24.6 minutes, P=.001). Experts scored higher than novices on both the GEARS scale (median 23 [range 19-24] vs. 12 [6-17.5], P=.004) and modified GEARS scale (36 [29-38] vs. 20 [9.5-28], P=.004). Experts made fewer task errors than novices (median 15.5 vs. 37.5, P=0.034). The ICC was 0.89 for the GEARS assessment, 0.92 for the modified GEARS assessment, and 0.60 for task errors. All participants agreed that the model would be useful for learning or teaching robotic myomectomy, and 94% agreed it would be useful for assessing a learner's ability to perform fibroid enucleation and robotic suturing before live surgery.ConclusionWe have demonstrated evidence supporting the validity of a low-cost robotic myomectomy model. The simulation model and the performance assessments developed in this study provide further educational tools for robotic myomectomy training.",sciencedirect,2026-04-13T21:17:16.841Z,development and validation of a simulation model for robotic myomectomy,4,R Schneyer,A Molina,schneyer R,molina A,"Study ObjectiveTo describe a low-cost, low-fidelity robotic myomectomy model and to assess its validity for surgical simulation training.DesignThe model was created using <$5 worth of materials: a foam cylinder, felt, a stress ball, bandage wrap, and multipurpose sealing wrap.SettingSurgical simulation lab.Patients or ParticipantsFour fellowship-trained minimally invasive gynecologic surgeons (experts) and 12 obstetrics and gynecology residents (novices) were recruited from August 2021 to April 2023.InterventionsParticipants performed a simulation task involving two steps: fibroid enucleation and hysterotomy repair. Video recordings were scored by two blinded reviewers using the validated Global Evaluative Assessment of Robotic Skills (GEARS) scale (5-25 points) and a modified GEARS scale (5-40 points), incorporating three novel domains specific to minimally invasive myomectomy. Performance was also scored using predefined task errors. Participants completed a post-task survey regarding the model's utility and educational effect. Interrater reliability of scoring was assessed using the intraclass correlation coefficient (ICC).Measurements and Main ResultsMedian time to task completion was shorter for experts compared to novices (9.7 vs. 24.6 minutes, P=.001). Experts scored higher than novices on both the GEARS scale (median 23 [range 19-24] vs. 12 [6-17.5], P=.004) and modified GEARS scale (36 [29-38] vs. 20 [9.5-28], P=.004). Experts made fewer task errors than novices (median 15.5 vs. 37.5, P=0.034). The ICC was 0.89 for the GEARS assessment, 0.92 for the modified GEARS assessment, and 0.60 for task errors. All participants agreed that the model would be useful for learning or teaching robotic myomectomy, and 94% agreed it would be useful for assessing a learner's ability to perform fibroid enucleation and robotic suturing before live surgery.ConclusionWe have demonstrated evidence supporting the validity of a low-cost robotic myomectomy model. The simulation model and the performance assessments developed in this study provide further educational tools for robotic myomectomy training.",NA,FALSE,2023,TRUE,TRUE,4e40d3b893eac718a4f809c094febb4b,gears; model; robotic; task; myomectomy; experts; novices; scale; simulation; assessment,schneyer R; scheib S; green I; molina A
Conference abstract,Long-Term Risk of Reintervention after Uterine Preserving Surgical Fibroid Treatments and Variation by Sociodemographic Factors,"E Zaritsky, SD Mitro, C Lee, L Wise, ... M Hedderson",Pages S5-S6,https://doi.org/10.1016/j.jmig.2023.08.018,https://www.sciencedirect.com/science/article/pii/S1553465023003461,https://www.sciencedirect.com/science/article/pii/S1553465023003461/pdfft?md5=adadf8d2bdd052fda7326680e7406655&pid=1-s2.0-S1553465023003461-main.pdf,AAGL2023_011,NA,NA,NA,NA,NA,NA,NA,"Study ObjectiveWe compared long-term reintervention rates across four uterine-preserving surgical fibroid treatments (UPTs) and effect modification by sociodemographic factors.DesignRetrospective open cohort.SettingRetrospective open cohort.Patients or Participants10,670 patients aged 18-50 (20% Asian, 21% Black, 21% Hispanic, 32% White, 5% other/multiracial) from 2009-2021.InterventionsPatients had a first UPT (laparoscopic or abdominal myomectomy, hysteroscopic resection, endometrial ablation [EA], uterine artery embolization [UAE]) after fibroid diagnosis. Patients maintained KPNC membership for ≥1 year after UPT and were followed until reintervention (second UPT, hysterectomy) or censoring (age 50, disenrollment, study end).Measurements and Main ResultsWe calculated cumulative incidence of reintervention and used Cox regression models to compare reintervention rates across UPTs adjusting for age, parity, race/ethnicity, body mass index (BMI), neighborhood deprivation index (NDI) and year. We assessed effect modification by age, parity, race/ethnicity, BMI, and NDI quartile.Median follow-up was 3.8 years (interquartile range: 1.8, 7.5). Index UPTs were 13% (1352) hysteroscopic resections, 16% (1748) UAEs, 21% (2215) EAs, and 50% (5355) myomectomies. At index UPT, 20% of patients were younger than 36, 43% were nulliparous, and 33% had BMI <25 kg/m2. Seven-year cumulative reintervention risk was 22% for myomectomy, 26% for UAE, 36% for EA, and 37% for hysteroscopic resection. Hysterectomy was the most common reintervention (85% of reinterventions after UAE, 77% after EA, 48% after myomectomy, 45% after hysteroscopic resection). Repeat procedures were also common: 33% of reinterventions after hysteroscopic resection were hysteroscopic resections, and 30% of reinterventions after myomectomy were myomectomies.Reintervention rates did not vary by race/ethnicity, BMI, or NDI, but rates of reintervention after UAE, EA, and hysteroscopic resection were higher for younger patients, and rates for myomectomy and hysteroscopic resection were higher for multiparas versus nulliparas.ConclusionLong-term reintervention risks for UAE, EA, and hysteroscopic resection are greater than myomectomy, and does not vary by race/ethnicity, BMI, or NDI.",sciencedirect,2026-04-13T21:17:16.841Z,long term risk of reintervention after uterine preserving surgical fibroid treatments and variation by sociodemographic factors,4,E Zaritsky,L Wise,zaritsky E,wise L,"Study ObjectiveWe compared long-term reintervention rates across four uterine-preserving surgical fibroid treatments (UPTs) and effect modification by sociodemographic factors.DesignRetrospective open cohort.SettingRetrospective open cohort.Patients or Participants10,670 patients aged 18-50 (20% Asian, 21% Black, 21% Hispanic, 32% White, 5% other/multiracial) from 2009-2021.InterventionsPatients had a first UPT (laparoscopic or abdominal myomectomy, hysteroscopic resection, endometrial ablation [EA], uterine artery embolization [UAE]) after fibroid diagnosis. Patients maintained KPNC membership for ≥1 year after UPT and were followed until reintervention (second UPT, hysterectomy) or censoring (age 50, disenrollment, study end).Measurements and Main ResultsWe calculated cumulative incidence of reintervention and used Cox regression models to compare reintervention rates across UPTs adjusting for age, parity, race/ethnicity, body mass index (BMI), neighborhood deprivation index (NDI) and year. We assessed effect modification by age, parity, race/ethnicity, BMI, and NDI quartile.Median follow-up was 3.8 years (interquartile range: 1.8, 7.5). Index UPTs were 13% (1352) hysteroscopic resections, 16% (1748) UAEs, 21% (2215) EAs, and 50% (5355) myomectomies. At index UPT, 20% of patients were younger than 36, 43% were nulliparous, and 33% had BMI <25 kg/m2. Seven-year cumulative reintervention risk was 22% for myomectomy, 26% for UAE, 36% for EA, and 37% for hysteroscopic resection. Hysterectomy was the most common reintervention (85% of reinterventions after UAE, 77% after EA, 48% after myomectomy, 45% after hysteroscopic resection). Repeat procedures were also common: 33% of reinterventions after hysteroscopic resection were hysteroscopic resections, and 30% of reinterventions after myomectomy were myomectomies.Reintervention rates did not vary by race/ethnicity, BMI, or NDI, but rates of reintervention after UAE, EA, and hysteroscopic resection were higher for younger patients, and rates for myomectomy and hysteroscopic resection were higher for multiparas versus nulliparas.ConclusionLong-term reintervention risks for UAE, EA, and hysteroscopic resection are greater than myomectomy, and does not vary by race/ethnicity, BMI, or NDI.",NA,FALSE,5355,FALSE,TRUE,39258d941cc0046ca205f6f2667bba30,hysteroscopic; reintervention; resection; myomectomy; bmi; rates; uae; ethnicity; index; ndi,zaritsky E; mitro S; lee C; wise L
Conference abstract,10 Steps in the Successful Conservative Surgical Management of Prolapsed Submucous Leiomyoma,"MR Cantor, MRA Baltazar",Page S6,https://doi.org/10.1016/j.jmig.2023.08.019,https://www.sciencedirect.com/science/article/pii/S1553465023003473,https://www.sciencedirect.com/science/article/pii/S1553465023003473/pdfft?md5=b8fedc05b9ac70d80c04f4b31c9b8db7&pid=1-s2.0-S1553465023003473-main.pdf,AAGL2023_012,NA,NA,NA,NA,NA,NA,NA,"Study ObjectiveLeiomyoma are common benign smooth muscle tumors and have several types. The pedunculate submucous myoma has the chance of prolapse. Vaginal myomectomy has been the conservative surgical treatment of patients with prolapsed submucous myoma. However, there were incidences of hemorrhage, recurrence and non-puerperal uterine inversion due to the remaining pedicle. The aim of this review is to present a standard and sequential minimally invasive procedure that can preserve the uterus. We enumerated the procedure in 10 steps that is clear and organized to be easily performed by surgeons.DesignA Descriptive study.SettingA tertiary government hospital. The author summarizes the technique divided into 10 steps: 1. Assessment of the size and mobility of the prolapsed submucous myoma 2. Assessment of the accessibility of the pedicle of the prolapsed submucous myoma 3. Perform Diagnostic Hysteroscopy in order to identify the pathology and topography of the uterus 4. Devascularization 5. Detachment 6. Removal of the myoma 7. Sealing off the dilated cervix with silicone nipple bottle 8. Injecting vasoconstrictor into the lip of the cervix 9. Hysteroscopic resection of the remaining pedicle of the myoma 10. Hemostasis.Patients or ParticipantsPatients with no known allergy to silicone, who presented with prolapsing submucous leiomyoma and opted for a conservative management.InterventionsStandardized conservative surgical management of prolapsed submucous leiomyomaMeasurements and Main ResultsN/A.ConclusionThe stepwise procedure of vaginal myomectomy followed by Hysteroscopic resection of the remaining pedicle of the submucous myoma could be a standard surgical management for patients who opt to preserve their uterus. The 10 steps described may help other surgeons plan and perform their surgery easier and safer. Innovative materials like the use of silicone nipple bottle may be utilized to overcome the dilated cervix during hysteroscopy.",sciencedirect,2026-04-13T21:17:16.841Z,10 steps in the successful conservative surgical management of prolapsed submucous leiomyoma,2,MR Cantor,MRA Baltazar,cantor M,baltazar M,"Study ObjectiveLeiomyoma are common benign smooth muscle tumors and have several types. The pedunculate submucous myoma has the chance of prolapse. Vaginal myomectomy has been the conservative surgical treatment of patients with prolapsed submucous myoma. However, there were incidences of hemorrhage, recurrence and non-puerperal uterine inversion due to the remaining pedicle. The aim of this review is to present a standard and sequential minimally invasive procedure that can preserve the uterus. We enumerated the procedure in 10 steps that is clear and organized to be easily performed by surgeons.DesignA Descriptive study.SettingA tertiary government hospital. The author summarizes the technique divided into 10 steps: 1. Assessment of the size and mobility of the prolapsed submucous myoma 2. Assessment of the accessibility of the pedicle of the prolapsed submucous myoma 3. Perform Diagnostic Hysteroscopy in order to identify the pathology and topography of the uterus 4. Devascularization 5. Detachment 6. Removal of the myoma 7. Sealing off the dilated cervix with silicone nipple bottle 8. Injecting vasoconstrictor into the lip of the cervix 9. Hysteroscopic resection of the remaining pedicle of the myoma 10. Hemostasis.Patients or ParticipantsPatients with no known allergy to silicone, who presented with prolapsing submucous leiomyoma and opted for a conservative management.InterventionsStandardized conservative surgical management of prolapsed submucous leiomyomaMeasurements and Main ResultsN/A.ConclusionThe stepwise procedure of vaginal myomectomy followed by Hysteroscopic resection of the remaining pedicle of the submucous myoma could be a standard surgical management for patients who opt to preserve their uterus. The 10 steps described may help other surgeons plan and perform their surgery easier and safer. Innovative materials like the use of silicone nipple bottle may be utilized to overcome the dilated cervix during hysteroscopy.",NA,FALSE,10,FALSE,TRUE,a813e19287ebfc37141c58ee13142eaf,myoma; submucous; pedicle; prolapsed; cervix; conservative; management; procedure; remaining; silicone,cantor M; baltazar M
Conference abstract,"Agreement Analysis of Fibroid and Uterine Volumes Assessed in Ultrasound, MRI, and 3D Virtual Reality before and after SPRM Treatment","TE Flaxman, S Sandhu, C Mbewe, S Duigenan, ... SS Singh",Page S6,https://doi.org/10.1016/j.jmig.2023.08.020,https://www.sciencedirect.com/science/article/pii/S1553465023003485,https://www.sciencedirect.com/science/article/pii/S1553465023003485/pdfft?md5=8992800a50d2bb9c07228a82050ef4a0&pid=1-s2.0-S1553465023003485-main.pdf,AAGL2023_013,NA,NA,NA,NA,NA,NA,NA,NA,sciencedirect,2026-04-13T21:17:16.841Z,agreement analysis of fibroid and uterine volumes assessed in ultrasound mri and 3d virtual reality before and after sprm treatment,4,TE Flaxman,S Duigenan,flaxman T,duigenan S,NA,NA,FALSE,3,FALSE,TRUE,915ae41de02b2d7387d5148537c49094,,flaxman T; sandhu S; mbewe C; duigenan S
Conference abstract,The Effect of Hematologic Malignancies on Perioperative Transfusions for Patients Undergoing Hysterectomy,"K Duckworth, S Lee, B Pothuri",Pages S6-S7,https://doi.org/10.1016/j.jmig.2023.08.021,https://www.sciencedirect.com/science/article/pii/S1553465023003497,https://www.sciencedirect.com/science/article/pii/S1553465023003497/pdfft?md5=38d5c1a9462b853604f66465e46fb2e3&pid=1-s2.0-S1553465023003497-main.pdf,AAGL2023_014,NA,NA,NA,NA,NA,NA,NA,NA,sciencedirect,2026-04-13T21:17:16.841Z,the effect of hematologic malignancies on perioperative transfusions for patients undergoing hysterectomy,3,K Duckworth,B Pothuri,duckworth K,pothuri B,NA,NA,FALSE,NA,FALSE,FALSE,27cda26aecd0b488349a61bf73b765e3,,duckworth K; lee S; pothuri B
Conference abstract,Comparison of O-RADS 2022 and Simple Rules Ultrasound Classifications to Predict Adnexal Malignancy,"MJ Solnik, M Atri, A Nanapragasam, S Sagheb, F Nasri",Page S7,https://doi.org/10.1016/j.jmig.2023.08.022,https://www.sciencedirect.com/science/article/pii/S1553465023003503,https://www.sciencedirect.com/science/article/pii/S1553465023003503/pdfft?md5=0155c4d5f0dd9d09b2e035c85944ef62&pid=1-s2.0-S1553465023003503-main.pdf,AAGL2023_015,NA,NA,NA,NA,NA,NA,NA,NA,sciencedirect,2026-04-13T21:17:16.841Z,comparison of o rads 2022 and simple rules ultrasound classifications to predict adnexal malignancy,5,MJ Solnik,F Nasri,solnik M,nasri F,NA,NA,FALSE,2022,FALSE,FALSE,3f972e5357f17afc7b8b2009eeef41ed,,solnik M; atri M; nanapragasam A; sagheb S; nasri F
Conference abstract,Abdominal Versus Vaginal Contained Manual Morcellation for Laparoscopic Myomectomy,"V Flatow, N Atobiloye, S Khalil, C Ascher-Walsh, ... K Zakashansky",Page S7,https://doi.org/10.1016/j.jmig.2023.08.023,https://www.sciencedirect.com/science/article/pii/S1553465023003515,https://www.sciencedirect.com/science/article/pii/S1553465023003515/pdfft?md5=ea322183e1dadc788955807c4da86a6a&pid=1-s2.0-S1553465023003515-main.pdf,AAGL2023_016,NA,NA,NA,NA,NA,NA,NA,NA,sciencedirect,2026-04-13T21:17:16.841Z,abdominal versus vaginal contained manual morcellation for laparoscopic myomectomy,4,V Flatow,C Ascher-Walsh,flatow V,ascher-walsh C,NA,NA,FALSE,NA,FALSE,FALSE,8d64fb7549af1d21a889c6d071861fc0,,flatow V; atobiloye N; khalil S; ascher-walsh C
Conference abstract,Is Appendiceal Endometriosis in the Eye of the Beholder? Predictive Value of Visible Lesions in Identifying True Pathology,"P Urbina, K Bolten, A Emeka, L Yu, ... S Tsai",Page S8,https://doi.org/10.1016/j.jmig.2023.08.025,https://www.sciencedirect.com/science/article/pii/S1553465023003539,https://www.sciencedirect.com/science/article/pii/S1553465023003539/pdfft?md5=a0553e62800f04c6f4a7c81fc12030d4&pid=1-s2.0-S1553465023003539-main.pdf,AAGL2023_017,NA,NA,NA,NA,NA,NA,NA,NA,sciencedirect,2026-04-13T21:17:16.841Z,is appendiceal endometriosis in the eye of the beholder predictive value of visible lesions in identifying true pathology,4,P Urbina,L Yu,urbina P,yu L,NA,NA,FALSE,NA,FALSE,TRUE,b578ff8bd0cc9f606c727f80f2f4e3d4,,urbina P; bolten K; emeka A; yu L
Conference abstract,Endometriosis and Pelvic Pain: A Look into Racial Variation in Medical and Surgical Management,"C Wicks, M Weintraub, LY Tucker, A Childs, ... E Zaritsky",Page S8,https://doi.org/10.1016/j.jmig.2023.08.026,https://www.sciencedirect.com/science/article/pii/S1553465023003540,https://www.sciencedirect.com/science/article/pii/S1553465023003540/pdfft?md5=432729177e8fbf1c5ec25c5e6ca9f36f&pid=1-s2.0-S1553465023003540-main.pdf,AAGL2023_018,NA,NA,NA,NA,NA,NA,NA,NA,sciencedirect,2026-04-13T21:17:16.841Z,endometriosis and pelvic pain a look into racial variation in medical and surgical management,4,C Wicks,A Childs,wicks C,childs A,NA,NA,FALSE,NA,FALSE,TRUE,b8932621ea398ae2b32d3e3174a51c58,,wicks C; weintraub M; tucker L; childs A
Conference abstract,Ultrasound Based Decision Tree Analysis Modelling to Predict AAGL Endometriosis Surgical Complexity Levels,"J Mak, A Eathorne, P McClenahan, A Gil, G Condous",Pages S8-S9,https://doi.org/10.1016/j.jmig.2023.08.027,https://www.sciencedirect.com/science/article/pii/S1553465023003552,https://www.sciencedirect.com/science/article/pii/S1553465023003552/pdfft?md5=0f7e3304713e85249ce7dd76c9184fcd&pid=1-s2.0-S1553465023003552-main.pdf,AAGL2023_019,NA,NA,NA,NA,NA,NA,NA,NA,sciencedirect,2026-04-13T21:17:16.841Z,ultrasound based decision tree analysis modelling to predict aagl endometriosis surgical complexity levels,5,J Mak,G Condous,mak J,condous G,NA,NA,FALSE,NA,FALSE,FALSE,6b76f842e4f74419f43c8f52d1924f8c,,mak J; eathorne A; mcclenahan P; gil A; condous G
