subtype,title,authors_raw,page_range,doi,article_url,pdf_url,abstract_id,abstract_objective,abstract_design,abstract_setting,abstract_patients_participants,abstract_intervention,abstract_measurements,abstract_conclusion,abstract_full_text,source,parse_timestamp,title_normalized,author_count,author_name_first,author_name_last,first_author_normalized,last_author_normalized,abstract_text,affiliation_raw,is_rct,sample_size,is_academic,is_us_based,abstract_hash,keywords_str,all_authors_str
Conference abstract,Performance Evaluation of Urinary and Bladder Recognition AI Models,"S Takenaka, H Matsuzaki, R Koike, Y Hirose, ... H Tanabe",Page S1,https://doi.org/10.1016/j.jmig.2023.08.007,https://www.sciencedirect.com/science/article/pii/S1553465023003357,https://www.sciencedirect.com/science/article/pii/S1553465023003357/pdfft?md5=4ba1a84eff1433b3c0b14a44ac90d0a4&pid=1-s2.0-S1553465023003357-main.pdf,AAGL2023_001,NA,NA,NA,NA,NA,NA,NA,"Study ObjectiveWe developed an AI model for intraoperative recognition of ureter and bladder using 13934 and 4940 images respectively, from 409 and 220 hysterectomy cases across 41 and 38 surgical facilities. The study aimed to evaluate the model's impact on physicians' organ recognition ability.DesignThis is a retrospective cohort study.SettingOne hundred and fifty videos with and without the ureter and bladder were prepared, respectively. Factors affecting recognition performance, such as Douglas fossa adhesion, giant myoma, and history of cesarean section, were included in real clinical proportions.Patients or ParticipantsCohorts were created with 4 Certified surgeons (group A), Attendings (group B), Fellows with ≧10 hysterectomy cases of experience (group C), and Fellows with <10 hysterectomy cases of experience (group D), respectively.InterventionsFirst, they were tested to guess the presence or absence of ureter and bladder and the location of those organs in the videos without AI-support. Next, the same test was conducted using both videos without AI-support and with AI-support superimposed on the model inference results.Measurements and Main ResultsWe tested if AI-support improves physician's organ recognition accuracy and if surgical skill and experience affect results. Results for all physicians with/without AI-support: ureter sensitivity 45.3% and 58.1%(p<0.01), bladder sensitivity 54.2% and 70.0%(p<0.01); ureter specificity 86.1% and 89.8%, bladder specificity 91.6% and 92.0%. AI-support improved sensitivity without compromising specificity. Sensitivity improvement (%) in groups A, B, C, D for ureter: 3.5, 15.9, 11.8, 27.3; for bladder: 8.9, 10.6, 16.8, 26.8. AI had positive effects on all groups, especially those with lower skills/experience. Group D with AI support achieved equal/better results than Group A without AI, implying AI helped D attain A-level organ recognition ability.ConclusionAI improved physician's organ recognition, especially for less skilled and experienced physicians. We plan to obtain regulatory clearance as a medical device using these results by the end of this fiscal year.",sciencedirect,2026-04-13T21:17:16.841Z,performance evaluation of urinary and bladder recognition ai models,4,S Takenaka,Y Hirose,takenaka S,hirose Y,"Study ObjectiveWe developed an AI model for intraoperative recognition of ureter and bladder using 13934 and 4940 images respectively, from 409 and 220 hysterectomy cases across 41 and 38 surgical facilities. The study aimed to evaluate the model's impact on physicians' organ recognition ability.DesignThis is a retrospective cohort study.SettingOne hundred and fifty videos with and without the ureter and bladder were prepared, respectively. Factors affecting recognition performance, such as Douglas fossa adhesion, giant myoma, and history of cesarean section, were included in real clinical proportions.Patients or ParticipantsCohorts were created with 4 Certified surgeons (group A), Attendings (group B), Fellows with ≧10 hysterectomy cases of experience (group C), and Fellows with <10 hysterectomy cases of experience (group D), respectively.InterventionsFirst, they were tested to guess the presence or absence of ureter and bladder and the location of those organs in the videos without AI-support. Next, the same test was conducted using both videos without AI-support and with AI-support superimposed on the model inference results.Measurements and Main ResultsWe tested if AI-support improves physician's organ recognition accuracy and if surgical skill and experience affect results. Results for all physicians with/without AI-support: ureter sensitivity 45.3% and 58.1%(p<0.01), bladder sensitivity 54.2% and 70.0%(p<0.01); ureter specificity 86.1% and 89.8%, bladder specificity 91.6% and 92.0%. AI-support improved sensitivity without compromising specificity. Sensitivity improvement (%) in groups A, B, C, D for ureter: 3.5, 15.9, 11.8, 27.3; for bladder: 8.9, 10.6, 16.8, 26.8. AI had positive effects on all groups, especially those with lower skills/experience. Group D with AI support achieved equal/better results than Group A without AI, implying AI helped D attain A-level organ recognition ability.ConclusionAI improved physician's organ recognition, especially for less skilled and experienced physicians. We plan to obtain regulatory clearance as a medical device using these results by the end of this fiscal year.",NA,FALSE,13934,FALSE,TRUE,040b96c6cd97ec244074361040075214,support; bladder; recognition; ureter; without; experience; organ; sensitivity; cases; hysterectomy,takenaka S; matsuzaki H; koike R; hirose Y
Conference abstract,Impact of Telehealth at an Academic Fibroid Center during the COVID-19 Pandemic,"J Hayden, M Milla, J Zhang, D Atashroo, DA Lum",Page S1,https://doi.org/10.1016/j.jmig.2023.08.008,https://www.sciencedirect.com/science/article/pii/S1553465023003369,https://www.sciencedirect.com/science/article/pii/S1553465023003369/pdfft?md5=4e4cebccaf673d7a1b8439ce726a4399&pid=1-s2.0-S1553465023003369-main.pdf,AAGL2023_002,NA,NA,NA,NA,NA,NA,NA,"Study ObjectiveTo study the impact of incorporating telehealth visits into a fibroid center during the COVID-19 pandemic on surgical volume and patient demographics.DesignRetrospective observational study.SettingTertiary academic fibroid center in California.Patients or Participants588 consecutive patients seen from March 2019 through May 2021.InterventionsWe identified all new consecutive patients seen at an academic fibroid center in the year preceding the March 2020 COVID-19 lockdown and during the year following the center reopening in May 2020. We included patient demographics such as race, ethnicity, geographic location, presenting symptoms and insurance type. We included procedure performed (if any) including subcategorization into major and minor surgery. This data was analyzed utilizing an interrupted time series analysis using Poisson regression. The distribution of residual and autocorrelation was checked graphically.Measurements and Main Results588 patients were identified during the study periods: 222 patients pre-COVID-19 lockdown and 366 patients post-COVID-19 lockdown. We observed a switch from 100% in-person visits pre-lockdown to 91% Telehealth visits post-lockdown. Patient demographics were unchanged but the number of patients seen per month post-lockdown was significantly higher (P<0.01). The implementation of Telehealth corresponded with a sustained 9% increase in the total number of procedures per month (p=0.03 IRR = 1.09 CI: 1.02-1.15). There was also a sustained increase in the total number of major procedures by 12% per month post-lockdown (p=0.04 IRR = 1.12 CI:1.00-1.14).ConclusionOur findings support the use of Telehealth as an effective and inclusive means of providing patient care in a surgical subspecialty. Despite the ongoing pandemic, the implementation of Telehealth corresponded with a increase in the number of patients seen per month as well as the number of total procedures and major surgeries. Patient demographics did not change, signifying that patient access to clinical care through Telehealth was not impacted.",sciencedirect,2026-04-13T21:17:16.841Z,impact of telehealth at an academic fibroid center during the covid 19 pandemic,5,J Hayden,DA Lum,hayden J,lum D,"Study ObjectiveTo study the impact of incorporating telehealth visits into a fibroid center during the COVID-19 pandemic on surgical volume and patient demographics.DesignRetrospective observational study.SettingTertiary academic fibroid center in California.Patients or Participants588 consecutive patients seen from March 2019 through May 2021.InterventionsWe identified all new consecutive patients seen at an academic fibroid center in the year preceding the March 2020 COVID-19 lockdown and during the year following the center reopening in May 2020. We included patient demographics such as race, ethnicity, geographic location, presenting symptoms and insurance type. We included procedure performed (if any) including subcategorization into major and minor surgery. This data was analyzed utilizing an interrupted time series analysis using Poisson regression. The distribution of residual and autocorrelation was checked graphically.Measurements and Main Results588 patients were identified during the study periods: 222 patients pre-COVID-19 lockdown and 366 patients post-COVID-19 lockdown. We observed a switch from 100% in-person visits pre-lockdown to 91% Telehealth visits post-lockdown. Patient demographics were unchanged but the number of patients seen per month post-lockdown was significantly higher (P<0.01). The implementation of Telehealth corresponded with a sustained 9% increase in the total number of procedures per month (p=0.03 IRR = 1.09 CI: 1.02-1.15). There was also a sustained increase in the total number of major procedures by 12% per month post-lockdown (p=0.04 IRR = 1.12 CI:1.00-1.14).ConclusionOur findings support the use of Telehealth as an effective and inclusive means of providing patient care in a surgical subspecialty. Despite the ongoing pandemic, the implementation of Telehealth corresponded with a increase in the number of patients seen per month as well as the number of total procedures and major surgeries. Patient demographics did not change, signifying that patient access to clinical care through Telehealth was not impacted.",NA,FALSE,2021,TRUE,TRUE,07622a220dd2993321bc9b65b17f3817,lockdown; patient; telehealth; number; center; covid; demographics; month; per; post,hayden J; milla M; zhang J; atashroo D; lum D
Conference abstract,Calculating the Burden of Time Outside the Body in Endoscopic Surgery Using a Novel Computer-Vision-Based Surgical Intelligence Platform,"I Levin, Ferman J Rapoport, O Bar, A Cohen, ... T Wolf",Page S2,https://doi.org/10.1016/j.jmig.2023.08.009,https://www.sciencedirect.com/science/article/pii/S1553465023003370,https://www.sciencedirect.com/science/article/pii/S1553465023003370/pdfft?md5=8d1a0bacdad730c50198506c4808488f&pid=1-s2.0-S1553465023003370-main.pdf,AAGL2023_003,NA,NA,NA,NA,NA,NA,NA,"Study ObjectiveTo measure the burden of Out-of-Body events during Gynecological endoscopic procedures using a novel computer-vision-based Surgical Intelligence Platform.DesignProspective and retrospective AI analysis of videos from laparoscopic procedures.SettingDepartment of Gynecology in a Tertiary Hospital.Patients or ParticipantsSurgical videos from all laparoscopic surgical procedures performed throughout 2022 were included.InterventionsVideos were analyzed using a Surgical Intelligence Platform that automatically detects OOB events using AI-based models. We measured the total time for all endoscopic procedures as well as time measurements for all OOB events.Measurements and Main Results660 videos were analyzed. The total time for all endoscopic procedures carried out was 505.59 hours, of which 40.73 hours were OOB events (8.06%). Interestingly, more complex procedures such as laparoscopic hysterectomy and laparoscopic myomectomy (average duration 96.51±36.93 and 78.81±46.29 minutes, respectively) had lower proportions of OOB events (4.17% and 6.07%, respectively), whereas lower difficulty procedures (BSO, Lap Salpingectomy) had higher proportions of OOB events (16.35% and 10.19%, respectively).ConclusionAn AI-based surgical analysis tool was used to assess the occurrence and burden of OOB events in our endoscopic procedures during 2022. This analysis demonstrated that OOB events were common and time-consuming. We were able to demonstrate that a significant portion of time in endoscopic procedures is spent outside the patient's cavity. The fraction of OOB events was higher in low-complexity procedures and lower in advanced procedures, probably due to the fact that skilled surgeons are more experienced in dealing with vision-obscuring surgical events.The substantial amount of time spent OOB during procedures not only poses a risk for patients but is also significantly time-consuming in the operating room and carries important OR efficiency and financial implications for healthcare organizations. Surfacing such information should lead to data-driven innovative approaches aimed at ensuring that patients are not at risk, momentum is not lost, and efficiency is maintained during minimally invasive surgery.",sciencedirect,2026-04-13T21:17:16.841Z,calculating the burden of time outside the body in endoscopic surgery using a novel computer vision based surgical intelligence platform,4,I Levin,A Cohen,levin I,cohen A,"Study ObjectiveTo measure the burden of Out-of-Body events during Gynecological endoscopic procedures using a novel computer-vision-based Surgical Intelligence Platform.DesignProspective and retrospective AI analysis of videos from laparoscopic procedures.SettingDepartment of Gynecology in a Tertiary Hospital.Patients or ParticipantsSurgical videos from all laparoscopic surgical procedures performed throughout 2022 were included.InterventionsVideos were analyzed using a Surgical Intelligence Platform that automatically detects OOB events using AI-based models. We measured the total time for all endoscopic procedures as well as time measurements for all OOB events.Measurements and Main Results660 videos were analyzed. The total time for all endoscopic procedures carried out was 505.59 hours, of which 40.73 hours were OOB events (8.06%). Interestingly, more complex procedures such as laparoscopic hysterectomy and laparoscopic myomectomy (average duration 96.51±36.93 and 78.81±46.29 minutes, respectively) had lower proportions of OOB events (4.17% and 6.07%, respectively), whereas lower difficulty procedures (BSO, Lap Salpingectomy) had higher proportions of OOB events (16.35% and 10.19%, respectively).ConclusionAn AI-based surgical analysis tool was used to assess the occurrence and burden of OOB events in our endoscopic procedures during 2022. This analysis demonstrated that OOB events were common and time-consuming. We were able to demonstrate that a significant portion of time in endoscopic procedures is spent outside the patient's cavity. The fraction of OOB events was higher in low-complexity procedures and lower in advanced procedures, probably due to the fact that skilled surgeons are more experienced in dealing with vision-obscuring surgical events.The substantial amount of time spent OOB during procedures not only poses a risk for patients but is also significantly time-consuming in the operating room and carries important OR efficiency and financial implications for healthcare organizations. Surfacing such information should lead to data-driven innovative approaches aimed at ensuring that patients are not at risk, momentum is not lost, and efficiency is maintained during minimally invasive surgery.",NA,FALSE,2022,FALSE,TRUE,91b0296d27d4800f6aa6e9d90b43f557,procedures; events; oob; time; endoscopic; surgical; laparoscopic; based; lower; videos,levin I; rapoport F; bar O; cohen A
Conference abstract,Impact of Training Level of the First Surgical Assistant on Quality Metrics for Hysterectomy: A Retrospective Review,"G Zhou, A Murji, K Brandon-Sutherland, E Randle, ... L Luketic",Pages S2-S3,https://doi.org/10.1016/j.jmig.2023.08.010,https://www.sciencedirect.com/science/article/pii/S1553465023003382,https://www.sciencedirect.com/science/article/pii/S1553465023003382/pdfft?md5=7e0f9fb6eefc8fafe8c27678dddef5b8&pid=1-s2.0-S1553465023003382-main.pdf,AAGL2023_004,NA,NA,NA,NA,NA,NA,NA,"Study ObjectiveEvaluate impact of the first-assist level of training on surgical quality outcomes for hysterectomies performed by general gynaecologists.DesignMulti-center retrospective review.Setting7 Ontario, Canada hospitals (4 academic, 3 community).Patients or ParticipantsPatients undergoing elective hysterectomy from July 2016-December 2020. Cases with pregnancy-related indications and those involving surgical fellows or fellowship-trained surgeons were excluded.InterventionsPrimary exposure was first-assist training level (postgraduate year (PGY) 1-5 or generalist). Primary outcome was median operative time (ORT)(minutes). Secondary outcomes were estimated blood loss (EBL), Clavien-Dindo grade ≥2 complications, and emergency visits and readmission, both within 30 days of surgery.Measurements and Main ResultsPatient, case and primary surgeon characteristics were described, and bivariate comparisons of outcomes based on first-assist training level were conducted. Logistic regression analysis was completed, and adjusted odds ratio (aOR) were reported. A total of 866 hysterectomies were performed with generalists and trainees assisting at 664 and 202 cases, respectively. There was no statistical difference in ORT between trainee- and staff-assisted cases (130[95-156] versus 99[73-139], p=0.14) after adjusting for confounders (hysterectomy route, uterine weight, additional procedures, surgeon volume, age, ASA, concomitant endometriosis/adhesions). Surgeries with trainees as first-assists had more ≥grade 2 complications (aOR 2.15, 95% CI 1.12-4.12, p=0.02) and hospital readmissions (aOR 2.91, 95% CI 1.18-7.16, p=0.02). Hysterectomies assisted by senior residents (PGY 3-5 and 4-5) had increased EBL (regression coefficient 42, 95% CI 0-83, p=0.05 and 43, 95% CI 2-84, p=0.04, respectively).ConclusionHysterectomies assisted by residents were associated with increased complications and hospital readmissions, despite a similar surgical time, when compared to procedures with staff assistants.",sciencedirect,2026-04-13T21:17:16.841Z,impact of training level of the first surgical assistant on quality metrics for hysterectomy a retrospective review,4,G Zhou,E Randle,zhou G,randle E,"Study ObjectiveEvaluate impact of the first-assist level of training on surgical quality outcomes for hysterectomies performed by general gynaecologists.DesignMulti-center retrospective review.Setting7 Ontario, Canada hospitals (4 academic, 3 community).Patients or ParticipantsPatients undergoing elective hysterectomy from July 2016-December 2020. Cases with pregnancy-related indications and those involving surgical fellows or fellowship-trained surgeons were excluded.InterventionsPrimary exposure was first-assist training level (postgraduate year (PGY) 1-5 or generalist). Primary outcome was median operative time (ORT)(minutes). Secondary outcomes were estimated blood loss (EBL), Clavien-Dindo grade ≥2 complications, and emergency visits and readmission, both within 30 days of surgery.Measurements and Main ResultsPatient, case and primary surgeon characteristics were described, and bivariate comparisons of outcomes based on first-assist training level were conducted. Logistic regression analysis was completed, and adjusted odds ratio (aOR) were reported. A total of 866 hysterectomies were performed with generalists and trainees assisting at 664 and 202 cases, respectively. There was no statistical difference in ORT between trainee- and staff-assisted cases (130[95-156] versus 99[73-139], p=0.14) after adjusting for confounders (hysterectomy route, uterine weight, additional procedures, surgeon volume, age, ASA, concomitant endometriosis/adhesions). Surgeries with trainees as first-assists had more ≥grade 2 complications (aOR 2.15, 95% CI 1.12-4.12, p=0.02) and hospital readmissions (aOR 2.91, 95% CI 1.18-7.16, p=0.02). Hysterectomies assisted by senior residents (PGY 3-5 and 4-5) had increased EBL (regression coefficient 42, 95% CI 0-83, p=0.05 and 43, 95% CI 2-84, p=0.04, respectively).ConclusionHysterectomies assisted by residents were associated with increased complications and hospital readmissions, despite a similar surgical time, when compared to procedures with staff assistants.",NA,FALSE,866,TRUE,TRUE,7939e9ad915d5fa1ec39b7e9f05288c2,first; aor; assist; assisted; cases; complications; hysterectomies; level; outcomes; surgical,zhou G; murji A; brandon-sutherland K; randle E
