subtype,title,authors_raw,page_range,doi,article_url,pdf_url,abstract_id,abstract_objective,abstract_design,abstract_setting,abstract_patients_participants,abstract_intervention,abstract_measurements,abstract_conclusion,abstract_full_text,source,parse_timestamp,title_normalized,author_count,author_name_first,author_name_last,first_author_normalized,last_author_normalized,abstract_text,affiliation_raw,is_rct,sample_size,is_academic,is_us_based,abstract_hash,keywords_str,all_authors_str
Conference abstract,"Social Determinants and Hysterectomy Rates, Approaches, and Outcomes: A Systematic Review","P Chang, S Sedra, J Kinahan, AL Le, ... I Chen",Page S3,https://doi.org/10.1016/j.jmig.2023.08.011,https://www.sciencedirect.com/science/article/pii/S1553465023003394,https://www.sciencedirect.com/science/article/pii/S1553465023003394/pdfft?md5=797a2bad0e328655cd26d89d146c033f&pid=1-s2.0-S1553465023003394-main.pdf,AAGL2023_005,NA,NA,NA,NA,NA,NA,NA,"Study ObjectiveTo determine the association between socioeconomic and sociodemographic factors on hysterectomy rates, approach and complications.DesignSystematic review and meta-analysis.SettingN/A.Patients or ParticipantsFollowing registration in PROSPERO, 103 studies describing patients undergoing hysterectomy and socioeconomic and sociodemographic factors were identified using electronic databases. Embase, Medline, and Cochrane Library were searched for studies published between 2010-2020 that described the association between education, income, rurality, insurance status, occupation, and marital status on hysterectomy rates, approaches (eg. abdominal vs. laparoscopic vs. vaginal), and complication rates. Article selection and data extraction was conducted by two independent reviewers, and the Newcastle-Ottawa Scale used to assess quality.InterventionsN/A.Measurements and Main ResultsOur electronic search identified 4990 studies. Following title, abstract, and full text screening, a total of 103 studies were included. Studies were conducted in North America (n=83), Asia (n=12), Europe (n=9), and Africa (n=1). Studies were retrospective and observational in nature, and variable in quality. Higher hysterectomy rates were associated with lower education status (Odds Ratio 2.06[2.02-2.10], n=4), rurality (OR 1.11[1.10-1.13], n=7), higher income (OR 1.11[1.08-1.13], n=7), and insured status (OR 2.00[1.90-2.12], n=2), while not associated with marital status (OR 1.04[0.99-1.09], n=2). Non-working status was associated with lower hysterectomy rates (OR 0.47[0.45-0.49], n=2). Lower minimally invasive hysterectomy (MIS) rates were associated with rurality (OR 0.76[0.73-0.78], n=5). Those with private insurance and higher income were more likely to undergo MIS hysterectomy (OR 1.15[1.14-1.17], n=13 and OR 1.36[1.34-1.37], n=12, respectively). Several studies reported on the relationship between surgical complications and various social determinants of health however pooled analysis was not possible due to varying methodologies used.ConclusionGynecologic surgical care appears to be associated with social determinants of health. As different determinants of health appear to exert different pressures, the effect of each social determinant needs to be considered separately.",sciencedirect,2026-04-13T21:17:16.841Z,social determinants and hysterectomy rates approaches and outcomes a systematic review,4,P Chang,AL Le,chang P,le A,"Study ObjectiveTo determine the association between socioeconomic and sociodemographic factors on hysterectomy rates, approach and complications.DesignSystematic review and meta-analysis.SettingN/A.Patients or ParticipantsFollowing registration in PROSPERO, 103 studies describing patients undergoing hysterectomy and socioeconomic and sociodemographic factors were identified using electronic databases. Embase, Medline, and Cochrane Library were searched for studies published between 2010-2020 that described the association between education, income, rurality, insurance status, occupation, and marital status on hysterectomy rates, approaches (eg. abdominal vs. laparoscopic vs. vaginal), and complication rates. Article selection and data extraction was conducted by two independent reviewers, and the Newcastle-Ottawa Scale used to assess quality.InterventionsN/A.Measurements and Main ResultsOur electronic search identified 4990 studies. Following title, abstract, and full text screening, a total of 103 studies were included. Studies were conducted in North America (n=83), Asia (n=12), Europe (n=9), and Africa (n=1). Studies were retrospective and observational in nature, and variable in quality. Higher hysterectomy rates were associated with lower education status (Odds Ratio 2.06[2.02-2.10], n=4), rurality (OR 1.11[1.10-1.13], n=7), higher income (OR 1.11[1.08-1.13], n=7), and insured status (OR 2.00[1.90-2.12], n=2), while not associated with marital status (OR 1.04[0.99-1.09], n=2). Non-working status was associated with lower hysterectomy rates (OR 0.47[0.45-0.49], n=2). Lower minimally invasive hysterectomy (MIS) rates were associated with rurality (OR 0.76[0.73-0.78], n=5). Those with private insurance and higher income were more likely to undergo MIS hysterectomy (OR 1.15[1.14-1.17], n=13 and OR 1.36[1.34-1.37], n=12, respectively). Several studies reported on the relationship between surgical complications and various social determinants of health however pooled analysis was not possible due to varying methodologies used.ConclusionGynecologic surgical care appears to be associated with social determinants of health. As different determinants of health appear to exert different pressures, the effect of each social determinant needs to be considered separately.",NA,FALSE,103,FALSE,TRUE,4f6f7901ee535a6e307ce2bea4a5af2c,hysterectomy; studies; rates; status; determinants; health; higher; income; lower; rurality,chang P; sedra S; kinahan J; le A
Conference abstract,Surgical Subspeciality Training Improves Surgical Outcomes in Benign Minimally Invasive Hysterectomy Even Among High-Volume Surgeons,"CK Pfeuti, G Makai",Pages S3-S4,https://doi.org/10.1016/j.jmig.2023.08.012,https://www.sciencedirect.com/science/article/pii/S1553465023003400,https://www.sciencedirect.com/science/article/pii/S1553465023003400/pdfft?md5=c936797eeab1ca325a8445fecd61d881&pid=1-s2.0-S1553465023003400-main.pdf,AAGL2023_006,NA,NA,NA,NA,NA,NA,NA,"Study ObjectiveTo evaluate the impact of gynecologic subspecialty training on surgical outcomes in benign minimally invasive hysterectomy (MIH) while accounting for surgeon volume.DesignRetrospective cohort study of patients who underwent a MIH between 2014-2017.SettingSingle community hospital system.Patients or ParticipantsPatients were identified via CPT codes for vaginal, laparoscopic, or robotic hysterectomy. Exclusion criteria included a gynecologic cancer diagnosis or concomitant major procedure during hysterectomy. 1631 patients underwent a MIH for benign indications by either gynecologic generalists or subspecialists in MIGS, FMRPS, or gynecologic oncology. 125 hysterectomies were vaginal, 539 were conventional laparoscopic, and 967 were robotically assisted.InterventionsN/A.Measurements and Main ResultsSurgical outcomes, including intraoperative visceral injuries, transfusions, EBL over 500 mL, and conversions, were compared between generalists and subspecialists and between low-volume and high-volume surgeons (defined as 12 or more hysterectomies annually). 47.6% of MIH were performed by subspecialists and 52.4% were performed by generalists (37.9% by high-volume generalists and 14.5% by low-volume generalists). Compared to generalists, subspecialists had a lower incidence of visceral injuries (0.5% vs 2.8%, p <0.001), transfusions (0.1% vs 2.1%, p <0.001), EBL over 500 mL (2.3% vs 7.4%, p <0.001), and conversions (2.5% vs 6.6%, p <0.001). Compared to low-volume surgeons, high volume surgeons had significantly lower incidence of each of these outcomes as well. The odds of a visceral injury or conversion in MIH performed by a generalist was 3.03 (1.89-5.00) times higher than for subspecialists. High-volume generalists were 5.26 (1.69-16.67) times more likely to have a visceral injury and 2.38 (1.35-4.17) times more likely to convert to an open procedure compared to high-volume subspecialists.ConclusionBoth subspecialty training and high surgeon volume are associated with a lower risk of surgical complications in benign MIH. Subspecialty training is associated with a greater reduction in surgical complications even among high-volume surgeons.",sciencedirect,2026-04-13T21:17:16.841Z,surgical subspeciality training improves surgical outcomes in benign minimally invasive hysterectomy even among high volume surgeons,2,CK Pfeuti,G Makai,pfeuti C,makai G,"Study ObjectiveTo evaluate the impact of gynecologic subspecialty training on surgical outcomes in benign minimally invasive hysterectomy (MIH) while accounting for surgeon volume.DesignRetrospective cohort study of patients who underwent a MIH between 2014-2017.SettingSingle community hospital system.Patients or ParticipantsPatients were identified via CPT codes for vaginal, laparoscopic, or robotic hysterectomy. Exclusion criteria included a gynecologic cancer diagnosis or concomitant major procedure during hysterectomy. 1631 patients underwent a MIH for benign indications by either gynecologic generalists or subspecialists in MIGS, FMRPS, or gynecologic oncology. 125 hysterectomies were vaginal, 539 were conventional laparoscopic, and 967 were robotically assisted.InterventionsN/A.Measurements and Main ResultsSurgical outcomes, including intraoperative visceral injuries, transfusions, EBL over 500 mL, and conversions, were compared between generalists and subspecialists and between low-volume and high-volume surgeons (defined as 12 or more hysterectomies annually). 47.6% of MIH were performed by subspecialists and 52.4% were performed by generalists (37.9% by high-volume generalists and 14.5% by low-volume generalists). Compared to generalists, subspecialists had a lower incidence of visceral injuries (0.5% vs 2.8%, p <0.001), transfusions (0.1% vs 2.1%, p <0.001), EBL over 500 mL (2.3% vs 7.4%, p <0.001), and conversions (2.5% vs 6.6%, p <0.001). Compared to low-volume surgeons, high volume surgeons had significantly lower incidence of each of these outcomes as well. The odds of a visceral injury or conversion in MIH performed by a generalist was 3.03 (1.89-5.00) times higher than for subspecialists. High-volume generalists were 5.26 (1.69-16.67) times more likely to have a visceral injury and 2.38 (1.35-4.17) times more likely to convert to an open procedure compared to high-volume subspecialists.ConclusionBoth subspecialty training and high surgeon volume are associated with a lower risk of surgical complications in benign MIH. Subspecialty training is associated with a greater reduction in surgical complications even among high-volume surgeons.",NA,FALSE,2017,FALSE,TRUE,d8c0888dada60902b1d6a1e344c38cf6,volume; generalists; high; mih; subspecialists; 001; gynecologic; surgeons; visceral; benign,pfeuti C; makai G
Conference abstract,Language-Based Disparities in Surgical Route of Hysterectomy for Benign Disease,"Peña TI González, NJ Jesse, Z Zhao, LF Harvey, O Fajardo",Page S4,https://doi.org/10.1016/j.jmig.2023.08.013,https://www.sciencedirect.com/science/article/pii/S1553465023003412,https://www.sciencedirect.com/science/article/pii/S1553465023003412/pdfft?md5=d350b21815171f6f4142e99b32021307&pid=1-s2.0-S1553465023003412-main.pdf,AAGL2023_007,NA,NA,NA,NA,NA,NA,NA,"Study ObjectiveTo assess the association between patient-preferred language and surgical route of hysterectomy.DesignA retrospective cohort study using the Healthcare Cost and Utilization Project's State Inpatient Database (SID) and State Ambulatory Surgery and Services Database (SASD).SettingAll inpatient and outpatient hysterectomies from the most recent year of available data (ranging from 2019 - 2020) from the six states that record patient-preferred language in the SID and SASD: Indiana, Iowa, Maryland, Michigan, Minnesota, and New Jersey.Patients or ParticipantsWomen aged 18 and over undergoing an inpatient or ambulatory hysterectomy of any type for benign indication.InterventionsMinimally invasive hysterectomy (laparoscopic, vaginal, and laparoscopic-assisted approach).Measurements and Main ResultsWe conducted logistic regression analyses to evaluate the association between patient preferred language and route of hysterectomy (abdominal vs. minimally invasive). 47,447 patients were included in the analysis. The majority of patients were non-Hispanic White (77%), with a median age of 46 years (IQR 40.0, 53.0). 94% of patients identified English as their preferred language. 6% preferred a non-English language, including 3% of patients who preferred Spanish. Individuals who preferred a non-English language were significantly less likely to undergo minimally invasive hysterectomy compared to individuals who preferred English (OR 0.54, 95% CI 0.49-0.59, p<0.001). This association remained significant following adjustments for demographic factors and social determinants of health including age, race, insurance, and state (OR 0.79, 95% CI 0.67-0.94, p=0.006).ConclusionPatients who are non-English speaking are significantly less likely to receive a minimally invasive hysterectomy. As prior research has demonstrated, minimally invasive hysterectomy results in improved surgical outcomes. Gynecologic surgeons need to address language disparities in addition to other socioeconomic factors such as race to optimize surgical outcomes for our patient population.",sciencedirect,2026-04-13T21:17:16.841Z,language based disparities in surgical route of hysterectomy for benign disease,5,Peña TI González,O Fajardo,gonzalez P,fajardo O,"Study ObjectiveTo assess the association between patient-preferred language and surgical route of hysterectomy.DesignA retrospective cohort study using the Healthcare Cost and Utilization Project's State Inpatient Database (SID) and State Ambulatory Surgery and Services Database (SASD).SettingAll inpatient and outpatient hysterectomies from the most recent year of available data (ranging from 2019 - 2020) from the six states that record patient-preferred language in the SID and SASD: Indiana, Iowa, Maryland, Michigan, Minnesota, and New Jersey.Patients or ParticipantsWomen aged 18 and over undergoing an inpatient or ambulatory hysterectomy of any type for benign indication.InterventionsMinimally invasive hysterectomy (laparoscopic, vaginal, and laparoscopic-assisted approach).Measurements and Main ResultsWe conducted logistic regression analyses to evaluate the association between patient preferred language and route of hysterectomy (abdominal vs. minimally invasive). 47,447 patients were included in the analysis. The majority of patients were non-Hispanic White (77%), with a median age of 46 years (IQR 40.0, 53.0). 94% of patients identified English as their preferred language. 6% preferred a non-English language, including 3% of patients who preferred Spanish. Individuals who preferred a non-English language were significantly less likely to undergo minimally invasive hysterectomy compared to individuals who preferred English (OR 0.54, 95% CI 0.49-0.59, p<0.001). This association remained significant following adjustments for demographic factors and social determinants of health including age, race, insurance, and state (OR 0.79, 95% CI 0.67-0.94, p=0.006).ConclusionPatients who are non-English speaking are significantly less likely to receive a minimally invasive hysterectomy. As prior research has demonstrated, minimally invasive hysterectomy results in improved surgical outcomes. Gynecologic surgeons need to address language disparities in addition to other socioeconomic factors such as race to optimize surgical outcomes for our patient population.",NA,FALSE,2020,FALSE,TRUE,b0bdf82b80ac767e0130fe79d79727c8,preferred; hysterectomy; language; english; invasive; minimally; non; patient; association; inpatient,gonzalez P; jesse N; zhao Z; harvey L; fajardo O
Conference abstract,Pelvic Floor and Sexual Function 3 Years after Hysterectomy-a Prospective Cohort Study,"U Johannesson, M Amato, C Forsgren",Page S4,https://doi.org/10.1016/j.jmig.2023.08.014,https://www.sciencedirect.com/science/article/pii/S1553465023003424,https://www.sciencedirect.com/science/article/pii/S1553465023003424/pdfft?md5=299e1bee461648fa351660e855caa2f3&pid=1-s2.0-S1553465023003424-main.pdf,AAGL2023_008,NA,NA,NA,NA,NA,NA,NA,"Study ObjectiveTo investigate the long-term effects of hysterectomy on benign indication on pelvic floor function and sexual function.DesignProspective clinical cohort study, 3-year follow-up.SettingIn an academic affiliated district general hospital.Patients or Participants260 patients undergoing hysterectomy on benign indication between 2016 and 2018.InterventionsA comparison of robotic assisted total laparoscopic hysterectomy with traditional techniques of surgery regarding pelvic floor function and sexual function.Measurements and Main ResultsAll women going through hysterectomy filled in validated questionnaires (Pelvic Floor Impact Questionnaire (PFIQ-7), Pelvic Floor Distress Inventory (PFDI-20), Female Sexual Function Index (FSFI)) on pelvic organ and sexual function before surgery, at six months, 1 and 3 years after surgery. Data were analyzed using nonparametric statistics and mixed effect models. The response rate at the 3-year follow-up was 154/242 (63.6%) for all questionnaires. There was an improvement of pelvic floor function at 3 years with a mean score of PFIQ-7 22.7 (49.4 SD, p<0.001) and mean score of PFDI-20 56.2 (54.6 SD, p=0.001). A deterioration of sexual function was seen among the sexually active women after 3 years with a mean score of FSFI of 21.6(10.1 SD, p<0.001) compared to baseline 25.2 (SD 6.6), not consistent with the unaltered sexual function for the whole cohort. No difference in pelvic floor or sexual function was detected when comparing robotic assisted laparoscopic hysterectomy (RTLH), laparoscopic hysterectomy (TLH) and abdominal hysterectomy (TAH).ConclusionThree years after surgery robotic-assisted total laparoscopic hysterectomy, total laparoscopic hysterectomy and total abdominal hysterectomy improve pelvic floor function to the same extent. An overall improvement of sexual function six months after hysterectomy, was not persistent after three years and among the sexually active women there was a decrease in FSFI scores. Correlations between pelvic floor function and sexual function after hysterectomy will be discussed.",sciencedirect,2026-04-13T21:17:16.841Z,pelvic floor and sexual function 3 years after hysterectomy a prospective cohort study,3,U Johannesson,C Forsgren,johannesson U,forsgren C,"Study ObjectiveTo investigate the long-term effects of hysterectomy on benign indication on pelvic floor function and sexual function.DesignProspective clinical cohort study, 3-year follow-up.SettingIn an academic affiliated district general hospital.Patients or Participants260 patients undergoing hysterectomy on benign indication between 2016 and 2018.InterventionsA comparison of robotic assisted total laparoscopic hysterectomy with traditional techniques of surgery regarding pelvic floor function and sexual function.Measurements and Main ResultsAll women going through hysterectomy filled in validated questionnaires (Pelvic Floor Impact Questionnaire (PFIQ-7), Pelvic Floor Distress Inventory (PFDI-20), Female Sexual Function Index (FSFI)) on pelvic organ and sexual function before surgery, at six months, 1 and 3 years after surgery. Data were analyzed using nonparametric statistics and mixed effect models. The response rate at the 3-year follow-up was 154/242 (63.6%) for all questionnaires. There was an improvement of pelvic floor function at 3 years with a mean score of PFIQ-7 22.7 (49.4 SD, p<0.001) and mean score of PFDI-20 56.2 (54.6 SD, p=0.001). A deterioration of sexual function was seen among the sexually active women after 3 years with a mean score of FSFI of 21.6(10.1 SD, p<0.001) compared to baseline 25.2 (SD 6.6), not consistent with the unaltered sexual function for the whole cohort. No difference in pelvic floor or sexual function was detected when comparing robotic assisted laparoscopic hysterectomy (RTLH), laparoscopic hysterectomy (TLH) and abdominal hysterectomy (TAH).ConclusionThree years after surgery robotic-assisted total laparoscopic hysterectomy, total laparoscopic hysterectomy and total abdominal hysterectomy improve pelvic floor function to the same extent. An overall improvement of sexual function six months after hysterectomy, was not persistent after three years and among the sexually active women there was a decrease in FSFI scores. Correlations between pelvic floor function and sexual function after hysterectomy will be discussed.",NA,FALSE,2018,TRUE,TRUE,322422215dc55066ff6609e7f5982a66,function; hysterectomy; pelvic; sexual; floor; laparoscopic; years; surgery; 001; assisted,johannesson U; amato M; forsgren C
