subtype,title,authors_raw,page_range,doi,article_url,pdf_url,abstract_id,abstract_objective,abstract_design,abstract_setting,abstract_patients_participants,abstract_intervention,abstract_measurements,abstract_conclusion,abstract_full_text,source,parse_timestamp,title_normalized,author_count,author_name_first,author_name_last,first_author_normalized,last_author_normalized,abstract_text,affiliation_raw,is_rct,sample_size,is_academic,is_us_based,abstract_hash,keywords_str,all_authors_str
Conference abstract,Porcine Models for Rectal Shaving Training,"M Sarofim, A Kalantan, JA Robertson, G Cario, ... D Chou",Page S23,https://doi.org/10.1016/j.jmig.2023.08.065,https://www.sciencedirect.com/science/article/pii/S155346502300393X,https://www.sciencedirect.com/science/article/pii/S155346502300393X/pdfft?md5=3ef20dde73931088e5b725e32b20e09a&pid=1-s2.0-S155346502300393X-main.pdf,AAGL2023_053,NA,NA,NA,NA,NA,NA,NA,NA,sciencedirect,2026-04-13T21:17:16.841Z,porcine models for rectal shaving training,4,M Sarofim,G Cario,sarofim M,cario G,NA,NA,FALSE,NA,FALSE,FALSE,a254aedd0bb4f2dc5d5165e9f818cde1,,sarofim M; kalantan A; robertson J; cario G
Conference abstract,"""Be the Squeaky Wheel"" - a Call to Action to Create Change in Ergonomics; The Role of OSHA and Reporting","J Wong, E Carey, K Wright, C King, ... LP King",Page S24,https://doi.org/10.1016/j.jmig.2023.08.067,https://www.sciencedirect.com/science/article/pii/S1553465023003953,https://www.sciencedirect.com/science/article/pii/S1553465023003953/pdfft?md5=0574c8bc1363e91b51ae150560df6a41&pid=1-s2.0-S1553465023003953-main.pdf,AAGL2023_054,NA,NA,NA,NA,NA,NA,NA,NA,sciencedirect,2026-04-13T21:17:16.841Z,be the squeaky wheel a call to action to create change in ergonomics the role of osha and reporting,4,J Wong,C King,wong J,king C,NA,NA,FALSE,NA,FALSE,TRUE,8b755065561a36c8812fe848f0579373,,wong J; carey E; wright K; king C
Conference abstract,"Marwah's Confluence Point, Evaluating Safety of Insertion of Veress Needle Just below the Rib Cage at the Confluence of the 8th to 10th Ribs","V Marwah, S Kedia, R Chakravarty, K Gupta, K Tongaria",Page S24,https://doi.org/10.1016/j.jmig.2023.08.068,https://www.sciencedirect.com/science/article/pii/S1553465023003965,https://www.sciencedirect.com/science/article/pii/S1553465023003965/pdfft?md5=35ff0b2647d0a75d12082a6839292aed&pid=1-s2.0-S1553465023003965-main.pdf,AAGL2023_055,NA,NA,NA,NA,NA,NA,NA,NA,sciencedirect,2026-04-13T21:17:16.841Z,marwah s confluence point evaluating safety of insertion of veress needle just below the rib cage at the confluence of the 8th to 10th ribs,5,V Marwah,K Tongaria,marwah V,tongaria K,NA,NA,FALSE,10,FALSE,FALSE,f38a1c311591c8994936ddc363487fbc,,marwah V; kedia S; chakravarty R; gupta K; tongaria K
Conference abstract,Predictors of Interest in Surgical Management for Chronic Pelvic Pain,"KM Ciesielski, A Tilea, S As-Sanie, SR Till",Pages S24-S25,https://doi.org/10.1016/j.jmig.2023.08.069,https://www.sciencedirect.com/science/article/pii/S1553465023003977,https://www.sciencedirect.com/science/article/pii/S1553465023003977/pdfft?md5=1f43ec2344ebd238ae8ca0c0ae3b2eb1&pid=1-s2.0-S1553465023003977-main.pdf,AAGL2023_056,NA,NA,NA,NA,NA,NA,NA,NA,sciencedirect,2026-04-13T21:17:16.841Z,predictors of interest in surgical management for chronic pelvic pain,4,KM Ciesielski,SR Till,ciesielski K,till S,NA,NA,FALSE,NA,FALSE,TRUE,1e6ae304759de8a172c86b391ac753c4,,ciesielski K; tilea A; as-sanie S; till S
Conference abstract,Effect of US FDA and Health Canada Warnings on Power Morcellation on Laparoscopic Hysterectomy for Fibroids in Canada,"I Chen, R Douma, R Mallick, L Belland, ... T Tulandi",Page S25,https://doi.org/10.1016/j.jmig.2023.08.070,https://www.sciencedirect.com/science/article/pii/S1553465023003989,https://www.sciencedirect.com/science/article/pii/S1553465023003989/pdfft?md5=53ade9a7f3d0ae7d514e68371801c792&pid=1-s2.0-S1553465023003989-main.pdf,AAGL2023_057,NA,NA,NA,NA,NA,NA,NA,NA,sciencedirect,2026-04-13T21:17:16.841Z,effect of us fda and health canada warnings on power morcellation on laparoscopic hysterectomy for fibroids in canada,4,I Chen,L Belland,chen I,belland L,NA,NA,FALSE,NA,FALSE,TRUE,29fe5ccc9b213b168601235ba84672c7,,chen I; douma R; mallick R; belland L
Conference abstract,Effect of Video-Based Coaching on Gynecologic Resident Laparoscopic Salpingectomy: A Randomized Controlled Trial,"TM Muir, KA Kho, C Ramirez, NM Donnellan, ... L Chao",Page S25,https://doi.org/10.1016/j.jmig.2023.08.071,https://www.sciencedirect.com/science/article/pii/S1553465023003990,https://www.sciencedirect.com/science/article/pii/S1553465023003990/pdfft?md5=4393b5dc1a41af5009696f1a5ee74ff4&pid=1-s2.0-S1553465023003990-main.pdf,AAGL2023_058,NA,NA,NA,NA,NA,NA,NA,NA,sciencedirect,2026-04-13T21:17:16.841Z,effect of video based coaching on gynecologic resident laparoscopic salpingectomy a randomized controlled trial,4,TM Muir,NM Donnellan,muir T,donnellan N,NA,NA,TRUE,NA,FALSE,FALSE,2c5045b2de266ef6c3d9c884091ef381,,muir T; kho K; ramirez C; donnellan N
Conference abstract,Pre-Operative Tamsulosin before Minimally Invasive Hysterectomy and Time to Spontaneous Void: A Randomized Controlled Trial,"LD McCann, M Gabra, C Hall, J Shah, ... A Aguirre",Pages S25-S26,https://doi.org/10.1016/j.jmig.2023.08.072,https://www.sciencedirect.com/science/article/pii/S1553465023004004,https://www.sciencedirect.com/science/article/pii/S1553465023004004/pdfft?md5=60228012e614380886af8e5dcd93d6df&pid=1-s2.0-S1553465023004004-main.pdf,AAGL2023_059,NA,NA,NA,NA,NA,NA,NA,NA,sciencedirect,2026-04-13T21:17:16.841Z,pre operative tamsulosin before minimally invasive hysterectomy and time to spontaneous void a randomized controlled trial,4,LD McCann,J Shah,mccann L,shah J,NA,NA,TRUE,NA,FALSE,FALSE,d7e5fd3aa610626a29a562a9b0799a9c,,mccann L; gabra M; hall C; shah J
Conference abstract,Preoperative Pelvic Pain Syndromes Are a Risk Factor for Failure in Patients Undergoing Radiofrequency Endometrial Ablation,"K Rakes, JN Sosa-Stanley, JN Casey",Page S26,https://doi.org/10.1016/j.jmig.2023.08.073,https://www.sciencedirect.com/science/article/pii/S1553465023004016,https://www.sciencedirect.com/science/article/pii/S1553465023004016/pdfft?md5=e10f43a1844d9a956f81c2f5e6fc22e4&pid=1-s2.0-S1553465023004016-main.pdf,AAGL2023_060,NA,NA,NA,NA,NA,NA,NA,NA,sciencedirect,2026-04-13T21:17:16.841Z,preoperative pelvic pain syndromes are a risk factor for failure in patients undergoing radiofrequency endometrial ablation,3,K Rakes,JN Casey,rakes K,casey J,NA,NA,FALSE,NA,FALSE,TRUE,4842850bbb04ad313c8d7d73f2443c17,,rakes K; sosa-stanley J; casey J
Conference abstract,Essentials in Minimally Invasive Gynecologic Surgery (EMIGS) Skills Exam: Tips and Tricks,"C Pando, M Briggs, B Beran",Page S27,https://doi.org/10.1016/j.jmig.2023.08.075,https://www.sciencedirect.com/science/article/pii/S1553465023004065,https://www.sciencedirect.com/science/article/pii/S1553465023004065/pdfft?md5=cc21317e8e87b248222d0d1a3f1fea9c&pid=1-s2.0-S1553465023004065-main.pdf,AAGL2023_061,NA,NA,NA,NA,NA,NA,NA,NA,sciencedirect,2026-04-13T21:17:16.841Z,essentials in minimally invasive gynecologic surgery emigs skills exam tips and tricks,3,C Pando,B Beran,pando C,beran B,NA,NA,FALSE,NA,FALSE,TRUE,eb285f4cf91f0c25300648bba5310f62,,pando C; briggs M; beran B
Conference abstract,Laparoscopic Management of Spontaneous Heterotopic Pregnancy with Abdominal Implantation and Subsequent Full-Term Vaginal Delivery,"G Namazi, D Carusi, Y Groszmann",Page S27,https://doi.org/10.1016/j.jmig.2023.08.076,https://www.sciencedirect.com/science/article/pii/S1553465023004077,https://www.sciencedirect.com/science/article/pii/S1553465023004077/pdfft?md5=a0deb3c4a58495b35ed9a43b677c0b0a&pid=1-s2.0-S1553465023004077-main.pdf,AAGL2023_062,NA,NA,NA,NA,NA,NA,NA,NA,sciencedirect,2026-04-13T21:17:16.841Z,laparoscopic management of spontaneous heterotopic pregnancy with abdominal implantation and subsequent full term vaginal delivery,3,G Namazi,Y Groszmann,namazi G,groszmann Y,NA,NA,FALSE,NA,FALSE,FALSE,4cfe5755e1d4f4a614db4e5560ab8f08,,namazi G; carusi D; groszmann Y
Conference abstract,Surgical Management of Isolated Fallopian tube Torsion in the Pediatric Population,"T Gallant, C King, A Newark, J Clay",Pages S27-S28,https://doi.org/10.1016/j.jmig.2023.08.077,https://www.sciencedirect.com/science/article/pii/S1553465023004089,https://www.sciencedirect.com/science/article/pii/S1553465023004089/pdfft?md5=d8e76b60f4c94d6ad34a50e72fa3c488&pid=1-s2.0-S1553465023004089-main.pdf,AAGL2023_063,NA,NA,NA,NA,NA,NA,NA,NA,sciencedirect,2026-04-13T21:17:16.841Z,surgical management of isolated fallopian tube torsion in the pediatric population,4,T Gallant,J Clay,gallant T,clay J,NA,NA,FALSE,NA,FALSE,TRUE,b6e3022a3fb91696077da458f6b98eca,,gallant T; king C; newark A; clay J
Conference abstract,Laparoscopic Inguinal Lymph Node Dissection in Vulval Cancer,"S Puntambekar, M Patil, A Puntambekar, S Puntambekar",Page S28,https://doi.org/10.1016/j.jmig.2023.08.078,https://www.sciencedirect.com/science/article/pii/S1553465023004090,https://www.sciencedirect.com/science/article/pii/S1553465023004090/pdfft?md5=d1f92a2704d846fa531fc37ac58d82be&pid=1-s2.0-S1553465023004090-main.pdf,AAGL2023_064,NA,NA,NA,NA,NA,NA,NA,NA,sciencedirect,2026-04-13T21:17:16.841Z,laparoscopic inguinal lymph node dissection in vulval cancer,4,S Puntambekar,S Puntambekar,puntambekar S,puntambekar S,NA,NA,FALSE,NA,FALSE,TRUE,0c902b3fed28402d12e7925f18d72ec9,,puntambekar S; patil M; puntambekar A; puntambekar S
Conference abstract,Simulation of Laparoscopic Myomectomy Using a Gynesim Real Tissue Model,"MD Hudson, VB Desai",Page S28,https://doi.org/10.1016/j.jmig.2023.08.079,https://www.sciencedirect.com/science/article/pii/S1553465023004107,https://www.sciencedirect.com/science/article/pii/S1553465023004107/pdfft?md5=2e964ffe3bc832b18c880088243c6721&pid=1-s2.0-S1553465023004107-main.pdf,AAGL2023_065,NA,NA,NA,NA,NA,NA,NA,NA,sciencedirect,2026-04-13T21:17:16.841Z,simulation of laparoscopic myomectomy using a gynesim real tissue model,2,Hudson,VB Desai,hudson,desai V,NA,NA,FALSE,NA,FALSE,FALSE,1f5ffd128a5c5f6fbd73fc592009f46c,,hudson; desai V
Conference abstract,Technical Considerations for Total Laparoscopic Hysterectomy for Large Cervical Fibroid Precluding Placement of Uterine Manipulator,"E Covert, K Bergin, J Wilson-Leedy",Pages S28-S29,https://doi.org/10.1016/j.jmig.2023.08.080,https://www.sciencedirect.com/science/article/pii/S1553465023004119,https://www.sciencedirect.com/science/article/pii/S1553465023004119/pdfft?md5=bf60b5357b0591ac975c72e95068f240&pid=1-s2.0-S1553465023004119-main.pdf,AAGL2023_066,NA,NA,NA,NA,NA,NA,NA,NA,sciencedirect,2026-04-13T21:17:16.841Z,technical considerations for total laparoscopic hysterectomy for large cervical fibroid precluding placement of uterine manipulator,3,E Covert,J Wilson-Leedy,covert E,wilson-leedy J,NA,NA,FALSE,NA,FALSE,FALSE,f9185ddd987f9502e846ec219fc5a016,,covert E; bergin K; wilson-leedy J
Conference abstract,Essentials in Minimally Invasive Gynecology Pro Tips,"KL Karlson, S Miles",Page S29,https://doi.org/10.1016/j.jmig.2023.08.081,https://www.sciencedirect.com/science/article/pii/S1553465023004120,https://www.sciencedirect.com/science/article/pii/S1553465023004120/pdfft?md5=4cd5445b3893079589c25ac0b8c9e069&pid=1-s2.0-S1553465023004120-main.pdf,AAGL2023_067,NA,NA,NA,NA,NA,NA,NA,NA,sciencedirect,2026-04-13T21:17:16.841Z,essentials in minimally invasive gynecology pro tips,2,KL Karlson,S Miles,karlson K,miles S,NA,NA,FALSE,NA,FALSE,TRUE,d446acb13ddfa9a35fb79c8a7a93b5ce,,karlson K; miles S
Conference abstract,Vascular Injury during Gynecologic Surgery: A Hands-on Simulation Model,"L Berkowitz, C Liao, K Stampler, A Schieler, ... J Hoffman",Page S29,https://doi.org/10.1016/j.jmig.2023.08.082,https://www.sciencedirect.com/science/article/pii/S1553465023004132,https://www.sciencedirect.com/science/article/pii/S1553465023004132/pdfft?md5=739d793899ea63f2eee815726fe6e136&pid=1-s2.0-S1553465023004132-main.pdf,AAGL2023_068,NA,NA,NA,NA,NA,NA,NA,NA,sciencedirect,2026-04-13T21:17:16.841Z,vascular injury during gynecologic surgery a hands on simulation model,4,L Berkowitz,A Schieler,berkowitz L,schieler A,NA,NA,FALSE,NA,FALSE,FALSE,e4ba3bfe72e194670e16d51938d49273,,berkowitz L; liao C; stampler K; schieler A
Conference abstract,Hysteroscopic Multiple Myomectomy: Robotic Endoscope Updates,"LF Harvey, RB Hendrick, D Herrell, A Couget, ... TL Anderson",Page S29,https://doi.org/10.1016/j.jmig.2023.08.084,https://www.sciencedirect.com/science/article/pii/S1553465023004156,https://www.sciencedirect.com/science/article/pii/S1553465023004156/pdfft?md5=83d72a2a8fd7fdd6d1225a6ad08619ee&pid=1-s2.0-S1553465023004156-main.pdf,AAGL2023_069,NA,NA,NA,NA,NA,NA,NA,NA,sciencedirect,2026-04-13T21:17:16.841Z,hysteroscopic multiple myomectomy robotic endoscope updates,4,LF Harvey,A Couget,harvey L,couget A,NA,NA,FALSE,NA,FALSE,FALSE,6bcce42e93f965f53800c11045d2951c,,harvey L; hendrick R; herrell D; couget A
Conference abstract,Robotic Approach to Mild Endometriosis and Vascular Entrapment of the Bilateral Sciatic Nerves,"CP Crispi, CA Souza, CP Crispi, CMV Joaquim, TR Dantas",Pages S29-S30,https://doi.org/10.1016/j.jmig.2023.08.085,https://www.sciencedirect.com/science/article/pii/S1553465023004168,https://www.sciencedirect.com/science/article/pii/S1553465023004168/pdfft?md5=adf36f6f89f261821287e8ef8e0fef95&pid=1-s2.0-S1553465023004168-main.pdf,AAGL2023_070,NA,NA,NA,NA,NA,NA,NA,NA,sciencedirect,2026-04-13T21:17:16.841Z,robotic approach to mild endometriosis and vascular entrapment of the bilateral sciatic nerves,5,CP Crispi,TR Dantas,crispi C,dantas T,NA,NA,FALSE,NA,FALSE,FALSE,66d59b89fee64d9da5a6f7716b0f27b2,,crispi C; souza C; crispi C; joaquim C; dantas T
Conference abstract,High Complexity Robotic-Assisted Myomectomy and Endometriosis Treatment Using Intraoperative Ultrasound,"M Zlotnik, GA Barison, E Zlotnik, DC Nazareth, ... M Corinti",Page S30,https://doi.org/10.1016/j.jmig.2023.08.086,https://www.sciencedirect.com/science/article/pii/S155346502300417X,https://www.sciencedirect.com/science/article/pii/S155346502300417X/pdfft?md5=bbb348a6471843b956abd3b5d21f4d12&pid=1-s2.0-S155346502300417X-main.pdf,AAGL2023_071,NA,NA,NA,NA,NA,NA,NA,NA,sciencedirect,2026-04-13T21:17:16.841Z,high complexity robotic assisted myomectomy and endometriosis treatment using intraoperative ultrasound,4,M Zlotnik,DC Nazareth,zlotnik M,nazareth D,NA,NA,FALSE,NA,FALSE,FALSE,88f279f3fdeefc5a4e041ad263d0f160,,zlotnik M; barison G; zlotnik E; nazareth D
Conference abstract,Instillation of ICG Dye into Ureters for Intra-Operative Identification during Robotic Surgery,"B Ortiz, K Paracha, O Russel",Page S30,https://doi.org/10.1016/j.jmig.2023.08.087,https://www.sciencedirect.com/science/article/pii/S1553465023004181,https://www.sciencedirect.com/science/article/pii/S1553465023004181/pdfft?md5=19c3c4c413a706168906766e7730c126&pid=1-s2.0-S1553465023004181-main.pdf,AAGL2023_072,NA,NA,NA,NA,NA,NA,NA,NA,sciencedirect,2026-04-13T21:17:16.841Z,instillation of icg dye into ureters for intra operative identification during robotic surgery,3,B Ortiz,O Russel,ortiz B,russel O,NA,NA,FALSE,NA,FALSE,FALSE,a611c0d220af13277b8254cbddc3f697,,ortiz B; paracha K; russel O
Conference abstract,Expanding the Scope: The Use of Indocyanine Green in Minimally Invasive Gynecology Surgery,"Luna N Ramirez, TJ Norton, J Mourad",Page S31,https://doi.org/10.1016/j.jmig.2023.08.088,https://www.sciencedirect.com/science/article/pii/S1553465023004193,https://www.sciencedirect.com/science/article/pii/S1553465023004193/pdfft?md5=fad19da2791a110dca4ad53ca1b1186f&pid=1-s2.0-S1553465023004193-main.pdf,AAGL2023_073,NA,NA,NA,NA,NA,NA,NA,NA,sciencedirect,2026-04-13T21:17:16.841Z,expanding the scope the use of indocyanine green in minimally invasive gynecology surgery,3,Luna N Ramirez,J Mourad,ramirez L,mourad J,NA,NA,FALSE,NA,FALSE,TRUE,d93d4a845facf2489c0a099248daac47,,ramirez L; norton T; mourad J
Conference abstract,Management of Caesarean Scar Ectopic Pregnancy Via Robotic Caesarean Scar Defect Repair – a Video Presentation,"C Rook, A Lam",Page S31,https://doi.org/10.1016/j.jmig.2023.08.089,https://www.sciencedirect.com/science/article/pii/S155346502300420X,https://www.sciencedirect.com/science/article/pii/S155346502300420X/pdfft?md5=983da31a44619a5ff8e29e0058cfa0d4&pid=1-s2.0-S155346502300420X-main.pdf,AAGL2023_074,NA,NA,NA,NA,NA,NA,NA,NA,sciencedirect,2026-04-13T21:17:16.841Z,management of caesarean scar ectopic pregnancy via robotic caesarean scar defect repair a video presentation,2,C Rook,A Lam,rook C,lam A,NA,NA,FALSE,NA,FALSE,FALSE,77e5db00ff069b964538aaa2eda76839,,rook C; lam A
Conference abstract,Robotic Assisted Gravid Hysterectomy for Management of Second Trimester Cesarean Scar Pregnancy,"L Lelea, T Lombardi, JM Janco",Page S31,https://doi.org/10.1016/j.jmig.2023.08.090,https://www.sciencedirect.com/science/article/pii/S1553465023004211,https://www.sciencedirect.com/science/article/pii/S1553465023004211/pdfft?md5=4a2e53df4f3e3a3da9cb5dfa4f4b3b68&pid=1-s2.0-S1553465023004211-main.pdf,AAGL2023_075,NA,NA,NA,NA,NA,NA,NA,NA,sciencedirect,2026-04-13T21:17:16.841Z,robotic assisted gravid hysterectomy for management of second trimester cesarean scar pregnancy,3,L Lelea,JM Janco,lelea L,janco J,NA,NA,FALSE,NA,FALSE,FALSE,10a23b10807dd7765d7ae8158f50efcb,,lelea L; lombardi T; janco J
Conference abstract,Robotic Hysterectomy in Cesarean Scar Ectopic with Placenta Accreta,"S Varma, N Dad, A Elfeky, J To, N Rivera",Page S32,https://doi.org/10.1016/j.jmig.2023.08.091,https://www.sciencedirect.com/science/article/pii/S1553465023004223,https://www.sciencedirect.com/science/article/pii/S1553465023004223/pdfft?md5=8dd603f9706c7bd6f8d90f9637710ecf&pid=1-s2.0-S1553465023004223-main.pdf,AAGL2023_076,NA,NA,NA,NA,NA,NA,NA,NA,sciencedirect,2026-04-13T21:17:16.841Z,robotic hysterectomy in cesarean scar ectopic with placenta accreta,5,S Varma,N Rivera,varma S,rivera N,NA,NA,FALSE,NA,FALSE,TRUE,ed294ebf3c8dd47391773d0c9bcb10d4,,varma S; dad N; elfeky A; to J; rivera N
Conference abstract,Complex Bladder Endometriosis with Ureteral Obstruction: Tenets of Surgical Management,"EM Lee, T Lee",Page S32,https://doi.org/10.1016/j.jmig.2023.08.093,https://www.sciencedirect.com/science/article/pii/S1553465023004247,https://www.sciencedirect.com/science/article/pii/S1553465023004247/pdfft?md5=d6d59dbc704585c1c1796bb5fa134ca3&pid=1-s2.0-S1553465023004247-main.pdf,AAGL2023_077,NA,NA,NA,NA,NA,NA,NA,NA,sciencedirect,2026-04-13T21:17:16.841Z,complex bladder endometriosis with ureteral obstruction tenets of surgical management,2,EM Lee,T Lee,lee E,lee T,NA,NA,FALSE,NA,FALSE,FALSE,5688f128af123f49d925ad355370af28,,lee E; lee T
Conference abstract,From Imaging to Visualization: Seeing the Future of Endometriosis Care,"C Warshafsky, TE Flaxman, S Duigenan, SS Singh",Page S32,https://doi.org/10.1016/j.jmig.2023.08.094,https://www.sciencedirect.com/science/article/pii/S1553465023004259,https://www.sciencedirect.com/science/article/pii/S1553465023004259/pdfft?md5=b32f2f5901e2679c1a734967af6ddf45&pid=1-s2.0-S1553465023004259-main.pdf,AAGL2023_078,NA,NA,NA,NA,NA,NA,NA,NA,sciencedirect,2026-04-13T21:17:16.841Z,from imaging to visualization seeing the future of endometriosis care,4,C Warshafsky,SS Singh,warshafsky C,singh S,NA,NA,FALSE,NA,FALSE,FALSE,fad2f2754fe0d4240eeedc1c1aa293a3,,warshafsky C; flaxman T; duigenan S; singh S
Conference abstract,Clinical Features of and Minimally Invasive Surgery for Bladder Endometriosis: A Series of 24 Cases,"S Sakate, Y Ochi, M Andou",Pages S32-S33,https://doi.org/10.1016/j.jmig.2023.08.095,https://www.sciencedirect.com/science/article/pii/S1553465023004260,https://www.sciencedirect.com/science/article/pii/S1553465023004260/pdfft?md5=5067aae948bed4d5965e337ce68ee9cf&pid=1-s2.0-S1553465023004260-main.pdf,AAGL2023_079,NA,NA,NA,NA,NA,NA,NA,NA,sciencedirect,2026-04-13T21:17:16.841Z,clinical features of and minimally invasive surgery for bladder endometriosis a series of 24 cases,3,S Sakate,M Andou,sakate S,andou M,NA,NA,FALSE,24,FALSE,FALSE,3b9895350d2d44969e1b68915ded90e6,,sakate S; ochi Y; andou M
Conference abstract,Double Discoid Excision with Connell Closure & ICG Dye Assessment of Perfusion,"AD Nguyen, VD Galaviz, PL Sticco, KT Downing",Page S33,https://doi.org/10.1016/j.jmig.2023.08.096,https://www.sciencedirect.com/science/article/pii/S1553465023004272,https://www.sciencedirect.com/science/article/pii/S1553465023004272/pdfft?md5=9b48e6b6a7045af06447d881776d925c&pid=1-s2.0-S1553465023004272-main.pdf,AAGL2023_080,NA,NA,NA,NA,NA,NA,NA,NA,sciencedirect,2026-04-13T21:17:16.841Z,double discoid excision with connell closure icg dye assessment of perfusion,4,AD Nguyen,KT Downing,nguyen A,downing K,NA,NA,FALSE,NA,FALSE,FALSE,bfdce2498dd30b35ef02fdcec9919912,,nguyen A; galaviz V; sticco P; downing K
Conference abstract,Transvaginal Natural Orifice Specimen Extraction (NOSE): 10-Step Approach for Laparoscopic Excision of Deep Rectosigmoid Endometriosis,"A Mangeshikar, Y Youssef, H Sheth, P Mangeshikar, G Moawad",Page S33,https://doi.org/10.1016/j.jmig.2023.08.097,https://www.sciencedirect.com/science/article/pii/S1553465023004284,https://www.sciencedirect.com/science/article/pii/S1553465023004284/pdfft?md5=d020aac2beb0164df20e1de976ed8874&pid=1-s2.0-S1553465023004284-main.pdf,AAGL2023_081,NA,NA,NA,NA,NA,NA,NA,NA,sciencedirect,2026-04-13T21:17:16.841Z,transvaginal natural orifice specimen extraction nose 10 step approach for laparoscopic excision of deep rectosigmoid endometriosis,5,A Mangeshikar,G Moawad,mangeshikar A,moawad G,NA,NA,FALSE,10,FALSE,FALSE,a1a5d146b9a9f44edca3b6e708c4d9f7,,mangeshikar A; youssef Y; sheth H; mangeshikar P; moawad G
Conference abstract,Approach to Excision of Superficial Endometriosis Using Avascular Spaces,"M Briggs, B Beran",Pages S33-S34,https://doi.org/10.1016/j.jmig.2023.08.098,https://www.sciencedirect.com/science/article/pii/S1553465023004296,https://www.sciencedirect.com/science/article/pii/S1553465023004296/pdfft?md5=d467fb74718e3d2be5a90626c8504898&pid=1-s2.0-S1553465023004296-main.pdf,AAGL2023_082,NA,NA,NA,NA,NA,NA,NA,NA,sciencedirect,2026-04-13T21:17:16.841Z,approach to excision of superficial endometriosis using avascular spaces,2,M Briggs,B Beran,briggs M,beran B,NA,NA,FALSE,NA,FALSE,FALSE,def97911b3b5c80edda5e5c076742dba,,briggs M; beran B
Conference abstract,Complex Case of Bilateral Endometriomas and Uterine Fibroids in a Patient with Advanced Endometriosis,"MC Alzamora, O Casas Diaz, JK Robinson",Page S34,https://doi.org/10.1016/j.jmig.2023.08.099,https://www.sciencedirect.com/science/article/pii/S1553465023004302,https://www.sciencedirect.com/science/article/pii/S1553465023004302/pdfft?md5=4f1dd719ff7162f5d94db82f0f36ccde&pid=1-s2.0-S1553465023004302-main.pdf,AAGL2023_083,NA,NA,NA,NA,NA,NA,NA,NA,sciencedirect,2026-04-13T21:17:16.841Z,complex case of bilateral endometriomas and uterine fibroids in a patient with advanced endometriosis,3,MC Alzamora,JK Robinson,alzamora M,robinson J,NA,NA,FALSE,NA,FALSE,TRUE,2c99ac44deb21045774f2293b46edb3d,,alzamora M; diaz O; robinson J
Conference abstract,"Approach to Total Laparoscopic Hysterectomy and Longitudinal Vaginal Septum Resection in a Uterus Bicornuate, Bicollis","EG Crihfield, D Alviar",Page S34,https://doi.org/10.1016/j.jmig.2023.08.101,https://www.sciencedirect.com/science/article/pii/S1553465023004326,https://www.sciencedirect.com/science/article/pii/S1553465023004326/pdfft?md5=98044810f2e02bf473bab0ca3b342e36&pid=1-s2.0-S1553465023004326-main.pdf,AAGL2023_084,NA,NA,NA,NA,NA,NA,NA,NA,sciencedirect,2026-04-13T21:17:16.841Z,approach to total laparoscopic hysterectomy and longitudinal vaginal septum resection in a uterus bicornuate bicollis,2,EG Crihfield,D Alviar,crihfield E,alviar D,NA,NA,FALSE,NA,FALSE,TRUE,a76963197028ac071b51141144bfd24a,,crihfield E; alviar D
Conference abstract,Laparoscopic Assisted Pregnancy Termination at 14 Weeks in Patient with Obstructing Cervical Cancer,"A Zeccola, M Kao, K Thomas, S Uhm, ... R Guido",Pages S34-S35,https://doi.org/10.1016/j.jmig.2023.08.102,https://www.sciencedirect.com/science/article/pii/S1553465023004338,https://www.sciencedirect.com/science/article/pii/S1553465023004338/pdfft?md5=7d918907082312c2b07e576084c22102&pid=1-s2.0-S1553465023004338-main.pdf,AAGL2023_085,NA,NA,NA,NA,NA,NA,NA,NA,sciencedirect,2026-04-13T21:17:16.841Z,laparoscopic assisted pregnancy termination at 14 weeks in patient with obstructing cervical cancer,4,A Zeccola,S Uhm,zeccola A,uhm S,NA,NA,FALSE,14,FALSE,TRUE,e597149620f3566f381e6e9d829c0818,,zeccola A; kao M; thomas K; uhm S
Conference abstract,Interstitial Ectopic Pregnancy: Laparoscopic Cornuostomy,"M Elsherbiny, K Ma, ET Lim",Page S35,https://doi.org/10.1016/j.jmig.2023.08.103,https://www.sciencedirect.com/science/article/pii/S155346502300434X,https://www.sciencedirect.com/science/article/pii/S155346502300434X/pdfft?md5=37620f2b696016a96a78dc6286071b33&pid=1-s2.0-S155346502300434X-main.pdf,AAGL2023_086,NA,NA,NA,NA,NA,NA,NA,NA,sciencedirect,2026-04-13T21:17:16.841Z,interstitial ectopic pregnancy laparoscopic cornuostomy,3,M Elsherbiny,ET Lim,elsherbiny M,lim E,NA,NA,FALSE,NA,FALSE,FALSE,0e64f443bcb9139c54496b97b56486b1,,elsherbiny M; ma K; lim E
Conference abstract,Advanced Pelvic Anatomy and Dissection Techniques,"CS Kwon, J Kim, JS Abelson, A McClurg, ... N Dasouki Abu-Alnadi",Page S35,https://doi.org/10.1016/j.jmig.2023.08.104,https://www.sciencedirect.com/science/article/pii/S1553465023004351,https://www.sciencedirect.com/science/article/pii/S1553465023004351/pdfft?md5=c86673b8f3d6ebaf0cdaca2b2bf09087&pid=1-s2.0-S1553465023004351-main.pdf,AAGL2023_087,NA,NA,NA,NA,NA,NA,NA,NA,sciencedirect,2026-04-13T21:17:16.841Z,advanced pelvic anatomy and dissection techniques,4,CS Kwon,A McClurg,kwon C,mcclurg A,NA,NA,FALSE,NA,FALSE,FALSE,f8f0bf6f859a6442525346d8b2703224,,kwon C; kim J; abelson J; mcclurg A
