doi,cr_title,cr_first_author,cr_last_author,cr_all_authors,cr_journal,cr_abstract,cr_year,cr_month,source,abstract_id
10.3329/bjog.v37i2.68795,Complications during Vaginal Sacrospinous Fixation along with McCall Culdoplasty in Stage III and IV POP,Begum B,Begum R,Begum B; Begum B; Begum R,Bangladesh Journal of Obstetrics &amp; Gynaecology,"In Bangladesh, about half a million women are suffering from stage III or IV pelvic organ prolapse (POP). With traditional surgical methods, there is a chance of recurrence, especially of apical prolapse. Sacrospinous fixation (SSF) along with MacCall Culdoplasty during vaginal hysterectomy can reduce this recurrence rate enormously. This study was designed to identify, manage as well as to prevent per-/post-operative complications during SSF. The study period was from August 2017 to December 2021 at Kumudini Women’s Medical College and Hospital, Bangladesh. Total 335 stage III and IV utero-vaginal prolapse cases were included in this study. The surgeries performed were vaginal hysterectomy followed by modified McCall Culdoplasty and right-sided vaginal sacrospinous ligament fixation (SSF) along with anterior and posterior fascial closure and perineorrhaphy. A standard data collection sheet was used to record the information. Per-operatively, main complications were hemorrhage (3.57%) due to vessel injury and rectal injury (0.90%). The immediate early postoperative complication was buttock pain (24%). Of these, in 97.53% cases, pain subsided within 6 weeks with analgesic and counselling. Only one patient had recurrence of apical prolapse within 1st week of operation. It should be concluded that with proper knowledge of anatomy and careful surgical technique, most of the complications can be avoided.
Bangladesh J Obstet Gynaecol, 2022; Vol. 37(2): 90-97",2023,11,crossref,AAGL2022_038
10.1016/j.jmig.2022.09.062,The Role of Minimally Invasive Intrauterine Surgery in Improving the Results of IVF Programs,Kozachenko I,Stepanian A,Kozachenko I; Smolnikova V; Adamyan L; Stepanian A,Journal of Minimally Invasive Gynecology,NA,2022,11,crossref,AAGL2022_040
10.1016/j.jmig.2025.09.331,14898 Practice Pattern Characteristics of Graduates of Minimally Invasive Gynecologic Surgery Fellowship Programs,Dawodu O,Lauer J,Dawodu O; Lauer J,Journal of Minimally Invasive Gynecology,NA,2025,11,crossref,AAGL2022_040
10.1055/b-0042-188736,55 The Role of Biologics in Minimally Invasive Spine Surgery,NA,NA,,Essential Step-by-Step Techniques for Minimally Invasive Spinal Surgery,NA,2022,01,crossref,AAGL2022_040
10.1016/j.jmig.2024.09.887,12063 Early Clinical Experience With a Peg-Based Hydrogel Spacer for the Prevention of Intrauterine Adhesions Following Hysteroscopic Surgery,Garza Leal J,Garza Leal J,Garza Leal J,Journal of Minimally Invasive Gynecology,NA,2024,11,crossref,AAGL2022_040
10.1016/j.jmig.2025.09.084,Successful Pregnancy after Extensive Robotic Adenomyosis Surgery Using the Double-Flap Technique and Intrauterine Indocyanine Green,Oliveira M,Faria B,Oliveira M; Pereira T; Alves J; Faria B,Journal of Minimally Invasive Gynecology,NA,2025,11,crossref,AAGL2022_040
10.1016/j.jmig.2022.09.066,Preoperative Tamsulosin to Prevent Postoperative Urinary Retention after Pelvic Floor Repair Surgery,Garcia-Ruiz N,Hurtado E,Garcia-Ruiz N; Malekzadeh M; Hurtado E,Journal of Minimally Invasive Gynecology,NA,2022,11,crossref,AAGL2022_044
10.4103/sjl.sjl_2024_a17,SJLA_2024_A17: Use of Perioperative Tamsulosin to Prevent Postoperative Urinary Retention Following Day Case Laparoscopic Inguinal Hernia Repair,AlGhazal T,AlGhazal T,AlGhazal T,Saudi Journal of Laparoscopy,"Postoperative urinary retention is one of the more common complications following laparoscopic inguinal hernia repair (LIHR). We hypothesized that the oral one adrenergic blocker Tamsulosin, (Flomax, Boehringer Ingelheim) could be used to decrease the incidence of urinary retention after LIHR. Data from all patients undergoing laparoscopic total extraperitoneal (TEP) inguinal hernia repair by a single surgeon from June 2012 through June 2017 were collected prospectively. Patients received Tamsulosin (Flomax) 0.4 mg/day orally for a total of 5 days beginning 2 days before surgery. All TEP procedures were done under general anesthesia without a urinary catheter in place. Patients were discharged home after voiding in the recovery area. Data are expressed as mean ± standard deviation; flomax was administered to 30 of 32 consecutive patients undergoing outpatient TEP inguinal hernia repair. The mean patient age was 51.3 ± 10.5 years (28–72 years). Ten (32.2%) patients were operated on for recurrent inguinal hernias, 14 (45.1%) had bilateral hernias repaired, and 4 (12.9%) had concomitant umbilical hernia repair. The average operative time was 60 ± 24 min. The mean amount of intraoperative fluids given was 998 ± 297 ml. Two patients were excluded from the study because they required a urinary catheter in the operating room for other reasons (one requiring concomitant cystoscopy and one with anticipated complicated repair in patients who had three prior open inguinal hernia repairs and did not take Flomax). None of the patients given Flomax perioperatively developed urinary retention and all were discharged home the same day of surgery. In contrast, the two patients undergoing TEP repairs who did not receive Flomax perioperatively both developed urinary retention that required catheter placement.",2023,01,crossref,AAGL2022_044
10.1007/s00192-025-06218-7,Commentary on “Effect of Preoperative Tamsulosin on Postoperative Urinary Retention Prevention after Sling Placement: A Randomized Controlled Trial”,Fornari A,Fornari A,Fornari A,International Urogynecology Journal,NA,2025,06,crossref,AAGL2022_044
10.1016/j.ajog.2024.02.136,Tamsulosin for prevention of postoperative urinary retention after vaginal pelvic organ prolapse surgery: a retrospective review,Song J,Alas A,Song J; Alas A,American Journal of Obstetrics and Gynecology,NA,2024,04,crossref,AAGL2022_044
10.1097/spv.0000000000001632,Tamsulosin to Prevent Urinary Retention After Vaginal Urogynecologic Surgery,Song J,Alas A,Song J; Carrillo L; Tibon J; Botros-Brey S; Evans E; Alas A,Urogynecology,"
            Importance
            Postoperative urinary retention (POUR) affects up to 51% of women undergoing surgery for pelvic organ prolapse (POP). Effective prevention strategies remain elusive, although alpha receptor antagonists show promise in recent literature.
          
          
            Objectives
            This study sought to evaluate the effect of preoperative tamsulosin on POUR after vaginal surgery for POP.
          
          
            Study Design
            We conducted a retrospective cohort study of female patients undergoing vaginal surgery for POP, with or without concomitant midurethral sling. Patients who received preoperative tamsulosin were compared with controls. All patients were discharged on the day of surgery after undergoing a standardized voiding trial. The primary outcome was the rate of POUR, defined by a failed voiding trial. Secondary outcomes included complication rates and risk factors for POUR.
          
          
            Results
            A total of 195 patients were included for analysis, with 60 patients (30.8%) receiving tamsulosin and 135 (69.2%) not. Baseline demographics were similar between groups, except the tamsulosin group had lower parity and were less likely to splint to void. The tamsulosin group had similar rates of POUR compared with control (31.7% vs 34.8%, P = 0.67). Multivariate logistic regression controlling for confounders showed no significant effect of tamsulosin on POUR rates (odds ratio, 0.65; 95% confidence interval, 0.31–1.35; P = 0.24). Concomitant sling placement was identified as the only independent risk factor for POUR (odds ratio, 3.00; 95% confidence interval, 1.55–5.81; P = 0.001).
          
          
            Conclusions
            Preoperative tamsulosin does not appear to be effective in preventing postoperative urinary retention in women undergoing vaginal surgery for POP, whereas concomitant sling placement appears to increase its risk.
          ",2025,04,crossref,AAGL2022_044
10.1016/j.jmig.2022.09.081,Post-Operative Voiding Function after Total Laparoscopic Hysterectomy with Transvaginal Versus Transabdominal Morcellation,Marguerie M,Marguerie M,Marguerie M,Journal of Minimally Invasive Gynecology,NA,2022,11,crossref,AAGL2022_057
10.1089/gyn.2023.0132,Postoperative Voiding Function After Total Laparoscopic Hysterectomy with Transvaginal Versus Transabdominal Morcellation,Marguerie M,Sanders A,Marguerie M; Carrigan R; Lo K; Belland L; Secter M; Sanders A,Journal of Gynecologic Surgery,"
                    Objective:
                    This study examined postoperative urinary retention (POUR) rates in patients who had transvaginal or transabdominal morcellation for large fibroids or adenomyotic uteri.
                  
                  
                    Materials and Methods:
                    This retrospective, observational cohort study was conducted, from January 2015 to April 2021, in a multicenter health care system, in Calgary and Southern Alberta, Canada. The patients were women, ≥18 years, who had total laparoscopic hysterectomy with morcellation. Women with preexisting urinary retention were excluded. POUR was urinary retention needing an indwelling or in-and-out catheter postoperatively before discharge.
                  
                  
                    Results:
                    There were no differences in POUR for transvaginal (29/139; 20.9%) and transabdominal (12/56; 21.4%) morcellation. There were also no differences in time to first postoperative void (5.5 hours [range: 3.5–8] versus 5.75 hours [range: 4–7.125]); length of stay (23 hours [range: 20.875–25.625] versus 22 hours [range:18.5–24.5]); postoperative urinary tract infections (5.1% versus 3.6%); or visits to the emergency department for POUR postdischarge (1.4% versus 1.8%) for transvaginal and transabdominal morcellation, respectively. The vaginal-morcellation group trended toward increased complication rates during morcellation (7% versus 0%) and urinary complaints at postoperative follow-ups (9.4% versus 0%).
                  
                  
                    Conclusions:
                    Either morcellation type produces similar rates of POUR. Surgeon and patient preferences guide decisions on preferred morcellation routes. Larger prospective trials are needed to further assess POUR, potential for increased complications, and postoperative urinary complaints induced by transvaginal morcellation. (J GYNECOL SURG 20XX:000)
                  ",2024,10,crossref,AAGL2022_057
10.52054/fvvo.14.1.006,Total surgical time in laparoscopic supracervical hysterectomy with laparoscopic in-bag-morcellation compared to laparoscopic supracervical hysterectomy with uncontained morcellation,Krentel H,De Wilde R,Krentel H; Tchartchian G; Torres de la Roche L; De Wilde R,"Facts, Views and Vision in ObGyn","Background: A possible solution to the problem of cell dissemination through laparoscopic uncontained morcellation during laparoscopic supracervical hysterectomy (LASH) is the use of laparoscopic in-bag morcellation. One criticism regarding the use of in-bag morcellation is the additional surgical time associated with this procedure.

Objectives: In this retrospective study we compared the total surgical time in LASH with laparoscopic in-bag morcellation (107 cases from 2016-2018) and LASH with uncontained morcellation (47 cases from 2015-2017).

Materials and Methods: All surgeries were performed in the same department of minimally invasive gynaecological surgery by a total of three experienced surgeons for the indication of bleeding disorder and / or dysmenorrhea.

Main outcome measures: We measured and compared total surgical time, surgical outcome, blood loss and complications in LASH with in-bag morcellation and with uncontained morcellation.

Results: Total surgical time in both procedures do not show a significant difference. Considering the learning curve in laparoscopic bag use, the total surgical time in LASH with laparoscopic in-bag morcellation is shorter than total surgical time in LASH with uncontained morcellation. Laparoscopic in-bag morcellation consumes time for bag use and handling, but saves time as it eliminates the need for meticulous sampling of lost tissue fragments and the complex lavage of the peritoneal cavity after morcellation. There is no difference between both groups in terms of blood loss, complications and surgical results.

Conclusion / What is new? We conclude that LASH with in-bag morcellation is not related to additional surgical time when compared to LASH with uncontained morcellation.",2022,03,crossref,AAGL2022_057
10.7759/cureus.86305,Spontaneous Transvaginal Evisceration of the Small Bowel Two Years Post Laparoscopic Total Hysterectomy: A Case Report,Houmaid H,Soummani A,Houmaid H; Sali M; Harou K; Asmouki H; Soummani A,Cureus,NA,2025,06,crossref,AAGL2022_057
10.21203/rs.3.rs-7265446/v1,Patient Outcomes with Robotic-Assisted Total Laparoscopic Hysterectomy Versus Robotic-Assisted Total Laparoscopic Hysterectomy with Minilaparotomy,Tubert A,Zgheib N,Tubert A; Lee R; Wright A; Roth D; Lamichhane R; Zgheib N,NA,"Abstract
        Background: Minimally invasive hysterectomy, with removal of the specimen through the vagina, has minimal morbidity and superior intraoperative and postoperative outcomes compared to abdominal hysterectomy. There are times, however, when vaginal specimen removal may not be feasible and a minilaparotomy can be utilized. This study purpose was to compare outcomes of robotic-assisted total laparoscopic hysterectomies with vaginal removal of the specimen versus minilaparotomy specimen extraction.
Methods:  A retrospective cohort study was conducted among two groups of patients who underwent a robotic-assisted total laparoscopic hysterectomy with vaginal specimen extraction (RV) or minilaparotomy specimen extraction (RL) by the gynecologic oncology service at an academic institution. Blood loss, pain medication requirements, length of stay and surgical complications were compared between groups.
Results: From January 2017 to October 2022, 1643 patients underwent a robotic hysterectomy. Sixty patients required a minilaparotomy for specimen extraction versus 1583 patients who had a vaginal extraction. RL cases had a larger blood loss (114.8mL vs 60.0mL, p&lt;0.001), morphine milligram equivalents requirements (95.8 versus 84.2, p=0.018), and length of stay (1.5 versus 1.2 days, p&lt;0.001) when compared to RV cases. Postoperative complications were more common in malignant RL cases compared to malignant RV extraction cases (p-value =0.028).
Conclusion: Despite a statistical increase in blood loss, pain medication needs, and length of stay, these outcomes were of limited clinical significance, and overall, RL was found to be a safe option for specimen removal when vaginal extraction is not feasible.",NA,01,crossref,AAGL2022_057
10.1016/j.jmig.2022.09.082,Surgical Practice Patterns in the Management of Ovarian Torsion,Brah T,Wang K,Brah T; Le Neveu M; Snow M; Krishnamoorthi M; Wu H; Simpson K; Patzkowsky K; Frost A; Wang K,Journal of Minimally Invasive Gynecology,NA,2022,11,crossref,AAGL2022_058
10.21275/mr24922003541,Laparoscopic Surgical Management of Ovarian Fibroma with Torsion in Young Female: A Case Report,Meena N,Meena N,Meena N,International Journal of Science and Research (IJSR),NA,2024,09,crossref,AAGL2022_058
10.1016/j.repbio.2025.101054,"Surgical management of ovarian torsion in children: Detorsion, cyst/mass excision, and ovarian fixation",Sancar S,Dayı S,Sancar S; Anayurt M; Dayı S,Reproductive Biology,NA,2025,09,crossref,AAGL2022_058
10.1016/b978-0-443-33833-5.00039-8,Ovarian–adnexal torsion,Spanos C,Spanos C,Spanos C,Non-Traumatic Acute Surgical Problems,NA,2025,01,crossref,AAGL2022_058
10.7759/cureus.95643,A Rare Case of Ovarian Dermoid Torsion in the Third Trimester: Clinical Challenges and Surgical Management,Saleem R,Mo R,Saleem R; Sathyendran P; Askalany T; Mo R,Cureus,NA,2025,10,crossref,AAGL2022_058
10.1016/j.jmig.2022.09.127,"Dissection Techniques for Dense Adhesions between Uterus, Bladder, and Anterior Abdominal Wall",Jiggetts S,Herzog D,Jiggetts S; Dad N; Schulman A; Herzog D,Journal of Minimally Invasive Gynecology,NA,2022,11,crossref,AAGL2022_098
10.26717/bjstr.2022.47.007460,"""Gynecological Leiomyoma of the Anterior Abdominal Wall: Localization Beyond the Uterus""",Azoulay D,Azoulay D,Azoulay D,Biomedical Journal of Scientific &amp; Technical Research,NA,2022,11,crossref,AAGL2022_098
10.1016/j.jmig.2021.09.685,Approach to a Total Laparoscopic Hysterectomy with Anterior Abdominal Wall Adhesions,OBrien E,Miles S,OBrien E; Miles S,Journal of Minimally Invasive Gynecology,NA,2021,11,crossref,AAGL2022_098
10.1016/j.jmig.2021.08.020,vNOTES Lateral Window Approach to Hysterectomy in a Case with Previous History of Multiple Surgeries Resulting in Keloid Scars and Enlarged Uterus with Dense Bladder Adhesions,Naval S,Naval S,Naval S,Journal of Minimally Invasive Gynecology,NA,2022,02,crossref,AAGL2022_098
10.53347/rid-213595,Anterior abdominal wall hemangioma,Hussin N,Hussin N,Hussin N,Radiopaedia.org,NA,2026,02,crossref,AAGL2022_098
10.1016/j.jmig.2023.08.022,Comparison of O-RADS 2022 and Simple Rules Ultrasound Classifications to Predict Adnexal Malignancy,Solnik M,Nasri F,Solnik M; Atri M; Nanapragasam A; Sagheb S; Nasri F,Journal of Minimally Invasive Gynecology,NA,2023,11,crossref,AAGL2023_015
10.1016/j.crad.2025.107180,Ultrasound Ovarian-Adnexal Reporting and Data System (O-RADS) and modified ultrasound simple rules comparison in evaluation of surgically proven adnexal masses,Kajal D,Atri M,Kajal D; Nanapragasam A; Leckie A; Sagheb S; Nasri F; Bouchard-Fortier G; Solnik J; Atri M,Clinical Radiology,NA,2026,01,crossref,AAGL2023_015
10.12677/acm.2022.123313,"Comparison of O-RADS Classification, GI-RADS Classification and Simple Rules in the Diagnosis of Adnexal Tumors",王 荣,王 荣,王 荣,Advances in Clinical Medicine,NA,2022,01,crossref,AAGL2023_015
10.1002/uog.24777,"Performance of <scp>IOTA</scp> Simple Rules, Simple Rules risk assessment, <scp>ADNEX</scp> model and <scp>O‐RADS</scp> in differentiating between benign and malignant adnexal lesions in North American women",Hiett A,Reid T,Hiett A; Sonek J; Guy M; Reid T,Ultrasound in Obstetrics &amp; Gynecology,"ABSTRACTObjectivesTo apply the International Ovarian Tumor Analysis (IOTA) Simple Rules (SR), the IOTA Simple Rules risk assessment (SRR), the IOTA Assessment of Different NEoplasias in the adneXa (ADNEX) model and the Ovarian‐Adnexal Reporting and Data System (O‐RADS) in the same cohort of North American patients and to compare their performance in preoperative discrimination between benign and malignant adnexal lesions.MethodsThis was a single‐center diagnostic accuracy study, performed between March 2018 and February 2021, which included 150 women with an adnexal lesion. Using the ADNEX model, lesions were classified prospectively, whereas the SR, SRR assessment and O‐RADS were applied retrospectively. Surgery with histological analysis was performed within 6 months of the ultrasound exam. Sensitivity and specificity were determined for each testing modality and the performance of the different modalities was compared.ResultsOf the 150 women, 110 (73.3%) had a benign ovarian tumor and 40 (26.7%) had a malignant tumor. The mean risk of malignancy generated by the ADNEX model without CA 125 was significantly higher in malignant vs benign lesions (63.3% vs 11.8%) and the area under the receiver‐operating‐characteristics curve (AUC) of the ADNEX model for differentiating between benign and malignant adnexal masses at the time of ultrasound examination was 0.937. The mean risk of malignancy generated by SRR assessment was also significantly higher in malignant vs benign lesions (74.1% vs 15.9%) and the AUC was 0.941. To compare the ADNEX model, SRR assessment and O‐RADS, the malignancy risk threshold was set at ≥ 10%. This cut‐off differentiates O‐RADS low‐risk categories (Category ≤ 3) from intermediate‐to‐high‐risk categories (Categories 4 and 5). At this cut‐off, the sensitivity of the ADNEX model was 97.5% (95% CI, 85.3%–99.9%) and the specificity was 63.6% (95% CI, 53.9%–72.4%), and, for the SRR model, the sensitivity was 100% (95% CI, 89.1%–100%) and the specificity was 51.8% (95% CI, 42.1%–61.4%). In the 113 cases to which the SR could be applied, the sensitivity was 100% (95% CI, 81.5%–100%) and the specificity was 95.6% (95% CI, 88.5%–98.6%). If the remaining 37 cases, which were inconclusive under SR, were designated ‘malignant’, the sensitivity remained at 100% but the specificity was reduced to 79.1% (95% CI, 70.1%–86.0%). The 150 cases fell into the following O‐RADS categories: 17 (11.3%) lesions in Category 2, 34 (22.7%) in Category 3, 66 (44.0%) in Category 4 and 33 (22.0%) in Category 5. There were no histologically proven malignant lesions in Category 2 or 3. There were 14 malignant lesions in Category 4 and 26 in Category 5. The sensitivity of O‐RADS using a malignancy risk threshold of ≥ 10% was 100% (95% CI, 89.1%–100.0%) and the specificity was 46.4% (95% CI, 36.9%–56.1%).ConclusionsWhen IOTA terms and techniques are used, the performance of IOTA models in a North American patient population is in line with published IOTA results in other populations. The IOTA SR, SRR assessment and ADNEX model and O‐RADS have similar sensitivity in the preoperative discrimination of malignant from benign pelvic tumors; however, the IOTA models have higher specificity and the algorithm does not require the use of magnetic resonance imaging. © 2022 International Society of Ultrasound in Obstetrics and Gynecology.",2022,05,crossref,AAGL2023_015
10.1002/jcu.24048,Comparison of the Diagnostic Performance of Ovarian Adnexal Reporting Data System (O‐<scp>RADS</scp>) With <scp>IOTA</scp> Simple Rules and <scp>ADNEX</scp> Model for Classifying Adnexal Masses: A Head‐To‐Head Meta‐Analysis,Almeida G,Alcázar J,Almeida G; Bort M; Alcázar J,Journal of Clinical Ultrasound,"ABSTRACTObjectiveTo compare the diagnostic accuracy of O‐RADS (Ovarian Reporting and Data System) and IOTA (international Ovarian Tumor Analysis group) simple rules (SR) and ADNEX (Assessment of Different NEoplasias in the adnexa) model for discriminating benign from malignant adnexal masses using meta‐analysis.MethodsA systematic search of studies comparing O‐RADS with SR and/or ADNEX in the same set of patients with an adnexal mass was performed in Medline, Web of Science, and Scopus databases from January 2020 to September 2023. Quality was assessed using the QUADAS‐2 tool. Quantitative meta‐analysis was performed.ResultsNine articles comprising 3924 women (3979 adnexal masses) were ultimately included after exclusions. Three studies compared O‐RADS versus SR, three studies compared O‐RADS versus ADNEX, and three studies compared all three methods. The risk of bias was high for patient selection in QUADAS‐2 in all studies. Six studies compared O‐RADS versus SR; no significant differences were found (pooled sensitivity and specificity of O‐RADS and IOTA SR were 94.0% and 77.0%, and 91.0% and 87.0%, respectively. p = 0.2204). Six studies compared O‐RADS versus ADNEX; no significant differences were found (pooled sensitivity and specificity of O‐RADS classification system and ADNEX were 95.0% and 79.0%, and 91.0% and 88.0%, respectively. p = 0.2307).ConclusionO‐RADS classification has a similar diagnostic performance to IOTA SR and ADNEX for discriminating benign and malignant adnexal masses.",2025,09,crossref,AAGL2023_015
10.1016/j.jmig.2023.08.028,Association between Ultrasound Soft Markers of Endometriosis and Pathologically Confirmed Positivity Rates of Endometriosis Lesions,VanDeman H,Mikhail E,VanDeman H; Moino D; Tanner J; Wyant H; Al Jumaily M; Hochberg L; Mikhail E,Journal of Minimally Invasive Gynecology,NA,2023,11,crossref,AAGL2023_020
