doi,cr_title,cr_first_author,cr_last_author,cr_all_authors,cr_journal,cr_abstract,cr_year,cr_month,source,abstract_id
10.12797/9788381389006.03,The Political Game of the Roe v. Wade Overturn,Maszniew Z,Maszniew Z,Maszniew Z,Smoking Guns: Tematy dzielące Amerykę,"The fall of Roe v. Wade reverts the U.S. to the pre-Roe status when the stateshad freedom of legislation on abortion. Consequently, the political aspect ofRoe v. Wade’s overturn shapes even deeper polarization of American society.The Supreme Court’s decision of Dobbs v. Jackson Women’s Health Organizationwas widely discussed regarding the 2022 midterms as well as future presidentialelections and the balance of power in Congress. Once again, law andpolitics intertwine in the creation of American reality, as the Supreme Court’sdecision became a soft power game. Even the definition of abortion was putup for debate by Republicans before the midterms. The fall of Roe v. Wadedeveloped into a tool in the hands of politicians fighting for votes and power,whereas women’s bodies became an instrument in the pursuit of political aims.",2023,01,crossref,AAGL2023_044
10.64628/aai.h6r4sqa5a,"5 justices, all confirmed by senators representing a minority of voters, appear willing to overturn Roe v. Wade",McMahon K,McMahon K,McMahon K,NA,NA,NA,01,crossref,AAGL2023_044
10.1016/j.jmig.2023.08.090,Robotic Assisted Gravid Hysterectomy for Management of Second Trimester Cesarean Scar Pregnancy,Lelea L,Janco J,Lelea L; Lombardi T; Janco J,Journal of Minimally Invasive Gynecology,NA,2023,11,crossref,AAGL2023_075
10.1016/j.jmig.2022.09.126,Robotic-Assisted Laparoscopic Hysterectomy for Management of Cesarean Scar Ectopic Concerning for a Molar Pregnancy,Cain A,Williams-Brown M,Cain A; Breen M; Holtz M; Williams-Brown M,Journal of Minimally Invasive Gynecology,NA,2022,11,crossref,AAGL2023_075
10.1016/j.jmig.2025.09.086,Robotic-Assisted Laparoscopic Management of Cesarean Scar Pregnancy,Lin B,Crihfield E,Lin B; Crihfield E,Journal of Minimally Invasive Gynecology,NA,2025,11,crossref,AAGL2023_075
10.1016/j.ajog.2022.12.008,Treatment of cesarean scar ectopic pregnancy by gravid total abdominal hysterectomy,Glassman D,Sauer M,Glassman D; Mohamed-Nady N; Sauer M,American Journal of Obstetrics and Gynecology,NA,2023,05,crossref,AAGL2023_075
10.1016/j.jmig.2021.09.123,Definitive Management of C-Section Scar Ectopic Pregnancy with Robotic-Assisted Laparoscopic Total Hysterectomy,Luna Ramirez N,Bral P,Luna Ramirez N; Elfeky A; Bral P,Journal of Minimally Invasive Gynecology,NA,2021,11,crossref,AAGL2023_075
10.1016/j.jmig.2023.08.101,"Approach to Total Laparoscopic Hysterectomy and Longitudinal Vaginal Septum Resection in a Uterus Bicornuate, Bicollis",Crihfield E,Alviar D,Crihfield E; Alviar D,Journal of Minimally Invasive Gynecology,NA,2023,11,crossref,AAGL2023_084
10.7759/cureus.60645,An Uncommon Encounter: Obstetric Management of a Bicornuate Bicollis Uterus With a Longitudinal Vaginal Septum,Moharana B,Gangane N,Moharana B; Choudhary A; Yadav A; Gangane N,Cureus,NA,2024,05,crossref,AAGL2023_084
10.54905/disssi/v27i133/e169ms2816,Tackling infertility in a case of bicornuate bicollis uterus with longitudinal vaginal septum: An arduous clinical challenge,Goyal N,Halani D,Goyal N; Agrawal M; Dewani D; Reddy M; Halani D,Medical Science,NA,2023,03,crossref,AAGL2023_084
10.1007/s10304-024-00559-0,Primäre ausgeprägte Dysmenorrhö bei unerkanntem Uterus bicornis bicollis mit verschlossenem Vaginalseptum,Spaich K,Germeyer A,Spaich K; Germeyer A,Gynäkologische Endokrinologie,NA,2024,05,crossref,AAGL2023_084
10.1007/s41975-025-00392-z,Primäre ausgeprägte Dysmenorrhö bei unerkanntem Uterus bicornis bicollis mit verschlossenem Vaginalseptum,Spaich K,Germeyer A,Spaich K; Germeyer A,Journal für Gynäkologische Endokrinologie/Schweiz,NA,2025,06,crossref,AAGL2023_084
10.1016/j.jmig.2021.09.005,Go Wide before Closing in: A Safe Approach to Minimally Invasive Hysterectomy for a Large Broad Ligament Leiomyoma,Kashi K,Kashi K,Kashi K,Journal of Minimally Invasive Gynecology,NA,2021,11,crossref,AAGL2021_004
10.1016/j.jmig.2023.08.252,9625 Laparoscopic Retrograde Hysterectomy for a Large Broad Ligament Fibroid,Sakate S,Andou M,Sakate S; Ochi Y; Andou M,Journal of Minimally Invasive Gynecology,NA,2023,11,crossref,AAGL2021_004
10.1016/j.jmig.2025.09.448,"14244 Subtotal Hysterectomy with Large Paracervical Broad Ligament Fibroid Using the ""Terraces Rice Fields Technique.""",Nash R,Lam A,Nash R; Lam A,Journal of Minimally Invasive Gynecology,NA,2025,11,crossref,AAGL2021_004
10.1016/j.jmig.2022.09.344,7911 Laparoscopic Intraligamentous Broad Ligament Leiomyoma Myomectomy and Closure,Hsu R,Kliethermes C,Hsu R; Rausch J; Kliethermes C,Journal of Minimally Invasive Gynecology,NA,2022,11,crossref,AAGL2021_004
10.1016/j.jmig.2024.09.846,11797 vNOTES Hysterectomy Technique in a Case With Big Broad Ligament Fibroid,Naval S,Naval S,Naval S,Journal of Minimally Invasive Gynecology,NA,2024,11,crossref,AAGL2021_004
10.1016/j.jmig.2021.09.022,Robotic Trachelectomy for Cervical Myoma after Partial Hysterectomy,Corinti M,Barison G,Corinti M; Cutrim P; Pessoa P; Alvarenga-Bezerra V; Vieira Gomes M; Barison G,Journal of Minimally Invasive Gynecology,NA,2021,11,crossref,AAGL2021_021
10.1136/ijgc-2022-igcs.591,SF031/#895 Single-port robotic hysterectomy after the previous trachelectomy,Choi B,Jung G,Choi B; Lee K; Jung G,On-Demand Surgical Films,NA,2022,12,crossref,AAGL2021_021
10.1016/j.jmig.2022.09.242,Single Port Robotic Hysterectomy after the Previous Robotic Radical Trachelectomy,Choi B,Jung G,Choi B; Lee K; Jung G,Journal of Minimally Invasive Gynecology,NA,2022,11,crossref,AAGL2021_021
10.1016/j.ygyno.2026.01.198,Evaluating birth outcomes in early cervical cancer after trachelectomy versus hysterectomy: A cost-effective analysis,Barger A,Huepenbecker S,Barger A; Walker A; Huepenbecker S,Gynecologic Oncology,NA,2026,02,crossref,AAGL2021_021
10.1007/s11701-025-02540-w,Robotic radical trachelectomy in early stage cervical cancer,Heras M,Coronado P,Heras M; Gracia M; Coronado P,Journal of Robotic Surgery,NA,2025,07,crossref,AAGL2021_021
10.1016/j.jmig.2021.09.033,Tips and Tricks for Diaphragmatic Endometriosis Resection and Management of Iatrogenic Pneumothorax,Dejenie M,Stuparich M,Dejenie M; Singh M; Behbehani S; Nahas S; Stuparich M,Journal of Minimally Invasive Gynecology,NA,2021,11,crossref,AAGL2021_032
10.4103/gmit.gmit_125_22,Treatment of Iatrogenic Pneumothorax during Resection of Diaphragmatic Endometriosis using a Laparoscopic Suction Irrigator: A Simple Approach,Singh M,Stuparich M,Singh M; Dejenie M; Behbehani S; Nahas S; Handler S; Stuparich M,Gynecology and Minimally Invasive Therapy,NA,2023,10,crossref,AAGL2021_032
10.62830/mmj2-03-15c,Endometriosis Presenting as Pneumothorax: Rare Entity of Thoracic Endometriosis Syndrome — A Case Report and Review of Literature,Bansal S,Bansal S,Bansal S,Endometriosis Presenting as Pneumothorax: Rare Entity of Thoracic Endometriosis Syndrome — A Case Report and Review of Literature,"Endometriosis affects roughly 10% (190 million) of women and girls of reproductive age globally, having significant social, public health and economic implications. It can decrease quality of life due to severe pain, fatigue, depression, anxiety and infertility. It can present as varied symptoms but presentation as pneumothorax is not only rare but difficult to diagnose. We report a case of a 45-year-old female presenting with recurrent right-sided pneumothorax coinciding with her menstrual cycle. Surgical exploration confirmed the diagnosis. The patient underwent a right-sided video-assisted thoracoscopic surgery (VATS) with repair of diaphragmatic fenestrations and pleurodesis. There was no recurrence of symptoms on follow-up. This case highlights the importance of a high index of suspicion in reproductive-aged women with recurrent pneumothorax. This entity is also termed as catamenial pneumothorax (CP).",2025,09,crossref,AAGL2021_032
10.1302/3114-221012,Strategic Tips and Tricks for Frozen Shoulder Arthroscopic Management,NA,NA,,OrthoMedia,NA,2022,02,crossref,AAGL2021_032
10.1201/9781003567080-6b,Tips &amp; Tricks in the Percutaneous Treatment of Iatrogenic Femoral Pseudoaneurysms,Solimeno G,Solimeno G,Solimeno G,Tips and Tricks in Endovascular Surgery,NA,2025,10,crossref,AAGL2021_032
10.1016/j.jmig.2021.09.345,Complicated Laparoscopic Trachelectomy Following Supracervical Hysterectomy,Sutaria T,Marfori C,Sutaria T; Barnes W; Marfori C,Journal of Minimally Invasive Gynecology,NA,2021,11,crossref,AAGL2021_074
10.1016/j.jmig.2023.08.363,10310 Stepwise Approach to Laparoscopic Trachelectomy Following Supracervical Hysterectomy,Lin E,Chao L,Lin E; Sendukas E; Young R; Chao L,Journal of Minimally Invasive Gynecology,NA,2023,11,crossref,AAGL2021_074
10.5468/ogs.22094,Surgical outcomes of laparoscopic trachelectomy following supracervical hysterectomy: a multicenter study,Dawood A,Soliman A,Dawood A; Harras H; Moussa H; Soliman A,Obstetrics &amp; Gynecology Science,"ObjectiveTo evaluate the feasibility, safety, and surgical outcomes of laparoscopic trachelectomy after supracervical hysterectomy.MethodsThis multicenter study was conducted at Tanta University, Benha University, and Aminah Laparoscopy Center (Benha, Egypt) from June 1, 2018 to October 31, 2021. Forty patients were recruited for this study and counseled on laparoscopic trachelectomy to treat their symptoms after supracervical hysterectomy. Furthermore, cervical biopsy was performed to detect and exclude any malignancy. Histopathological examination of cervical specimens was performed after surgery. Operative details and outcomes were recorded.ResultsThe median age of the patients was 42 years (range, 38-47). The median body mass index was 25 years (range, 22- 28). The median interval between hysterectomy and the clinical presentation was 4.40 years (range, 3.58-5.25). Most patients presented with abnormal vaginal discharge (40%) and bleeding (25%). Moreover, a cervical biopsy result revealed stump carcinoma in three cases (7.5%) that were excluded. The median operative time was 210 minutes (range, 170-220). The median blood loss was 270 mL (range, 220-320). Additionally, histopathological examinations revealed that chronic non-specific cervicitis was present in 54.05% of trachelectomy specimens. There were no significant differences between symptomatic and asymptomatic patients regarding operative outcomes, except adhesions, which were more significantly increased in symptomatic patients (P=0.015). Minimal complications, both operative and postoperative, were related to the procedure.ConclusionAlthough the operative time was long and adhesions were common during laparoscopic trachelectomy, the procedure was feasible and safe, with minimal complications.",2022,11,crossref,AAGL2021_074
10.21608/ejhm.2023.318792,The Interval between a Supracervical Hysterectomy and Trachelectomy. What Led to an Early or Late Trachelectomy?,NA,NA,,The Egyptian Journal of Hospital Medicine,NA,2023,07,crossref,AAGL2021_074
10.1017/9781009128377.011,Total and Supracervical Laparoscopic Hysterectomy at Sacrocolpopexy: Procedure Steps and Evidence,NA,NA,,Laparoscopic Urogynecology,NA,2022,09,crossref,AAGL2021_074
10.1016/j.jmig.2021.09.369,Complicated Hysteroscopic Removal of Retained IUD Fragment,Palacios-Helgeson L,Mohling S,Palacios-Helgeson L; Mohling S,Journal of Minimally Invasive Gynecology,NA,2021,11,crossref,AAGL2021_098
10.1016/j.jmig.2025.09.122,Surgical Techniques for Hysteroscopic Removal of an Embedded IUD Fragment,Spielman S,Oshinowo A,Spielman S; Crifase C; Dadrat A; Oshinowo A,Journal of Minimally Invasive Gynecology,NA,2025,11,crossref,AAGL2021_098
10.1016/j.ajog.2022.12.286,“Push-pull”: a technique for hysteroscopic removal of a deeply embedded iud fragment,Mann P,Nguyen B,Mann P; myo m; Nguyen B,American Journal of Obstetrics and Gynecology,NA,2023,03,crossref,AAGL2021_098
10.1016/j.jmig.2022.09.224,Hysteroscopic Removal of Deeply Embedded IUD,Voigt P,Wagner E,Voigt P; McEntee K; Wagner E,Journal of Minimally Invasive Gynecology,NA,2022,11,crossref,AAGL2021_098
10.1016/j.jmig.2025.04.005,Office Hysteroscopic Removal of Embedded IUD in Early Pregnancy,Youssef Y,Chudnoff S,Youssef Y; To J; Chudnoff S,Journal of Minimally Invasive Gynecology,NA,2026,02,crossref,AAGL2021_098
10.1016/j.jmig.2022.09.026,AI-Derived Threshold Score of Intraabdominal Myoelectrical Activity Predicts Presence and Stage of Endometriosis with 100% Accuracy,Noar M,Noar M,Noar M,Journal of Minimally Invasive Gynecology,NA,2022,11,crossref,AAGL2022_010
10.1007/s00464-022-09642-8,Gastric myoelectrical activity based AI-derived threshold predicts resolution of gastroparesis post-pyloric balloon dilation,Noar M,Khan S,Noar M; Khan S,Surgical Endoscopy,NA,2023,03,crossref,AAGL2022_010
10.20944/preprints202404.0527.v1,Gastrointestinal Myoelectrical Activity (GIMA) Biomarker for Noninvasive Diagnosis of Endometriosis,Noar M,Kolatkar A,Noar M; Mathias J; Kolatkar A,NA,"Background/Objectives: Endometriosis represents substantial direct and indirect healthcare costs impacted by absent accurate, non-invasive uniformly diagnostic tools. We endeavored to demonstrate gastrointestinal myoelectrical activity (GIMA) biomarkers unique to endometriosis allow noninvasive, uniformly accurate diagnosis or exclusion of endometriosis. Methods: Prospective open-label comparative study of 154 patients, age &amp;amp;gt;18, with or without diagnosed endometriosis. Population included 62 non-endometriosis controls (Cohort 1), 43 subjects with surgically histologically-confirmed endometriosis (Cohort 2), and 49 subjects with abdominal pain and negative imaging (Cohort 3). Electroviscerography (EVG) recorded GIMA biomarkers from three abdominal electrodes before and 30-minutes post water-load protocol. Cohort 2 had postoperative EVG and Cohort 3 had preoperative EVG. Calculated specificity, sensitivity, NPV, PPV and predictive probability or C-Statistic used univariate, multivariate, linear and logistical regression analyses of the area under the curve (AUC) at all frequency and time points, including age and pain covariants. Results: Non-endometriosis cohort differed significantly from endometriosis cohorts (p&amp;amp;lt;0.001) for median (IQR), and AUC percent frequency distribution of power at baseline, 10-minute, 20-minute, and 30-minute post water-load at all frequency ranges 15-20cpm, 30-40cpm and 40-50cpm. Endometriosis cohorts were statistically similar (p&amp;amp;gt;0.05). GIMA biomarker threshold scoring demonstrated 95%/91% sensitivity and PPV, 96%/95% specificity and NPV and C-statistic of &amp;amp;gt;99%/98% respectively for age subsets. GIMA biomarkers in Cohort 3 predicted 47/49 subjects positive and 2/49 negative for endometriosis, confirmed surgically. Hormonal therapy, surgical stage, nor pain score affected diagnostic accuracy. Conclusions: Non-invasive electroviscerography with GIMA biomarker detection distinguished participants with and without endometriosis based upon endometriosis specific GIMA biomarkers threshold scoring.",NA,01,crossref,AAGL2022_010
10.3390/jcm13102866,Gastrointestinal Myoelectrical Activity (GIMA) Biomarker for Noninvasive Diagnosis of Endometriosis,Noar M,Kolatkar A,Noar M; Mathias J; Kolatkar A,Journal of Clinical Medicine,"Background/Objectives: Endometriosis represents substantial direct and indirect healthcare costs impacted by an absence of uniformly accurate, non-invasive diagnostic tools. We endeavored to demonstrate gastrointestinal myoelectrical activity (GIMA) biomarkers, unique to endometriosis, will allow non-invasive, uniformly accurate diagnosis or exclusion of endometriosis. Methods: Prospective open-label comparative study of 154 patients, age ≥ 18, with or without diagnosed endometriosis. Population included 62 non-endometriosis controls (Cohort 1), 43 subjects with surgically/histologically confirmed endometriosis (Cohort 2), and 49 subjects with abdominal pain and negative imaging (Cohort 3). Non-invasive electroviscerography (EVG) recorded GIMA biomarkers from three abdominal electrodes before and 30 min post water load protocol. Cohort 2 had postoperative EVG and Cohort 3 had preoperative EVG. Calculated specificity, sensitivity, negative predictive value (NPV), positive predictive value (PPV), and predictive probability or C-statistic used univariate, multivariate, linear, and logistical regression analyses of the area under the curve (AUC) at all frequency and time points, including age and pain covariants. Results: The non-endometriosis cohort differed significantly from the endometriosis cohorts (p &lt; 0.001) for median (IQR) and AUC percent frequency distribution of power at baseline, 10 min, 20 min, and 30 min post water load at all frequency ranges: 15–20 cpm, 30–40 cpm, and 40–50 cpm. The endometriosis cohorts were statistically similar (p &gt; 0.05). GIMA biomarker threshold scoring demonstrated 95%/91% sensitivity and PPV, 96%/95% specificity and NPV, and a C-statistic of &gt;99%/98%, respectively, for age subsets. GIMA biomarkers in Cohort 3 predicted 47/49 subjects positive and 2/49 negative for endometriosis, confirmed surgically. Hormonal therapy, surgical stage, nor pain score affected diagnostic accuracy. Conclusions: EVG with GIMA biomarker detection distinguished participants with and without endometriosis based upon endometriosis-specific GIMA biomarkers threshold scoring.",2024,05,crossref,AAGL2022_010
10.1016/j.jmig.2025.09.027,Defining the Role of the Gastrointestinal Myoelectrical Activity (GIMA) Biomarker in the Diagnosis of Endometriosis.,Tanos P,Karampelas S,Tanos P; Donders F; Massaro A; Philippe S; Karampelas S,Journal of Minimally Invasive Gynecology,NA,2025,11,crossref,AAGL2022_010
10.1016/j.jmig.2022.09.031,The Role of Endometriosis-Specific MRI Protocol in the Diagnosis and Management of Patients with Endometriosis-Related Pain,Luna-Russo M,Kho R,Luna-Russo M; Markwei M; Fan C; Yao M; Kho R,Journal of Minimally Invasive Gynecology,NA,2022,11,crossref,AAGL2022_015
10.1007/978-3-031-50662-8_10,"Role of Ultrasonography in the Diagnosis of Endometriosis in Infertile Women: Ovarian Endometrioma, Deep Endometriosis, and Superficial Endometriosis",Manieri Rocha R,Condous G,Manieri Rocha R; Leonardi M; Condous G,Endometriosis-related Infertility,NA,2024,01,crossref,AAGL2022_015
10.1177/22840265261427196,Corrigendum to “Endometriosis related pelvic pain following laparoscopic surgical treatment.”,NA,NA,,Journal of Endometriosis and Pelvic Pain Disorders,NA,2026,03,crossref,AAGL2022_015
10.1177/22840265231170912,Diagnosis and management of thoracic endometriosis syndrome: Case report,Murphy Shaw A,Spitzer T,Murphy Shaw A; Demarco K; Belovs L; Strange R; Spitzer T,Journal of Endometriosis and Pelvic Pain Disorders,"Introduction: While the diagnosis of endometriosis is relatively common, thoracic endometriosis is a rare manifestation. Thoracic Endometriosis Syndrome (TES) most commonly presents with pneumothorax, 3% which are bilateral, making this case unique in the already limited breadth of TES with catamenial hemopneumothorax. Additionally, this patient had laboratory values constant with ovarian suppression yet continued menses and recurrent hemopneumothorax, necessitating surgical intervention. We propose that with this severity of disease a combination of surgical intervention and hormonal therapy is the ideal approach, providing the lowest rate of recurrence. Case description: A 33 year old woman with 2-day history of chest pain and shortness of breath with heavy menstrual cycles and significant dysmenorrhea. A chest radiograph and computed tomography scan revealed right-sided pneumothorax and bilateral hemothoraces with left-sided diaphragmatic hernia. Video-assisted thoracoscopic surgery confirmed sanguinous pleural effusions and biopsy proven endometriotic lesions. The patient was started on a gonadotropin-releasing hormone agonist and experienced short-interval recurrence of her symptoms. An aromatase inhibitor was added to her regimen and she underwent a left diaphragmatic hernia repair. Conclusions: The recurrence of symptoms despite complete hypothalamic-pituitary-ovarian axis suppression, in addition to the surgical requirements and findings make this case unique in the already limited breadth of thoracic endometriosis syndrome with catamenial hemopneumothorax. ",2023,06,crossref,AAGL2022_015
10.1201/9780429488115-6,Pain Management Strategies and Alternative Therapies,Wartan S,Wartan S,Wartan S,Endometriosis,NA,2022,06,crossref,AAGL2022_015
10.1016/j.jmig.2022.09.048,Differences in Route of Benign Hysterectomy in Black Patients for Abnormal Uterine Bleeding with Exclusion of Fibroid Diagnosis,Palacios-Helgeson L,Gould C,Palacios-Helgeson L; Osmundsen B; Gould C,Journal of Minimally Invasive Gynecology,NA,2022,11,crossref,AAGL2022_030
10.1017/9781009003674.079,A 40-Year-Old G4P4 Woman with 16-Week-Size Fibroid Uterus and Abnormal Uterine Bleeding Desiring Hysterectomy,Webb C,Webb C,Webb C,Surgical Gynecology,NA,2021,12,crossref,AAGL2022_030
10.4103/asl.asl_72_22,Ayurvedic Management of Abnormal Uterine Bleeding in Uterine Fibroid,Rajoria K,Singh S,Rajoria K; Singh S,Ancient Science of Life,"Summary
          Abnormal uterine bleeding (AUB) is the most common gynecological problem and is often accompanied with uterine fibroid. Very limited options are available in biomedicine for the AUB. In this reported case, AUB associated with stasis dermatitis was managed on the line of treatment of Vataja Yonivyapada with satisfactory results. This is a case of AUB in uterine fibroid associated with stasis dermatitis in the left lower limb of a 39-year-old female. Gokshuradi Guggulu 750 mg, Shatavari Churna - 2 g, Gairika - 500 mg, and Mukta Shukti Pishti - 500 mg were given twice a day for 18 months, Pushyanuga Churna - 2 g, Chandraprabha Vati - 250 mg, and Arsha Kuthara Rasa 250 mg twice a day for 8 months, and Gokshura churna - 2 g twice a day for 14 months were given to her as oral medication. Jatyadi taila was applied locally twice a day on affected area for 17 months. Four sets of Anuvasana Basti (medicated oil enema), one set of Raktamokshana (therapeutic bloodletting) with Alabu, and three sets of Raktamokshana with Shringa were also adopted in 14 months of treatment duration. After 14 months of treatment, the size of the bulky uterus was reduced from 108 mm × 76 mm × 70 mm in May 2018 to 102 mm × 64 mm × 55 mm in May 2019 and from 7.0 to 6.6 mm in endometrium thickness. The fibroid was resolved, and abnormal bleeding was arrested. This case demonstrates that Ayurveda oral medication and Panchakarma based on the management of Vataja Yonivyapada may be useful in AUB associated with stasis dermatitis.",2024,01,crossref,AAGL2022_030
10.1891/9780826144676.0054,Abnormal Uterine Bleeding,NA,NA,,Formulating a Differential Diagnosis for the Advanced Practice Provider,NA,2022,04,crossref,AAGL2022_030
10.2139/ssrn.4925453,Uterine Necrosis Requiring Hysterectomy after Transcervical Uterine Fibroid Radiofrequency Ablation,Cline B,Doytcheva K,Cline B; Eastman L; Doytcheva K,NA,NA,NA,01,crossref,AAGL2022_030
10.1016/j.jmig.2022.09.057,Laparoscopic Modified McCall Culdoplasty,Foxx A,Till S,Foxx A; Whitmore G; Till S,Journal of Minimally Invasive Gynecology,NA,2022,11,crossref,AAGL2022_038
10.1007/s00192-024-05886-1,A Modified McCall Culdoplasty in Pelvic Organ Prolapse Surgery: Anatomical and Functional Outcomes,Ettore G,Ettore C,Ettore G; Torrisi G; Grimaldi R; Ettore C,International Urogynecology Journal,NA,2024,12,crossref,AAGL2022_038
10.1016/j.tjog.2022.11.013,McCall culdoplasty vs. vaginally assisted laparoscopic sacrocolpopexy in the treatment of advanced uterine prolapse: A randomized controlled study,Karadag B,Tatar S,Karadag B; Mulayim B; Karadag C; Akdaş B; Karataş S; Yüksel B; Tatar S,Taiwanese Journal of Obstetrics and Gynecology,NA,2023,03,crossref,AAGL2022_038
10.1016/j.ejogrb.2022.01.012,Fixation of uterosacral ligaments to anterior vaginal wall during modified McCall culdoplasty after vaginal hysterectomy,Mancarella M,Sgro L,Mancarella M; Testa F; Chiadò Piat F; Novara L; Biglia N; Sgro L,European Journal of Obstetrics &amp; Gynecology and Reproductive Biology,NA,2022,03,crossref,AAGL2022_038
