pmid,doi,epmc_title,epmc_first_author,epmc_journal,epmc_year,epmc_abstract,source,epmc_strategy,abstract_id
41939010,10.1016/j.lanepe.2026.101652,Clinical presentation and hospitalisation risk of RSV in primary care among children younger than 5 years in Italy in four seasons between 2019 and 2023: a multicentre prospective cohort study.,"Baglivo F, Bracaloni S, Esposito E, Tecchio F, Casini B, Pistello M, Panatto D, Orsi A, Massaro E, Chironna M, Centrone F, Pariani E, Pellegrinelli L, Pandolfi E, Croci I, RSVComNet Ita Network, Rizzo C.",NA,2026,"<h4>Background</h4>Respiratory syncytial virus (RSV) significantly contributes to pediatric morbidity globally. Severe cases are more common in infants and children with underlying health conditions, but even mild infections can result in long-term respiratory issues. While the RSV disease is well-documented in hospital settings, its clinical presentation and hospitalization risk in primary care, the initial point of healthcare access, remains unclear.<h4>Methods</h4>We conducted a multi-center prospective cohort study across multiple regions in Italy during four seasons (from 2019 to 2020 to 2023-2024), excluding 2020-2021. Children ≤5 years with acute respiratory infection (ARI), meeting the WHO case definition for community-based surveillance, were enrolled through primary care pediatricians. Nasopharyngeal swabs were collected and tested with RT-PCR. Clinical data were collected at baseline for all participants and at follow-up intervals of 14 and 30 days post-enrollment for RSV-positive children.<h4>Findings</h4>Among 1410 enrolled children with ARIs, RSV was laboratory-confirmed in 40.2% (n = 566). The mean duration of illness among RSV-positive children was 15.2 days (SD 8.8 days), with symptoms persisting in 40.9% of cases at day 14 and 15.4% at day 30. Hospitalization occurred in 4.4% (25/566) of RSV-positive cases, with a median hospital stay of 5 days (IQR: 4-7 days). Younger age was identified as the primary predictor of hospitalization (observed hospitalization rate of 16.2% in children under 6 months), with an estimated hospitalization risk of 12.5% at birth (95% CI: 3.4-33.1%). Fever did not differentiate RSV infection from other respiratory pathogens (p = 0.084).<h4>Interpretation</h4>Our study highlights the significant hospitalization risks associated with RSV infections among children presenting in primary care settings, offering detailed age-specific risk estimates crucial for accurate health technology assessments (HTAs) of preventive strategies. The findings strongly support exploring the expansion of RSV preventive interventions beyond the conventional age threshold of 24 months, considering the persisting risk in older children. Furthermore, we emphasize the importance of adopting a case definition without a mandatory fever criterion to enhance the sensitivity of RSV surveillance and thus improve the validity of disease-related estimates.<h4>Funding</h4>RSV ComNet is a collaborative study funded by Sanofi and AstraZeneca. Study design and planning were undertaken in collaboration with Sanofi researchers. All data collection, analyses, interpretation, manuscript drafting, and the decision to submit for publication were performed independently by the authors. No datasets were shared with the funding parties.",europmc,author_broad_kw,AAGL2023_033
41548724,10.1016/j.gie.2026.01.007,"Long-term Outcomes of endoscopic ultrasound-guided Gastroenterostomy (LONG-RANGE study): a prospective cohort study tracking symptom recurrence, reintervention timelines and stent modifications over time.","Vanella G, Frigo F, Perelli F, Barà R, Leone R, Stasio RC, Maisonneuve P, Partelli S, Aleotti F, Orsi G, Macchini M, Balzano G, Reni M, Falconi M, Capurso G, Arcidiacono PG.",NA,2026,"<h4>Background and aims</h4>Limited information is available on long-term outcomes of EUS-guided gastroenterostomy (EUS-GE) and modifications of lumen-apposing metal stents (LAMSs) over time.<h4>Methods</h4>All consecutive EUS-GEs for malignant indications between 2020 and 2024 were enrolled in a single-center prospective registry (Prospective Registry of Therapeutic, ClinicalTrials.gov NCT04813055). The primary outcomes were EUS-GE dysfunctions and dysfunction-free survival (DyFS) using Kaplan-Meier curves. Endoscopic and radiologic reassessments were used to estimate local modifications and LAMS diameter over time (linear regression).<h4>Results</h4>A total of 166 EUS-GEs (median age 66 [IQR 60-73] years; male 53.6%; pancreatic cancer, 74.1%) were included. A 20-mm LAMS dilated to 18 mm was used in 98.8%. Technical and clinical success rates were 98.8% and 95.7%, respectively. Adverse events were registered in 16.3% (procedure-related, 7.2%). Over a median follow-up of 128 (64-245) days, symptom recurrence occurred in 11%, but was related to EUS-GE dysfunctions in 13 of 154 cases (8.4%), after a median of 209 (85-347) days. All endoscopic reinterventions were successful. Estimated DyFS at 6 and 12 months was 96.7% and 82%, respectively. At endoscopic re-evaluations (47 patients, 61 endoscopies), peri-LAMS tissue reactions were observed in 38.3% after 269 (79-390) days whereas LAMS modifications (mostly ingrowth) were observed in 19.1% after 421 (231-560) days. Radiologic follow-up (89 patients, 168 CT scans) revealed a reduction in LAMS diameter of ≈0.21 mm ± 0.03 every month (F-test; P <.0001).<h4>Conclusions</h4>Clinically overt EUS-GE dysfunctions are rare and successfully endoscopically amenable, discouraging scheduled surveillance in malignancies. However, LAMSs show predictable narrowing, sustained by subclinical local reactions, which might inform surveillance in benign indications.",europmc,author_broad_kw,AAGL2023_033
38845288,10.1016/j.ejim.2024.05.034,Relationship between degree of risk factor control and all-cause mortality in individuals with type 2 diabetes: A prospective cohort study.,"Garofolo M, Penno G, Solini A, Orsi E, Vitale M, Resi V, Bonora E, Fondelli C, Trevisan R, Vedovato M, Nicolucci A, Pugliese G, Renal Insufficiency And Cardiovascular Events (RIACE) Study Group.",NA,2024,"<h4>Aims</h4>To assess whether and to what extent excess risk of all-cause death is reduced in individuals with type 2 diabetes by achieving optimal control of traditional cardiovascular risk factors.<h4>Methods</h4>This observational, prospective, cohort study enrolled 15,773 Caucasian patients in 19 Italian centres in 2006-2008. Participants were stratified according to the number of the following risk factors outside target: haemoglobin A<sub>1c</sub>, blood pressure, micro/macroalbuminuria, current smoking, LDL cholesterol, and triglycerides. All-cause mortality was retrieved for 15,656 patients (99.3 %) on 31 October 2015.<h4>Results</h4>Age-adjusted mortality rates and hazard ratios were significantly higher in the whole RIACE cohort (by ∼20 %) and in patients with (by ∼100 %) but not in those without prior cardiovascular disease (CVD), as compared with the coeval Italian general population. In all patients and in those without prior CVD, the relationship with mortality according to the number of risk factors outside target was J-shaped, an effect that was attenuated after either excluding ""overtreated "" patients, i.e., those with haemoglobin A<sub>1c</sub> ≤6.0 % on anti-hyperglycaemic agents causing hypoglycaemia and/or systolic blood pressure ≤120 mmHg on anti-hypertensive agents, or adjusting for ""overtreatment"". Conversely, in patients with prior CVD, mortality remained higher than in the general population in all categories and increased progressively from +70 % to +314 %, without J-effect.<h4>Conclusions</h4>In patients with type 2 diabetes, optimal treatment of traditional cardiovascular risk factors completely eliminated the excess mortality risk versus the general population, provided that they were not ""overtreated"". However, this effect was observed only in participants without history of CVD.<h4>Trial registration</h4>ClinicalTrials.gov, NCT00715481, retrospectively registered 15 July 2008.",europmc,author_broad_kw,AAGL2023_033
37495092,10.1016/j.jmig.2023.07.010,Analysis of Sociodemographic Factors Affecting Ambulatory Surgical Center Discharge Patterns for Endometrial Cancer Hysterectomies.,"Wang SM, Moore C, Keegan E, Mayer C, Litman E, Das KJH, Wu CZ, Chappell NP.",NA,2023,"<h4>Study objective</h4>Investigate outcomes for patients undergoing minimally invasive hysterectomies (MIHs) performed for endometrial cancer at ambulatory surgery centers (ASCs).<h4>Design</h4>Our study aimed to explore the feasibility and discharge outcomes for MIHs for endometrial cancer in an ASC setting by using same-day discharge data.<h4>Setting</h4>The prevalence of MIH for endometrial cancer between 2016 and 2019 was estimated from the Nationwide Ambulatory Surgery Sample.<h4>Patients</h4>Patients who underwent MIHs for endometrial cancer at an ASC were included.<h4>Interventions</h4>N/A MEASUREMENTS MAIN RESULTS: Weighted estimates of prevalence and association between discharge status and sociodemographic factors were explored. Same-day discharge was defined as discharge on the day of surgery, and delayed discharge was defined as discharge after the day of surgery. An estimated 95 041 MIHs for endometrial cancer were performed at ASCs between 2016 and 2019. Notably, 91.9% (n = 87 372) resulted in same-day discharge, 1.2% (n = 1121) had delayed discharge, and 6.9% (n = 6548) had missing discharge information; 78.7% procedures (n = 68 812) were performed at public hospitals. The proportion of delayed discharges were lower in private, not-for profit ASCs (0.8%, p = .03) than public hospitals. Patients who had delayed discharges on average were older (69.7 vs 62.4 years, p <.001), more likely to have comorbid conditions including diabetes (adjusted odds ratio [aOR] 1.48, 95% confidence interval [CI] 1.25-1.75) and overweight or obese body mass indices (aOR 1.18, 95% CI 1.01-1.39), and more likely to have public insurance (aOR 1.78, 95% CI 1.40-2.25).<h4>Conclusion</h4>MIHs for endometrial cancer are feasible in an ASC. Optimal candidates for receipt of MIHs for endometrial cancer at an ASC are patients who are younger and have less comorbidities, lower body mass index, and private insurance.",europmc,author_title_kw,AAGL2023_034
41872694,10.1111/petr.70302,Sociodemographic and Clinical Factors Impact Non-Live Vaccine Coverage After Pediatric Solid Organ Transplantation: A Single Center Study.,"Blatt AZ, Wang Y, Chang YC, Heston SM.",NA,2026,"<h4>Background</h4>Pediatric solid organ transplant (SOT) recipients are at increased risk of vaccine preventable diseases (VPD) due to both under-vaccination and ineffective responses to vaccines while immunosuppressed. Current guidelines recommend timely post-transplant immunization with non-live vaccines and surveillance of vaccine-specific titers to assess vaccine responses; however, institutional adherence to these recommendations may be variable.<h4>Methods</h4>This single-center retrospective study of 199 pediatric SOT recipients (59 heart, 10 intestinal/multi-visceral, 34 kidney, and 96 liver) evaluated guideline adherence to post-vaccine serologic monitoring and identified sociodemographic and clinical factors associated with delayed and incomplete schedules for routine childhood non-live vaccines after transplant.<h4>Results</h4>Serologic monitoring was utilized after only 8% of recommended vaccines, while participants' age at transplant (odds ratio [OR], 95% confidence interval [CI]: 0.86, 0.81-0.91), receipt of a heart transplant (OR, 95% CI: 0.32, 0.17-0.60), and coverage with private insurance (OR, 95% CI: 0.46, 0.25-0.85) were factors negatively associated with timely initiation or completion of non-live vaccines after transplant.<h4>Conclusions</h4>The associations between age at transplant, heart transplantation, and type of insurance with under-immunization warrant further investigation to address modifiable gaps in vaccine coverage and ensure pediatric SOT recipients are optimally protected from VPD.",europmc,author_broad_kw,AAGL2023_034
41448641,10.1093/joccuh/uiaf077,Young adults with a history of depression and/or anxiety: the role of sociodemographic and health-related factors in not being sickness absent.,"Narusyte J, Alaie I, Ropponen A, Wang M, Svedberg P.",NA,2026,"<h4>Objectives</h4>The continuity of mental health problems from childhood to adulthood is well acknowledged, as is the impact on work ability. However, knowledge is scarce about individuals who maintain work ability and have no sickness absence (SA), despite mental health problems. The aim was to identify sociodemographic and health-related factors among private and public employees with a history of depression and/or anxiety, and no SA.<h4>Methods</h4>This prospective cohort study included 9039 Swedish twin individuals born between 1975 and 1986, with and without a history of depression and/or anxiety, and employed in the private or public sectors. Survey data from 2005 were used to classify self-rated depression, anxiety, and overall health. Data on SA, education, occupational class, outpatient health care use, and prescribed antidepressants were obtained from national registries. Participants were prospectively followed for SA from 2006 to 2020. Logistic regression analyses were applied to calculate odds ratios (ORs) with 95% CIs.<h4>Results</h4>Approximately 37% of individuals with previous depression and/or anxiety were not on SA during follow-up, compared with 54% of those without such history. Lower use of antidepressants implied higher odds for no SA among both private (OR: 2.09; 95% CI, 1.64-2.66) and public (OR: 2.38; 95% CI, 1.78-3.19) employees with previous depression and/or anxiety. Having fewer visits to outpatient health care was significantly associated with no SA (ORs: 2.22-3.60). Being a white-collar worker implied higher odds for no SA only among those privately employed (OR: 1.39; 95% CI, 1.10-1.76).<h4>Conclusions</h4>Primarily, health-related factors seemed to play a role in no SA among young employees with previous depression and/or anxiety.",europmc,author_broad_kw,AAGL2023_034
40305764,10.1097/scs.0000000000011448,Don't Delay: Sociodemographic Factors Impacting Timing of Cleft Lip Repair.,"Kahramangil B, Barrera JE, Swiekatowski KR, Wang EB, Osamor CC, Dunnigan JK, Kopplin NG, Hung PW, Sobol D, Greives MR.",NA,2025,"Optimal treatment of cleft lip (CL) with or without cleft palate requires early evaluation, surgical planning, and timely repair. Sociodemographic barriers may cause delays in the treatment of patients with CL. This study aims to identify the sociodemographic and clinical factors that may delay CL repair. This IRB-approved retrospective analyzed patients treated for CL at a tertiary academic center (2015-2023). The primary outcome was age at CL surgery, with >6 months considered delayed. Surgical timing was compared across sociodemographic factors. A total of 241 patients (88 White, 72 Hispanic, 21 Black, and 60 other) were included. Of these, 84 had isolated CL and 157 had cleft lip and palate. The median repair age was 4.5 months (IQR: 3.8-5.7), with 79.3% undergoing surgery by 6 months. Delays in CL repair were more common in families with <$75,000 income (25.0% versus 14.0%; P =0.04), Medicaid insurance versus private (25.4% versus 9.7%; P <0.01), Black (18.2%) or Hispanic (27.8%) versus White patients (11.7%; P =0.049), and those with medical comorbidities (54.0% versus 15.3%, P <0.001). Nasoalveolar molding (NAM) reduced delay, whereas cleft lip adhesion (CLA) surgery increased it (10.1%, 82.4%, and 18.7% for NAM, CLA, no infant orthopedic, respectively; P <0.001). Multivariate analysis identified medical comorbidities (OR: 8.21; P <0.001) and CLA (OR 46.4, P <0.001) as strong predictors of delay, whereas NAM use predicted timely repair (OR: 0.19, P <0.01). Sociodemographic factors were not independent predictors. Institutional and state-level programs targeting these factors may help decrease the barriers to CL care.",europmc,author_broad_kw,AAGL2023_034
40413544,10.1186/s12939-025-02530-2,Epidemiological and sociodemographic transitions in the global burden and risk factors for Alzheimer's disease and other dementias: a secondary analysis of GBD 2021.,"Xu C, Jiang C, Liu X, Shi W, Bai J, Mubarik S, Wang F.",NA,2025,"<h4>Background</h4>The study aimed to analyze the long-term trends in the global burden of Alzheimer's disease and other dementias(ADOD) in different regions, and assess the association between socio-demographic index(SDI) and disease burden.<h4>Methods</h4>We extracted data on the incidence, mortality, disability-adjusted life-years(DALYs), and age-standardized rates related to ADOD, as disease burden measures from 1990 to 2021. The joinpoint regression, quantile regression and restricted cubic splines were adopted to estimate the temporal trends and relationships with SDI. Risk factors for deaths and DALYs were also analyzed.<h4>Results</h4>Globally, 9.84 million cases of ADOD occurred in 2021, with 1.95 million ADOD-related deaths, causing 36.33 million DALYs. ADOD incidence, mortality and DALYs all increased from 1990 to 2021. Regional and sex variations persisted, with the fastest increase in age-standardized death rate in low-middle SDI quintiles, experienced the highest estimated annual percentage changes (0.41[0.31,0.52]). The incidence of ADOD increased more rapidly as SDI increased in areas that have historically shown lower incidence compared to other areas. In regions with higher mortality or DALYs burden, these indicators decreased relatively faster as SDI increased. High fasting plasma glucose was the main risk factor, particularly in high SDI region, with an increasing trend in attributable burden. The burden attributable to high BMI was increasing, whereas the burden associated with smoking steadily decreased.<h4>Conclusion</h4>ADOD poses a significant and escalating challenge to healthcare sustainability, with persistent regional and gender disparities. By learning from successful ADOD management in certain nations, we can proactively reduce health burdens and bridge disparities between countries at various developmental levels.",europmc,author_broad_kw,AAGL2023_034
40460394,10.1097/gme.0000000000002543,Associations between reproductive health factors and sociodemographic characteristics and the severity of moderate to severe postmenopausal depression: a secondary analysis of randomized controlled trial data.,"Wang X, Zhang Q, Wang G, Zhou J.",NA,2025,"<h4>Objectives</h4>The cessation of the menstrual cycle is associated with numerous physiological changes and symptoms, with depression being common during perimenopause and postmenopause, causing significant impacts on one's life. The objective of this study was to explore the relationship between the severity of moderate to severe postmenopausal depression and reproductive health factors, as well as sociodemographic characteristics.<h4>Methods</h4>This secondary analysis is based on data from a randomized controlled trial conducted at both a psychiatric hospital (Beijing Anding Hospital) and a general hospital (Beijing Chaoyang Hospital) between April 2013 and September 2017. The original randomized controlled trial employed a multicenter, randomized design over an 8-week period to evaluate depression and associated clinical characteristics. Of the 189 women screened, 5 did not meet the inclusion criteria, leaving 184 eligible for this secondary analysis. The study group consisted of 184 postmenopausal women. Depression was the primary outcome, measured by a 24-item Hamilton Depression Rating Scale observer-rated scale. Quick Inventory of Depressive Symptomatology-Self-Report was used for sensitivity analysis and was considered a secondary outcome. The visual analog scale (VAS) primarily assesses physical pain symptoms. The patient's basic sociodemographic characteristics and reproductive-related information are considered secondary indicators.<h4>Results</h4>Linear regression analysis revealed that a lower age at menopause (β = -0.380; P < 0.001), married/partnered (β = -3.028; P = 0.001), higher body mass index (BMI) (β = 0.744; P < 0.001), higher VAS (β = 0.126; P < 0.001), and have chronic physical diseases (β = 2.335; P = 0.015) are significantly associated with more severe depressive symptoms in moderate to severe postmenopausal depression. Logistic regression analysis revealed that BMI [odds ratio (OR) = 1.156; 95% CI: 1.012-1.32], VAS (OR = 1.04; 95% CI: 1.017-1.063), and being single (OR = 3.658; 95% CI: 1.618-8.27) were significantly associated with an increased risk of severe depressive symptoms in postmenopausal participants, while age at menopause (OR = 0.857; 95% CI: 0.765-0.96) emerged as a protective factor.<h4>Conclusions</h4>Our findings indicate that an earlier age at menopause, being single, the presence of concomitant physical illnesses, a higher BMI, and more severe pain symptoms are associated with increased severity of moderate to severe postmenopausal depression. These results contribute to raising awareness of moderate to severe depression among postmenopausal women and underscore the importance of early diagnosis through targeted screening efforts.",europmc,author_broad_kw,AAGL2023_034
41895650,10.1016/j.jmig.2026.03.023,Author's Reply: The impact of minimally invasive gynecologic surgery subspecialty training on outcomes of benign laparoscopic hysterectomy: A retrospective cohort study.,"Meyer R, Schneyer R, Hamilton K, Levin G, Siedhoff MT, Wright KN.",NA,2026,,europmc,title_kw_only,AAGL2023_038
41891091,10.1016/j.pecinn.2026.100465,Lights camera action: Randomized control trial evaluating the impact of a preoperative instructional video on patient satisfaction following minimally invasive gynecologic surgery.,"Simko S, Animasaun N, Bergman H, Lam A, Porche M, Cruz J, Stuparich M, Nahas S.",NA,2026,"<h4>Objectives</h4>To evaluate the impact of a pre-operative instructional video for patients undergoing minimally invasive gynecologic surgery (MIGS) on patient satisfaction following surgery, pre-procedure anxiety, postoperative pain, and patient preparedness.<h4>Methods</h4>A randomized control trial was performed at an academic subspecialty gynecologic clinic. A total of 57 patients participated in the study who underwent robotic or laparoscopic surgery with same day discharge after surgery between October 2023 and March 2025. Patients were randomly assigned to 2 groups: preoperative video in addition to standard physician counseling and standard physician counseling alone prior to surgery.<h4>Results</h4>Patients who received supplemental video counseling had higher satisfaction scores compared to those in the control group. No differences were seen in preparedness levels, pre-procedural anxiety, medication compliance, narcotic use, postoperative pain, number of postoperative visits, or number of MyChart and telephone encounters.<h4>Conclusions</h4>Video counseling can be utilized to improve patient satisfaction for gynecologic surgeries. Future considerations include continued development of these tools and further study on their potential benefits for improved clinical efficiency.<h4>Innovation</h4>As technology evolves, we can continue to advance the care patients receive in the perioperative period. Audiovisual instruction can help provide patients with a visually appealing option to guide them through the steps of the recovery process and may be able to improve efficiency in the clinic visit.",europmc,title_kw_only,AAGL2023_038
