pmid,doi,epmc_title,epmc_first_author,epmc_journal,epmc_year,epmc_abstract,source,epmc_strategy,abstract_id
41783980,10.1080/17581966.2026.2635332,Addition of pulsed electric field ablation to SBRT for lung tumors: effect on health-related quality of life.,"Harris JP, Boyd C, Shi M, Reilly M, Simon A, Seyedin SN, Chen WP, Nagasaka M, Abi-Jaoudeh N, Hoyt MA.",NA,2026,"<h4>Introduction</h4>Treatment indications for oligometastatic/oligoprogressive lung tumors are growing. Safety and lack of detrimental effect on patients' quality of life are critical for novel local therapies.<h4>Methods</h4>We tested that the additive effect of pulsed electric field (PEF) ablation with lower-dose stereotactic body radiation therapy (SBRT) on health-related quality of life (HRQoL) as a secondary endpoint in a prospective clinical trial. FACT-Lung Cancer Subscale (FACT-LCS) and FACT-General domain surveys were collected at screening, 3 months, and 12 months. Functional clinical data included forced vital capacity (FVC), forced expiratory volume in one second (FEV1), and diffusing capacity of the lung for carbon monoxide (DLCO).<h4>Results</h4>Six patients with eight tumors were enrolled. Baseline well-being domain scores were: Physical 25.9 (Std Dev 2.3), Social 21.0 (Std Dev 6.9), Emotional 17.3 (Std Dev 4.7), Functional 21.2 (Std Dev 5.8), and LCS 19.4 (Std Dev 5.3). There were no significant changes following combined modality treatment in HRQoL domain scores or pulmonary function metrics after treatment. Lower EWB and SWB were associated with worse FVC and FEV1.<h4>Conclusion</h4>In this small pilot study, no clinically meaningful declines in pulmonary function or patient-reported quality of life were observed at 3 months following combination therapy.",europmc,author_broad_kw,AAGL2023_057
41824949,10.2196/77470,Effect of a Digital-Driven Physician-Pharmacist Collaborative Model for Diabetes in Primary Health Care: Cluster Randomized Trial.,"Xiao J, Wang Q, Tan S, Chen L, Xiang D, Yuan H, Li X, Huang S, Tang B, Guo Y, Huang H, Zhao D, Li Y, Wang L, Li Q, Liu J, Xu P.",NA,2026,"<h4>Background</h4>Evidence-based physician-pharmacist collaborative clinics have demonstrated significant short-term benefits for patients with type 2 diabetes (T2D), but their long-term effectiveness remains unclear, especially in primary health care settings.<h4>Objective</h4>This study aimed to explore the long-term effectiveness and cost-effectiveness of a novel, digital-driven, multifaceted physician-pharmacist collaborative model for managing patients with T2D in underresourced settings.<h4>Methods</h4>We conducted a 12-month cluster randomized controlled trial from May 2021 to December 2022 across 6 primary health care settings in China. Guided by the theory of planned behavior, the intervention involved routine therapy from physicians along with pharmaceutical interventions from pharmacists. These were delivered through a combination of face-to-face visits and mobile health care. The intervention group received 4 face-to-face visits and biweekly remote education sessions over the 12 months. We conducted intention-to-treat analyses to estimate differences in clinical and behavior indicators between the intervention and control groups. Primary outcomes included glycosylated hemoglobin and 10-year atherosclerotic cardiovascular risk. Data were analyzed using adjusted generalized estimation equations.<h4>Results</h4>This study included 574 patients (291 in the intervention group and 283 in the control group). Over 12 months, patients in the intervention group had significant reductions in hemoglobin A<sub>1c</sub> (-2.57 vs -1.96, respectively; P<.001; 95% CI -1.027 to -0.238) and 10-year atherosclerotic cardiovascular risk (-1.35 vs 0.01, respectively; P<.001; 95% CI -1.690 to -0.630) compared with the control group. Substantial improvements were also observed in several secondary outcomes, including fasting blood glucose, 2-hour postprandial blood glucose, waist circumference, waist-to-hip ratio, blood pressure, triglyceride, and total cholesterol. Total diabetes-related costs decreased, and patient satisfaction improved significantly in the intervention group. There were no significant differences in BMI, high-density lipoprotein, or low-density lipoprotein.<h4>Conclusions</h4>These findings suggest that the physician-pharmacist collaborative model could improve the long-term quality and efficiency of T2D management and reduce medical costs in underresourced areas globally. Patients with T2D, especially those with central obesity or high cardiovascular risk, may benefit more from collaborative clinics.<h4>Trial registration</h4>Chinese Clinical Trial Registry ChiCTR2000031839; https://www.chictr.org.cn/showproj.html?proj=51910.",europmc,author_broad_kw,AAGL2023_057
40899924,10.3290/j.qi.b6541914,The effect of provincial legislation on oral health in continuing care facilities.,"Chen Y, Figueiredo R, Petryk L, Levin L.",NA,2025,"<h4>Objective</h4>In Alberta, a provincial daily oral hygiene policy for continuing care facilities (CCF) was approved in 2018, and a mouth care training program was implemented in 2015. These initiatives require CCF to provide residents with twice-daily oral hygiene assistance and staff training. This study aimed to evaluate the provincial implementation scope, compliance rates, perceived impact on residents, and areas for improvement.<h4>Method and materials</h4>A web-based survey was distributed to CCF managers across Alberta, with 77 responses representing 11,653 residents.<h4>Results</h4>Overall, 66.2% of CCF managers had implemented the oral hygiene policy, and 50.6% implemented the mouth care training program. Managers implementing these policies showed a 14.3% increase in twice-daily oral hygiene provision, with 31.2% reporting improved oral cleanliness. Notably, 22.1% indicated improved resident quality of life, and 55.2% observed increased staff oral health knowledge. However, reliance on family/caregivers for oral hygiene products (79.2%) and poor attendance at external dental appointments (67.6%) were significant barriers reported by managers.<h4>Conclusion</h4>While policy implementation has positively impacted residents and staff, gaps remain in resource availability and professional support. Future policies should focus on enhancing access to oral health professionals and providing in-house dental resources.",europmc,author_broad_kw,AAGL2023_057
41621521,10.1016/j.ajog.2026.01.030,Learning curves of gynecologic residents preparing for the Essentials in Minimally Invasive Gynecologic Surgery manual skills exam.,"Hirsch M, Katz A, Wu H, Lerner V.",NA,2026,"<h4>Background and objective</h4>To describe gynecologic resident practice patterns and learning curves at a single academic institution as they prepare for the Essentials in Minimally Invasive Gynecologic Surgery manual skills exam and compare their performance metrics during practice to those of third-year residents and surgeons trained in minimally invasive gynecologic surgery. This information could provide guidance on implementing a structured Essentials in Minimally Invasive Gynecologic Surgery preparation curriculum.<h4>Study design</h4>This is a prospective observational study of gynecologic resident physicians from April 2023 to March 2025 at a single institution. Residents and their coach recorded details of their Essentials in Minimally Invasive Gynecologic Surgery practice sessions, including time-to-completion, the number of sessions, and accuracy metrics for each task repetition. Time-to-completion of skills was compared to the number of repetitions to create composite learning curves.<h4>Results</h4>The median number of repetitions for each task ranged from 5 to 12. The median number of hours spent practicing was 10. Learning curves showed the greatest rate of improvement in the first 3 to 5 repetitions. First-year residents had steeper initial learning curves than more senior residents. All residents passed the Essentials in Minimally Invasive Gynecologic Surgery manual skills exam.<h4>Conclusion</h4>This training program improved performance metrics for gynecologic residents preparing for the Essentials in Minimally Invasive Gynecologic Surgery manual skills exam. Residents needed relatively short periods of practice to achieve desired scores. Based on our findings, training programs are feasible and effective and should be initiated early in training before debut in the operating room to maximize the learning opportunities that surgical education via simulation offers.",europmc,title_kw_only,AAGL2023_061
41785985,10.1016/j.ajog.2026.02.040,Validity evidence for the Essentials in Minimally Invasive Gynecologic Surgery laparoscopic skills: correlation with the Global Operative Assessment of Laparoscopic Skills.,"Grace Chen CC, Bar-El L, Long JB, Frost A, King CR, Katz A, Moawad NS, Levy B, Wu H, Lerner V.",NA,2026,"<h4>Background</h4>The Essentials in Minimally Invasive Gynecologic Surgery manual skills examination is a new qualifying examination for board certification in obstetrics and gynecology. The aim of this study is to examine the validity evidence for the use of Essentials in Minimally Invasive Gynecologic Surgery as a summative evaluation by assessing performance of laparoscopic tasks (sleeve transfer, circle cut, extracorporeal knot tying, intracorporeal knot tying, and running stitch) using a previously studied global rating scale for laparoscopic surgery (Global Operative Assessment of Laparoscopic Skills).<h4>Study design</h4>Expert laparoscopic educators evaluated video recordings of participants performing laparoscopic exercises from the Essentials in Minimally Invasive Gynecologic Surgery construct validation trial using the modified Global Operative Assessment of Laparoscopic Skills (depth perception, bimanual dexterity, efficiency, and tissue handling), scoring them on a 5-point anchored Likert scale with higher scores indicating better performance. Spearman's correlation tests were used to assess correlations among scores, and Wilcoxon rank-sum tests were used to compare groups. Weight kappa statistics were calculated to assess inter-rater agreement. All statistical analyses were conducted on R 4.3.1.<h4>Results</h4>We included 144 participants: 54 postgraduate year 1 residents, 55 postgraduate year 3 residents, 20 American Board of Obstetrics and Gynecology-certified obstetrics and gynecology attendings, and 15 American Board of Obstetrics and Gynecology-certified obstetrics and gynecology attendings who completed a Minimally Invasive Gynecologic Surgery fellowship. We demonstrated that more proficient participants achieved higher Global Operative Assessment of Laparoscopic Skills scores. There were weak to moderate negative correlations between Global Operative Assessment of Laparoscopic Skills scores and time to task completion as well as total number of errors for each exercise (r=0.55-0.70, P<.001; r=0.28-0.55, P=.003 to P<.001, respectively). Participants who passed Essentials in Minimally Invasive Gynecologic Surgery scored better on Global Operative Assessment of Laparoscopic Skills (passed: median individual item Global Operative Assessment of Laparoscopic Skills scores (interquartile range) 3 to 3.5 [2, 4] vs failed: 1 to 2 [1, 3], P<.001-.08).<h4>Conclusion</h4>More experienced participants and participants who passed Essentials in Minimally Invasive Gynecologic Surgery perform laparoscopic Essentials in Minimally Invasive Gynecologic Surgery exercises with better skills. Importantly, those who passed Essentials in Minimally Invasive Gynecologic Surgery performed at a corresponding Global Operative Assessment of Laparoscopic Skills score of at least 3 (range, 1-5) for all the items (depth perception, bimanual dexterity, efficiency, and tissue handling). Given that Global Operative Assessment of Laparoscopic Skills are easy to use and widely available, while Essentials in Minimally Invasive Gynecologic Surgery metrics are proprietary and cannot be accessed, Global Operative Assessment of Laparoscopic Skills can be used as a proxy for the Essentials in Minimally Invasive Gynecologic Surgery passing score during preparation. In addition, our study adds to the body of validity evidence, further supporting Essentials in Minimally Invasive Gynecologic Surgery as a summative evaluation for obstetrics and gynecology trainees.",europmc,title_kw_only,AAGL2023_061
37436053,10.52054/fvvo.15.2.069,"Laparoscopic management of a second trimester ruptured spontaneous heterotopic tubal pregnancy mimicking ovarian tumour, a case report.","Kathopoulis N, Diakosavvas M, Kypriotis K, Chatzipapas I, Domali E, Protopapas A.",NA,2023,"<h4>Background</h4>Laparoscopic surgery in the second trimester of pregnancy is a high risk and demanding operation. Especially when dealing with adnexal pathology, the surgeon should balance between the effort to establish adequate visualisation of the operating field with minimal uterine manipulation and use of energy application to avoid any potential adverse effects on the intrauterine pregnancy.<h4>Objective</h4>The video shows laparoscopic surgery performed in the second trimester of pregnancy and highlights modifications to technique to ensure safety. Materials and Methods: We present a case report of spontaneous heterotopic tubal pregnancy that mimicked an ovarian tumour and was managed surgically with a laparoscopy in the second trimester. During surgery, a previously ruptured left tubal pregnancy (? ectopic) was the cause for a concealed hematoma in the pouch of Douglas, misdiagnosed as ovarian tumour. This is one of the few cases of heterotopic pregnancy treated by laparoscopy in the second trimester of pregnancy.<h4>Results</h4>The patient was discharged the day 2 post-operatively, the intrauterine pregnancy progressed, and the patient delivered with a planned caesarean section on the 38th week.<h4>Conclusions</h4>Laparoscopic surgery, with adjustments, is a safe and effective method to manage adnexal pathology during a second trimester pregnancy.",europmc,title_kw_only,AAGL2023_062
41262088,10.4103/gmit.gmit-d-25-00011,"Surgical Results and Current Status of Adnexal Torsion Management, with a Comparison of Entire Adnexal Torsion and Isolated Fallopian Tube Torsion: A Single-center Study.","Ojima T, Yazawa H, Yazawa R, Anjo K.",NA,2025,"<h4>Objectives</h4>We aimed to evaluate the results of surgery for adnexal torsion at Fukushima Red Cross Hospital over the 10-year period from 2013 to 2023.<h4>Materials and methods</h4>In cases of adnexal torsion, we evaluated the incidence, torsion site, symptoms, and presence or absence of necrosis and bleeding.<h4>Results</h4>Among 1243 surgeries for ovarian tumor performed during the study period, there were 43 cases (3.5%) of adnexal torsion. Of these, 39 cases (91%) were entire ovarian torsion (ovarian and fallopian tube torsion [OFTT]) and 4 cases (9%) were isolated fallopian tube torsion (IFTT). The incidence of ovarian tumors was higher with OFTT, while paraovarian cysts and hydrosalpinx were more common with IFTT. Compared with IFTT, OFTT was associated with more frequent abdominal pain, emergency surgery, and necrosis on pathological diagnosis. Furthermore, in 53% (10/19) of cases with no necrosis on postoperative pathological examination, there was a change in color to dark purple or black that was suspected to represent necrosis during surgery.<h4>Conclusion</h4>Adnexal torsion can lead to necrosis of the ovary or fallopian tube; thus, it is important to make an accurate diagnosis and provide appropriate treatment as soon as possible. When selecting a surgical procedure in reproductive-aged women, it is recommended that ovarian function - sparing procedures be actively considered, except in cases of advanced necrosis, with the understanding that there is often a discrepancy between intraoperative macroscopic necrosis findings and pathological necrosis that identified by postoperative pathological examination (discrepancy rate was 31% in this study).",europmc,title_kw_only,AAGL2023_063
41521001,10.1016/j.jmig.2026.01.007,Surgical Management of Disseminated Peritoneal Leiomyomatosis.,"Alzamora M, Viars M, Gallant T, King CR.",NA,2026,"<h4>Objective</h4>The objective of this video is to describe a case of disseminated peritoneal leiomyomatosis (DPL) mimicking deeply infiltrating endometriosis and discuss the preoperative workup, intraoperative approach, and postoperative considerations. We also illustrate key surgical techniques to optimize safe and complete resection, including use of indocyanine green (ICG) for ureteral identification and strategic use of retractors for improved visualization and mobilization of lesions.<h4>Setting</h4>Tertiary care, academic center with expertise in complex gynecologic surgery.<h4>Participants</h4>A 48-year-old patient with a remote history of laparoscopic hysterectomy for uterine fibroids that required morcellation, although it was unknown if this was performed in a contained fashion. She presented with chronic cyclical pelvic pain, urinary urgency, and tenesmus. She was started on progestin therapy for presumed endometriosis, with incomplete symptom relief.<h4>Intervention</h4>Pelvic MRI revealed nodular thickening of bilateral round ligament remnants, a spiculated fibrotic lesion with hemorrhagic foci involving the right ovary and terminal ileum, and a lobulated mass abutting the bladder and vaginal cuff. Laparoscopic surgical excision was planned during which leiomyomatous lesions noted at the umbilicus, vaginal cuff, bladder, and round ligament remnants. Cystoscopy-guided ureteral instillation of ICG was used to aid ureteral identification, and rectal and vaginal retractors were used to delineate anatomy.<h4>Conclusion</h4>DPL is an uncommon and often misdiagnosed condition that may mimic deep endometriosis. Recognition of its iatrogenic association highlights the importance of contained morcellation during gynecologic surgery. Preoperative imaging and intraoperative identification of critical structures, such as the ureters, bladder and rectal borders, enable safe, complete excision with low risk of recurrence.",europmc,author_broad_kw,AAGL2023_063
38184642,10.1186/s40814-023-01430-y,In-person cognitive behavioural therapy vs. usual care after surgical management of extremity fractures: an unsuccessful feasibility trial.,"Gouveia K, Sprague S, Gallant J, Del Fabbro G, Leonard J, Bzovsky S, McKay P, Busse JW, COPE Investigators.",NA,2024,"<h4>Background</h4>Extremity fractures are common, and most are managed operatively; however, despite successful reduction, up to half of patients report persistent post-surgical pain. Furthermore, psychological factors such as stress, distress, anxiety, depression, catastrophizing, and fear-avoidance behaviors have been associated with the development of chronic pain. The purpose of this pilot study was to examine the feasibility of a randomized controlled trial to determine the effect of in-person cognitive behavioral therapy (CBT) vs. usual care on persistent post-surgical pain among patients with a surgically managed extremity fracture.<h4>Methods</h4>Eligible patients were randomized to either in-person CBT or usual care. We used four criteria to judge the composite measure of feasibility: 1) successful implementation of CBT at each clinical site, 2) 40 patients recruited within 6 months, 3) treatment compliance in a minimum 36 of 40 participants (90%), and 4) 32 of 40 participants (80%) achieving follow-up at one year. The primary clinical outcome was persistent post-surgical pain at one year after surgery.<h4>Results</h4>Only two of the four participating sites were able to implement the CBT regimen due to difficulties with identifying certified therapists who had the capacity to accommodate additional patients into their schedule within the required timeframe (i.e., 8 weeks of their fracture). Given the challenges associated with CBT implementation, only one site was able to actively recruit patients. This site screened 86 patients and enrolled 3 patients (3.5%) over a period of three months. Participants were unable to comply with the in-person CBT, with no participants attending an in-person CBT session. Follow-up at one year could not be assessed as the pilot study was stopped early, three months into the study, due to failure to achieve the other three feasibility criteria.<h4>Conclusion</h4>Our pilot trial failed to demonstrate the feasibility of a trial of in-person CBT versus usual care to prevent persistent pain after surgical repair of traumatic long-bone fractures and re-enforces the importance of establishing feasibility before embarking on definitive trials. Protocol modifications to address the identified barriers include the delivery of our intervention as a therapist-guided, remote CBT program.<h4>Trial registration</h4>ClinicalTrials.gov (Identifier NCT03196258); Registered June 22, 2017, https://clinicaltrials.gov/ct2/show/NCT03196258.",europmc,author_broad_kw,AAGL2023_063
37565058,10.1002/oto2.66,Surgical Management and Outcomes of Pediatric Congenital Head and Neck Teratomas: A Scoping Review.,"Patel S, Kunnath AJ, Gallant JN, Belcher RH.",NA,2023,"<h4>Objective</h4>To perform a scoping review to characterize postoperative outcomes of pediatric patients (ages 0-18) with a history of congenital head and neck teratomas.<h4>Data sources</h4>PubMed, EMBASE, Web of Science, Cochrane, Clinicaltrails.gov.<h4>Review methods</h4>A search of multiple databases was performed. Studies were included if they detailed the surgical management and outcomes of pediatric patients with a history of congenital head and neck teratomas.<h4>Results</h4>One hundred and eight studies totaling 137 patients were identified. The median gestational age at birth was 37 weeks. Respiratory distress, prompting emergent endotracheal intubation or tracheostomy, was present in most patients (58%). The ex utero intrapartum treatment (EXIT) procedure was utilized for 21 (15%) patients. The teratomas were resected after a median duration of 4 days from birth. The most common postsurgical complications were vocal cord paralysis (3%), hemorrhage (2%), and tracheomalacia (2%). Death occurred perioperatively in 2 patients (2%). Twenty-six patients (19%) required additional surgery, and 5 patients (4%) needed adjuvant chemotherapy. Patients were monitored for a median duration of 24 months with a recurrence rate of 6%. Four recurrent cases (50%) had intracranial extension, and 88% of the recurrent cases were mature teratomas at initial histopathological diagnosis.<h4>Conclusion</h4>Most patients with congenital head and neck teratomas require emergent airway management perinatally. Excisional and surgical complications are rare, and most patients are cured of their disease with a single operation. Recurrent teratomas tend to have an intracranial extension and are likely to be of mature pathology at the time of initial diagnosis.",europmc,author_broad_kw,AAGL2023_063
NA,10.21203/rs.3.rs-3318499/v1,Improvement of laparoscopic inguinal lymph node dissection for Penile cancer,"ban y, xu f, liang t, yang n.",NA,2023,"The prognosis of Penile cancer patients is closely related to the metastasis of inguinal lymph nodes. Timely inguinal lymph node dissection is an important part of the treatment of Penile cancer. The tumor control effect of laparoscopic inguinal lymph node dissection is similar to that of open surgery, but the complications are significantly reduced; And there are different methods in terms of surgical approach, dissection approach and Great saphenous vein preservation. We adopt the transabdominal subcutaneous anterograde approach and improve the laparoscopic inguinal lymph node dissection. This article introduces the procedures and technical improvement points of the improved laparoscopic inguinal lymph node dissection through the subcutaneous approach.",europmc,title_kw_only,AAGL2023_064
38077118,10.1155/2023/9831045,Retracted: Nursing of Vulvar Cancer Radical Operation Combined with Laparoscopic Inguinal Lymph Node Dissection.,International EM.,NA,2023,[This retracts the article DOI: 10.1155/2022/8091114.].,europmc,title_kw_only,AAGL2023_064
40927704,10.1016/j.crwh.2025.e00746,Multidisciplinary team management of caesarean scar ectopic pregnancy progressing to a live birth and caesarean hysterectomy at 34 weeks: A case report.,"Xue R, Gu W, Lang X.",NA,2025,"Progression of a caesarean scar ectopic pregnancy (CSEP) to a live birth is exceptionally rare. Whether the placenta should be removed during a caesarean section for patients with a CSEP complicated by severe placenta accreta spectrum remains unclear. This report presents the case of a 42-year-old multigravida with two prior caesarean sections who presented with CSEP at 6 weeks. Despite recommendations for termination, the patient decided to continue the pregnancy. Serial imaging confirmed a progressive placenta accreta spectrum. At 34+ weeks of gestation, a caesarean hysterectomy was successfully performed under the management of a multidisciplinary team, with good maternal and infant outcomes. The management of a CSEP progressing to a live birth during the third trimester requires provider expertise and multidisciplinary treatment and should be individualized. In the present case, caesarean hysterectomy was performed without attempting placental removal, which might have significantly decreased blood loss. While the patient survived, the management remains controversial, and women with CSEP opting for expectant management should be informed about the lack of conclusive evidence on its safety and associated risks. Such options can be considered only in a highly equipped specialist centre with access to a multidisciplinary team.",europmc,title_kw_only,AAGL2023_074
