pmid,doi,epmc_title,epmc_first_author,epmc_journal,epmc_year,epmc_abstract,source,epmc_strategy,abstract_id
41663249,10.1080/14767058.2026.2624937,A retrospective comparison of hysteroscopic resection and curettage in the treatment of retained products of conception: surgical and reproductive outcomes.,"Coban G, Biber Ak AY, Ozdemir AZ, Coban EF.",NA,2026,"<h4>Objective</h4>To compare the efficacy, safety, and reproductive outcomes of hysteroscopic resection versus conventional dilation and curettage (D&C) in the management of retained products of conception (RPOC) following delivery or abortion.<h4>Materials and methods</h4>This retrospective cross-sectional study included 55 patients diagnosed with RPOC at a tertiary care center between January 2015 and December 2025. The surgical intervention selected for each patient was determined by clinical indications, with either hysteroscopic resection or dilation and curettage (D&C) being the preferred option. The diagnosis was confirmed by transvaginal ultrasonography and histopathological examination. A comprehensive analysis encompassing demographic characteristics, clinical manifestations, surgical outcomes, and fertility outcomes was conducted between the two groups.<h4>Results</h4>Hysteroscopy was performed in 28 patients (50.9%). D&C was performed in 27 patients (49.1%). The median time from pregnancy termination to intervention was significantly longer in the hysteroscopy group (28 vs. 7.5 days; <i>p</i> = 0.036). Residual tissue size and operative time were also significantly greater in the hysteroscopy group (<i>p</i> = 0.017 and <i>p</i> < 0.001, respectively). Although not statistically significant, time to conception was shorter in the hysteroscopy group (5 vs. 9.4 months), and the rate of pregnancy desire was significantly higher (82.1% vs. 66.7%; <i>p</i> = 0.021). Pregnancy was observed to be more prevalent in the D&C group during the follow-up period. However, this difference did not attain statistical significance.<h4>Conclusion</h4>Hysteroscopy and dilation and curettage (D&C) have been demonstrated to be both effective and safe options for RPOC. The use of hysteroscopy, with its capacity for direct visualization and targeted removal, is supported by its efficacy in precise intrauterine assessment. The fertility outcomes observed in this cohort were comparable between the study groups.",europmc,title_kw_only,AAGL2023_027
39357866,10.52054/fvvo.16.3.031,Caesarean scar defect and retained products of conception (RPOC): a step-by-step combined hysteroscopic and laparoscopic treatment.,"Panico G, Mastrovito S, Bonetti E, Fanfani F, Scambia G, Catena U.",NA,2024,"<h4>Background</h4>Uterine scar defect (also called uterine niche or isthmocele) associated to retained products of conception (RPOC) is an uncommon occurrence following caesarean section. Typically, the primary indicator is abnormal vaginal bleeding, and an accurate diagnosis can be established through ultrasound evaluation. Several surgical and endoscopic treatments have been described.<h4>Objectives</h4>To show a step-by-step video of combined hysteroscopic and laparoscopic approach to perform isthmocele repair in a patient with caesarean scar defect and RPOC.<h4>Materials and methods</h4>We report a case of a 34-year-old patient who was referred to our Digital Hysteroscopic Clinic (DHC) for abnormal vaginal bleeding and persistent pelvic pain, three months after a caesarean section. A single-step diagnostic approach through transvaginal ultrasound and diagnostic hysteroscopy revealed the presence of an isthmic uterine niche within the caesarean scar area, containing a poorly vascularised heterogeneous hyperechoic focal mass measuring 33x11x33 millimetres.<h4>Main outcome measures</h4>Removal of RPOC and surgical complications.<h4>Results</h4>All retained placental tissue was removed and the uterine wall defect was corrected. No complications occurred and the patient was discharged two days after the procedure. Patient was asymptomatic at 3 months follow up and ultrasound and hysteroscopy showed a reconstituted uterine wall.<h4>Conclusion</h4>An integrated hysteroscopic and laparoscopic approach seems to be an effective conservative method to remove RPOC and perform isthmocele repair with optimal surgical results.",europmc,title_kw_only,AAGL2023_027
38521232,10.1016/j.ajog.2024.03.017,"Reproductive and obstetrical outcomes after treatment of retained products of conception: hysteroscopic removal vs ultrasound-guided electric vacuum aspiration, a prospective follow-up study.","Wagenaar LP, van Vugt WLJ, Huppelschoten AG, Radder CM, Peters LW, Weyers S, van Wessel S, Schoot BC, Hamerlynck TWO, van Vliet HA.",NA,2024,"<h4>Background</h4>Traditionally, curettage has been the most widely performed surgical intervention for removing retained products of conception. However, hysteroscopic removal is increasingly performed as an alternative because of the potentially lower risk of intrauterine adhesions and higher rates of complete removal. Until recently, studies comparing curettage with hysteroscopic removal regarding reproductive and obstetrical outcomes were limited, and data conflicting.<h4>Objective</h4>This study aimed to assess reproductive and obstetrical outcomes in women wishing to conceive after removal of retained products of conception by hysteroscopy or ultrasound-guided electric vacuum aspiration.<h4>Study design</h4>This was a prospective long-term follow-up study, conducted in 3 teaching hospitals and 1 university hospital. Patients were included from April 2015 until June 2022 for follow-up, either in a randomized controlled, nonblinded trial on the risk of intrauterine adhesions after removal of retained products of conception, or in a cohort alongside the randomized trial. Women with an ultrasonographic image suggestive of retained products of conception ranging from 1 to 4 cm were eligible. Surgical procedures in the randomized controlled trial were hysteroscopic morcellation or ultrasound-guided electric vacuum aspiration. In the cohort study, hysteroscopic treatment included hysteroscopic morcellation or cold loop resection compared with ultrasound-guided electric vacuum aspiration.<h4>Results</h4>A total of 261 out of 305 patients (85.6%) were available for follow-up after removal of retained products of conception, resulting in a cohort of 171 women after hysteroscopic removal and 90 women after removal by ultrasound-guided vacuum aspiration. Respectively, 92 of 171 women (53.8%) in the hysteroscopic removal group and 56 of 90 (62.2%) in the electric vacuum aspiration group wished to conceive (P=.192). Subsequent pregnancy rates were 88 of 91 (96.7%) after hysteroscopic removal and 52 of 56 (92.9%) after electric vacuum aspiration (P=.428). The live birth rates were 61 of 80 (76.3%) and 37 of 48 (77.1%) after hysteroscopic removal and electric vacuum aspiration, respectively (P=.914), with 8 of 88 pregnancies (9.1%) in the hysteroscopic removal group and 4 of 52 (7.7%) in the electric vacuum aspiration group still ongoing at follow-up (P=1.00). The median time to conception was 8.2 weeks (interquartile range, 5.0-17.2) in the hysteroscopic removal group and 6.9 weeks (interquartile range, 5.0-12.1) in the electric vacuum aspiration group (P=.262). The overall placental complication rate was 13 of 80 (16.3%) in the hysteroscopic removal group and 11 of 48 (22.9%) in the electric vacuum aspiration group (P=.350).<h4>Conclusion</h4>Hysteroscopic removal and ultrasound-guided electric vacuum aspiration of retained products of conception seem to have no significantly different effects on subsequent live birth rate, pregnancy rate, time to conception, or pregnancy complications. Reproductive and obstetrical outcomes after removal of retained products of conception are reassuring, albeit with a high risk of placental complications.",europmc,title_kw_only,AAGL2023_027
39007504,10.1111/ajo.13861,"Methoxyflurane analgesia for outpatient hysteroscopy: A double-blind, randomised, controlled trial.","Twidale EK, Neutens S, Hynt L, Dudley N, Streeton C.",NA,2025,"<h4>Background</h4>Despite clinical and economic benefits, pain during outpatient hysteroscopy (OPH) remains a barrier to use. There is a lack of evidence to support routine use of one analgesic over another versus no analgesic.<h4>Aims</h4>To study the efficacy and safety of methoxyflurane analgesia during OPH.<h4>Materials and methods</h4>A single-centre, randomised, double-blind, placebo-controlled experiment was performed; 90 patients were randomly assigned (1:1). Participants allocated to the treatment group (cases) received 3 mL of methoxyflurane through an inhaler. The control group received a placebo. The primary outcome was a mean difference in pain, via a change in Visual Analog Scale (VAS) score from baseline at diagnostic hysteroscopy. Secondary outcomes were a mean difference in VAS score with any subsequent operative procedures; a mean difference in VAS score at 15 min post-procedure; participant and clinician-reported adverse effects and events; and participant-reported procedure acceptability, adjuvant nitrous oxide (N<sub>2</sub>O<sub>2</sub>) use and a composite of 'distress'.<h4>Results</h4>During diagnostic hysteroscopy, there was a mean difference of 11.5 mm/100 (95% confidence interval (CI) 0.08-22.95), P = 0.05, with the lower score in the cases, compared with controls. During subsequent operative procedures, there was a mean difference of 15 mm/100 (95% CI 2.71-28.22), P = 0.02, with the lower pain score in the cases, compared with controls. There was no significant difference in pain 15 min post-procedure, participant- and clinician- reported adverse effects and events, procedure acceptability and the 'distress' composite.<h4>Conclusions</h4>Methoxyflurane significantly reduced pain during OPH compared with placebo, for diagnostic as well as operative procedures. Furthermore, methoxyflurane was well tolerated, with no adverse events.",europmc,author_broad_kw,AAGL2023_028
38190883,10.1016/j.jmig.2024.01.003,Barriers to Office Hysteroscopy in Fellowship Education and Practice.,"Zelivianskaia A, Ramanathan AR, Qu A, Robinson JK.",NA,2024,"<h4>Study objective</h4>To identify the top 3 perceived barriers to performing office hysteroscopy (OH) by minimally invasive gynecologic surgery (MIGS) faculty and fellows and identify opportunities for education on this key topic that will be most effective in fellowship training and MIGS practice.<h4>Design</h4>Cross-sectional survey study targeted at all American Association of Gynecologic Laparoscopists-accredited Fellowship in Minimally Invasive Gynecologic Surgery fellows, program directors, and associate program directors in February to April 2022. The survey was designed by faculty who have extensive experience in OH procedures. In addition, a literature search was performed to aid with question design.<h4>Setting, patients, and interventions</h4>This was a REDCap electronic survey administered through the Fellowship in Minimally Invasive Gynecologic Surgery listserv. No additional follow-up was performed after survey completion. The 15-minute survey was sent to 60 program directors, 92 assistant program directors, and 158 fellows, including the incoming class of 2024 and the 2022 fellowship graduates.<h4>Measurements and main results</h4>A total of 93 responses were received; 67% of respondents performed OH but 73% of those performed 5 procedures or less per month. Most participants controlled pain with nonsteroidal anti-inflammatory drugs +/- paracervical block. The most common perceived barrier to performing OH was concern over pain management. Other commonly cited concerns were equipment costs, sterilization costs, and office staff training; 37% to 44% of respondents also cited lack of departmental support and insufficient clinic time, respectively, as barriers, and 56% indicated they are interested in educational materials on OH.<h4>Conclusion</h4>Our study suggests general interest in, but a low volume of, OH among MIGS fellows and faculty. The most common perceived barrier was concern regarding pain management. This has been well studied in the literature and likely presents an area for greater education to improve OH utilization. We also uncovered concerns regarding systemic barriers, such as equipment costs, departmental support, and clinic structure. This is an area for further research and advocacy efforts to address barriers to OH on a system level.",europmc,author_broad_kw,AAGL2023_029
41666983,10.1016/j.jmig.2026.02.016,Comparing Long-term Symptomatic Leiomyoma Recurrence Rates After Resection Using the Hysteroscopic Morcellator versus Bipolar Resectoscope.,"Fenske BM, Fadadu PP, Mays M, Cole KC, Hopkins M, Breitkopf D.",NA,2026,"<h4>Study objective</h4>To determine the optimal hysteroscopic myomectomy technique by comparing symptomatic leiomyoma recurrence rates after mechanical tisssue removal system versus bipolar resection.<h4>Design</h4>This retrospective cohort study included premenopausal patients undergoing fibroid resection with the hysteroscopic mechanical tissue removal system (mTRS) or bipolar resectoscope (BR) for International Federation of Gynecology and Obstetrics (FIGO) type 0-2 leiomyomas. Subjects who underwent resection from 2005-2021 were followed over time for symptom recurrence and medical/surgical treatments. The risk of fibroid recurrence and hysterectomy was estimated using the Kaplan-Meier method.<h4>Setting</h4>Single academic tertiary care center.<h4>Patients or participants</h4>Patients with FIGO type 0-2 leiomyomas at time of surgery were included. Those without pathology-confirmed leiomyoma or for which hysteroscopic resection was completed with an alternative method or unknown method was excluded. Patients that were postmenopausal at the time of the study were excluded as well.<h4>Interventions</h4>Hysteroscopic Mechanical Tissue Removal System or Bipolar Resection MEASUREMENTS AND MAIN RESULTS: In total, 89 patients were treated with the hysteroscopic mechanical tissue removal system and 358 with bipolar resection. Baseline demographics including age, BMI, race/ethnicity, and obstetric history were comparable between groups; abnormal uterine bleeding (AUB) was the most common indication for index surgery. The mean fibroid size and median resected tissue volume were slightly greater in the bipolar resection group. The length of follow-up was variable, with a mean of 7.1 years (SD 5.4) amongst both groups. Symptomatic fibroid recurrence occurred in 29.2% of patients in the hsyteroscopic mechanical tissue removal system compared to 38.5% in the bipolar resection group (p=NS). Additional hysteroscopic management, with hysteroscopic mechanical tissue removal system or bipolar resection, was the most common method of treatment for fibroid recurrence. The cumulative incidence of hysterectomy was similar (mTRS=15.7% vs BR=22.3%), with abnormal uterine bleeding being the most common indication.<h4>Conclusion</h4>There was no significant difference between long-term recurrence rates for FIGO type 0-2 leiomyomas when comparing the hysteroscopic mechanical tissue removal system to bipolar resection; however, larger prospective cohorts with longer follow-up or randomized controlled trials may help to determine if one technique is indeed more effective.",europmc,author_title_kw,AAGL2023_030
39438822,10.1186/s12883-024-03907-6,"TRANscranial direct current stimulation for FOcal Refractory epilepsy in mitochondrial disease (TRANSFORM): delayed-start, randomised, double-blinded, placebo-controlled study.","Bangel KA, Lim AZ, Blain A, Ng YS, Winder A, Bulmer J, Gorman G, Baker M, McFarland R.",NA,2024,"<h4>Background</h4>Focal epilepsy is common in children and adults with mitochondrial disease. Seizures are often refractory to pharmacological treatment and, in this patient group, frequently evolve to refractory focal status epilepticus (also known as epilepsia partialis continua). Where this occurs, the long-term prognosis is poor. Transcranial DC stimulation (tDCS) is a promising, non-invasive, adjunctive treatment alternative to common surgical procedures. Limited recruitment of study participants with this rare disease and the ethical challenges of administering a treatment to one group and not another, while maintaining strict methodological rigour can pose challenges to the design of a clinical study.<h4>Method</h4>We designed the first delayed start, double-blinded, sham-controlled study to evaluate the efficacy of tDCS as an adjunctive treatment for focal epilepsy. We will include participants with a genetically confirmed diagnosis of mitochondrial disease with drug-resistant focal epilepsy aged ≥ 2 years, aiming to collect 30 episodes of focal status epilepticus, each treated for a maximum period of 14 days. The early start intervention arm will receive tDCS from day 1. The delayed start intervention arm will receive sham stimulation until crossover on day 3. Our primary endpoint is a greater than 50% reduction from baseline (on day 0) in seizure frequency assessed by 3x daily reporting, accelerometery, and video monitoring. Changes in the underlying epileptogenic focus within the brain related to the tDCS intervention will be assessed by magnetic resonance imaging (MRI) and/or electroencephalography (EEG).<h4>Discussion</h4>Study results in favour of treatment efficacy would support development of tDCS into a mainstream treatment option for focal epileptic seizures related to mitochondrial disease.<h4>Trials registration</h4>ISRCTN: 18,241,112; registered on 16/11/2021.",europmc,author_title_kw,AAGL2023_031
41346217,10.1111/vde.70041,"Randomised, Double-Blinded, Placebo-Controlled Challenge Test With Single Food Items in Dogs With Atopic Dermatitis and Adverse Food Reactions.","Sofou EI, Samuel E, Aleksandrova S, Chatzis M, Saridomichelakis MN.",NA,2026,"<h4>Background</h4>Identification of offending foods in dogs with adverse food reactions is usually based on ""deterioration"" during open food challenges.<h4>Objectives</h4>To examine the placebo effect during double-blinded, placebo-controlled food challenges using a predefined set of criteria for relapse.<h4>Animals</h4>Twelve dogs with atopic dermatitis and adverse food reactions.<h4>Materials and methods</h4>Dogs were serially challenged with 40 g/day of eight food items (beef, chicken, codfish, corn flour, cow's milk, hen's egg, lamb, wheat), for 1 week, each mixed with their elimination diet and water. An additional two challenges were placebo (elimination diet mixed with water). Owners and investigators were blinded to the challenges and the order of the 10 challenges was randomised for each dog. Relapse was defined as moderate-to-severe owner global assessment of challenge deterioration and/or > 100% increase of Canine Atopic Dermatitis Extent and Severity Index, 4th iteration (CADESI-04) score (with the score at the end being > 9) and/or > 100% increase of pruritus using a Visual Analog Scale (with the score at the end being > 1.9/10).<h4>Results</h4>Most (91.7%) dogs were positive to one to six challenges with food items, yet half of them also were falsely positive in one placebo challenge. Two dogs had only one placebo challenge. The number of positive challenges to foods did not differ between dogs with positive and negative placebo challenges.<h4>Conclusions and clinical relevance</h4>The placebo effect during double-blinded food challenges creates doubts about the accuracy of the results of challenges with food items in this and in previous studies where open food challenges were used.",europmc,title_kw_only,AAGL2023_031
41656979,10.3310/ggcc1111,"A pragmatic, multicentre, placebo-controlled, 3-arm, double-blinded, randomised controlled trial, incorporating an internal pilot, to determine the role of bronchodilators in preventing exacerbations of bronchiectasis.","Wilson N, Morton M, Homer T, Breeze Konkoth A, Joyce R, Kershaw A, Wilde H, Liddle A, Wason J, Ternent L, Allen M, Lord R, Steer J, Devereux G, Chalmers JD, Hill AT, Haworth CS, Hurst JR, De Soyza AA.",NA,2026,"<h4>Background</h4>Bronchiectasis is a long-term lung condition associated with bronchial dilatation, chronic inflammation and infection. Treatment is often empirical or extrapolated from other lung conditions, for example the use of inhaled therapies licensed for use in asthma or chronic obstructive pulmonary disease. Inhaled therapies, such as corticosteroids or long-acting bronchodilators (long-acting beta agonists or long-acting muscarinic antagonists), are commonly used in bronchiectasis despite scanty evidence on exacerbation reduction.<h4>Objective</h4>To assess whether: dual bronchodilators (long-acting beta agonists/long-acting muscarinic antagonists) either as stand-alone therapy or in combination with inhaled corticosteroid are superior to placebo at reducing mean exacerbation rates over 12 months dual bronchodilators (long-acting beta agonists/long-acting muscarinic antagonists) are non-inferior to triple therapy (inhaled corticosteroid/long-acting beta agonists/long-acting muscarinic antagonists) at reducing mean exacerbation rates over 12 months.<h4>Design</h4>Pragmatic, multicentre, placebo-controlled, three-arm, double-blinded, prospective, randomised controlled trial incorporating a 12-month internal pilot.<h4>Target population</h4>Six hundred adults with bronchiectasis and history of ≥ 2 exacerbations in any 12-month period within the preceding 2 years.<h4>Setting</h4>United Kingdom National Health Service secondary care sites.<h4>Interventions</h4>Twelve months, one puff daily of either dual therapy [55 μg umeclidinium (long-acting muscarinic antagonists) and 22 μg vilanterol (long-acting beta agonists)], triple therapy [dual therapy plus 92 μg fluticasone furoate (inhaled corticosteroid)] or matched placebo dry powder inhalers, randomised in a 2 : 2 : 1 ratio, respectively.<h4>Outcome measures</h4>Primary: number of participants reported bronchiectasis exacerbations requiring treatment with antibiotics during the 12-month treatment period. Primary economic: incremental cost per quality-adjusted life-year gained at 12 months.<h4>Results</h4>Recruitment rates did not follow projections due to the COVID-19 pandemic; 85 potentially eligible patients were screened, of whom 33 (39%) were randomised. Of the randomised participants, 30 (91%) completed follow-up at 12 months; 3 participants withdrew [1/14 (7%) dual therapy, 1/12 (8%) triple therapy and 1/7 (14%) placebo]. Five participants discontinued therapy during the trial [1/14 (7%) dual therapy, 2/12 (17%) triple therapy and 2/7 (29%) placebo]. Given the small sample size, the statistical and economic analyses are descriptive and exploratory. Exacerbation data were available for 32/33 (97%) of randomised participants (13 dual therapy, 12 triple therapy and 7 placebo). The median number of exacerbations during the follow-up (the primary outcome) was 1 (interquartile range 0-3) for dual therapy, 2 (1, 2.5) for triple therapy and 3 (2, 3) for placebo. No safety concerns were identified. Complete resource-use and quality-of-life data were available for 30/33 (91%) participants.<h4>Conclusions</h4>COVID-19 impacted delivery of the trial, affecting staff capacity, setting up of timelines, and ultimately, recruitment to the pilot. There was good retention and data completeness within the trial randomised participants. The trial is unable to provide evidence on the superiority or cost-effectiveness of dual or triple therapy to placebo at reducing mean exacerbation rates over 12 months or the non-inferiority of dual to triple therapy.<h4>Future work and limitations</h4>The main limitation of this work is the small sample size that prevents any firm conclusions to be made. However, the results do suggest that there is a signal of efficacy and that a larger trial is needed to provide valuable clinical evidence. These results underscore the importance of completing a large-scale trial of these therapies to help improve the understanding and best treatment for patients with bronchiectasis.<h4>Funding</h4>This synopsis presents independent research funded by the National Institute for Health and Care Research (NIHR) Health Technology Assessment programme as award number NIHR127460.",europmc,title_kw_only,AAGL2023_031
