abstract_id,title,first_author_normalized,abstract_objective,abstract_conclusion,best_pmid,best_score,has_tie,n_candidates,title_sim,title_pts,abstract_pts,first_au_pts,last_au_pts,coauthor_pts,team_bonus,journal_pts,keyword_pts,date_pts,no_text_penalty,pub_title,pub_journal,pub_doi
AAGL2020_046,Sentinel Node Mapping Vs. Sentinel Node Mapping Plus Backup Lymphadenectomy in Endometrial Cancer: 3-Year Outcome,bogani G,"Sentinel node mapping (SLNM) has replaced lymphadenectomy for staging surgery in apparent early-stage endometrial cancer (EC). Here, we evaluate long-term survival of two different approaches of nodal assessment in EC.",Our study highlighted that laparoscopic staging is safe and effective in EC. SLNM provides similar long-term oncologic outcomes than lymphadenectomy. Further evidence is warranted to assess the prognostic value of low-volume disease detected by ultra staging in patients following SLNM.,33485641,6,FALSE,52,0.375,1,1,2,0,0,0,1,0,1,0,Sentinel node mapping vs. sentinel node mapping plus back-up lymphadenectomy in high-risk endometrial cancer patients: Results from a multi-institutional study.,Gynecologic oncology,10.1016/j.ygyno.2021.01.008
AAGL2020_047,Patterns of Recurrence after Laparoscopic and Open Abdominal Radical Hysterectomy for Cervical Cancer: A Propensity-Matched Analysis,bogani G,To identify different patterns of recurrence after laparoscopic and open abdominal radical hysterectomy for cervical cancer.,"Patients having laparoscopy are at high risk of developing intra-pelvic recurrences and peritoneal carcinomatosis, due to unknown reasons (possibly due to a contamination of the pelvic area during colpotomy). Further evidence is needed in order to identify the best surgical treatment modality for cervical cancer patients.",40907142,3.81,FALSE,47,0.184,0,1,2,0,0,0,0.81,0,0,0,"Ninety-day surgery-related outcomes of laparoscopic hysterectomy, bilateral salpingo-oophorectomy and sentinel node mapping in apparent early-stage endometrial cancer: a secondary analysis of a prospective single-arm study.","European journal of obstetrics, gynecology, and reproductive biology",10.1016/j.ejogrb.2025.114679
AAGL2020_049,Laparoscopic Management of Cesarean Scar Ectopic Pregnancy: A Step-By-Step Approach,kent L,The objective of this video is to present an overview of diagnosis and management of cesarean scar ectopic pregnancy and demonstrate a step-by-step approach for laparoscopic management.,"Cesarean scar ectopic pregnancy is a rare type of ectopic pregnancy and is associated with risks including life threatening hemorrhage, uterine rupture, hysterectomy, and complications in future pregnancies. Minimally Invasive Surgery is a safe and feasible management option for this serious condition.",34774522,5,FALSE,84,0.583,2,1,0,0,0,0,1,0,1,0,A laparoscopic approach to cesarean scar ectopic pregnancy.,American journal of obstetrics and gynecology,10.1016/j.ajog.2021.11.021
AAGL2020_052,Laparoscopic Approach to the Obliterated Anterior Cul-De-Sac,porter A,"To review surgical principles that can be used to approach the obliterated anterior cul-de-sac. Additionally, to demonstrate application of these principles during total laparoscopic hysterectomy","Prior cesarean delivery can complicate laparoscopic hysterectomy. However, reliance on sound surgical principles can help ensure success. These include: Isolation and control of blood supply prior to adhesiolysis; Understanding and identifying safe spaces where anatomy is not altered by adhesive disease; Maintaining forward progress; Restoring anatomy",39053009,1,TRUE,70,0.056,0,0,0,2,0,0,1,0,0,-2,Video-Based Coaching for Laparoscopic Salpingectomy: A Randomized Controlled Trial.,Obstetrics and gynecology,10.1097/AOG.0000000000005677
AAGL2020_053,Predictive Factors for Recurrence of Adnexal Torsion,levin G,To investigate the predisposing factors for recurrent adnexal torsion (rAT) in patients who had surgical intervention for primary adnexal torsion (pAT).,Recurrent adnexal torsion is more common than previously thought. Younger age and smaller ovarian cyst at pAT are independently associated with the risk for future recurrence of adnexal torsion. These factors should be considered when contemplating oophoropexy at pAT.,39863035,1,TRUE,79,0.043,0,0,2,0,0,0,1,0,0,-2,Racial and ethnic enrollment disparities in clinical trials leading to Food and Drug Administration approvals for gynecologic malignancies.,American journal of obstetrics and gynecology,10.1016/j.ajog.2025.01.026
AAGL2020_054,Laparoscopic Transversus Abdominis Plane Block in Minimally Invasive Gynecologic Surgery,braxton E,To describe an evidence-based technique for performing laparoscopic guided Transversus Abdominis Plane (TAP) block at time of minimally invasive gynecologic surgery.,"Benefits of perioperative TAP block include decreased opioid use, quicker discharge, and faster return of bowel function at time of laparoscopic hysterectomy. Laparoscopic TAP block has demonstrated superiority over ultrasound guided approach in a randomized controlled trial. Lastly, Liposomal bupivacaine has improved benefit when compared to plain bupivacaine when used for TAP block.",37284204,3.18,FALSE,84,0.409,1,1,0,0,0,0,0.68,0,0.5,0,Laparoscopic versus ultrasound-guided transversus abdominis plane block for postoperative pain management in minimally invasive colorectal surgery: a meta-analysis protocol.,Frontiers in oncology,10.3389/fonc.2023.1080327
AAGL2020_055,Surgical Management of Interstitial Ectopic Pregnancy,jago C,To demonstrate a minimally invasive surgical technique for management of interstitial ectopic pregnancy,"Management of interstitial ectopic pregnancy has traditionally been performed via cornual wedge resection. We present a minimally invasive approach using a four step process: (1) identify the location of the interstitial pregnancy, (2) utilize hemostatic measures such as vasopressin, vessel occlusion, or tranexamic acid, (3) create a circumferential linear incision over the specimen leaving a tissue pedicle, and (4) complete a double layer running closure for re-approximation and hemostasis.",36738775,4.5,FALSE,96,0.6,2,1,0,0,0,0,1,0,0.5,0,Multidisciplinary approach to the surgical management of interstitial ectopic pregnancy.,Fertility and sterility,10.1016/j.fertnstert.2023.01.044
AAGL2020_056,Predictive Variables for Postoperative Opioid Requirements Following Hysterectomy,benlolo S,"To identify predictive factors for opioid consumption following hysterectomy by determining the relationship between perioperative opioid requirements, preoperative pelvic pain scores and patient variables.","Predictors of cumulative postoperative opioid requirements for hysterectomy include preoperative NRS scores, PSQ minor scores, number of preoperative pain medications, and surgical approach. This information can be used to create a predictive calculator to individualize perioperative interventions, optimize postoperative pain management, and tailor opioid use.",37709142,3.66,FALSE,26,0.15,0,1,2,0,0,0,0.66,0,0,0,The Tailored Opioid Reduction Strategy (TORS): A Quality Improvement Initiative to Reduce Opioid Prescription Following Hysterectomy.,Journal of obstetrics and gynaecology Canada : JOGC = Journal d'obstetrique et gynecologie du Canada : JOGC,10.1016/j.jogc.2023.102214
AAGL2020_061,Laparoscopic Excision of Pericardial and Diaphragmatic Endometriosis,nguyen D,To present a five-step approach to the excision of pericardial and diaphragmatic endometriosis by laparoscopy.,"While rare and challenging to diagnose and treat, pericardial and diaphragmatic endometriosis and its potentially debilitating symptomatology can be successfully managed through a multidisciplinary and step-wise surgical intervention.",41195923,3.68,FALSE,61,0.111,0,1,2,0,0,0,0.68,0,0,0,"Observation of art enhances medical students' cultural and gender awareness, recognition, and clinical empathy.",Indian journal of medical ethics,10.20529/IJME.2025.059
AAGL2020_062,Parametrial Endometriosis Part 1: A Correlation of Parametrial Anatomy and Disease Presentation,edwards D,"This is the first video of a series introducing the concept of Parametrial Endometriosis (PE) and describing our approach to diagnosing and treating this particular disease presentation. The objective of this video is to discuss the anatomy and innervation of the parametrium, introduce the concept of PE and explain the presenting signs and symptoms associated to this condition.","PE is a unique presentation of endometriosis with a specific constellation of symptoms. This video series introduces this concept and sets the fundamental anatomic bases for the next videos in the series, which describe the diagnosis, as well as the surgical technique and results of the Laparoscopic Nerve-Sparing Ultralateral Resection (LaNSURe) of PE.",34567608,5.75,FALSE,48,0.067,0,2,0,2,0,0,0.75,0,1,0,Intrapelvic entrapment of sacral nerve roots by abnormal bundles of the piriformis muscle: description of an extra-spinal cause of sciatica and pudendal neuralgia.,Journal of hip preservation surgery,10.1093/jhps/hnab041
AAGL2020_063,Laparoscopic Ureterolysis in the Setting of Endometriosis,allen R,This video presentation will review the medial and lateral approaches to ureter identification and illustrate surgical techniques to perform a laparoscopic ureterolysis in cases of endometriosis and retroperitoneal fibrosis.,"In patients with advanced endometriosis, ureterolysis is often necessary given extensive retroperitoneal fibrosis and inherent risk of ureteral injury. An intimate knowledge of anatomic landmarks, directed blunt and sharp dissection techniques, judicious use of cautery and careful hemostasis may allow for safe and effective completion of a laparoscopic ureterolysis in complex cases.",40144526,3.67,TRUE,66,0.095,0,1,0,2,0,0,0.67,0,0,0,Mechanistic investigation of Shuanghuanglian against infectious bronchitis in chickens: a network pharmacology and molecular dynamics study.,Frontiers in veterinary science,10.3389/fvets.2025.1557850
AAGL2020_068,Assessment of Gynecologic Laparoscopy Simulation Curriculum for Development of Fundamentals of Laparoscopy Surgery Psychomotor Skills.,yu V,To investigate the utility of a gynecologic laparoscopy simulation curriculum designed for mid-level obstetrics and gynecology (OBGYN) residents in the five Fundamentals of Laparoscopy Surgery (FLS) skills. The hypothesis was that residents would demonstrate significant improvement in all tasks.,"Mid-level OBGYN residents exposed to this gynecologic laparoscopy simulation training program significantly improved performance in the five FLS skills. Consequently, it may serve as a model for residency training programs. However, the absence of a cognitive and psychomotor hysteroscopic component in FLS is noteworthy and a shortcoming for OBGYN training programs.",41025907,3.58,FALSE,48,0.033,0,1,2,0,0,0,0.58,0,0,0,"Robotic-Assisted Radical Prostatectomy in the Elderly Patient-A Study of Functional, Surgical, and Oncological Outcomes in an Australian Cohort.",The Prostate,10.1002/pros.70063
AAGL2020_070,Fundamentals of Laparoscopic Surgery Scores and Career Choices in Obgyn Residents,foley C,To examine Fundamentals of Laparoscopic Surgery® (FLS) scores and career choices in obstetrics and gynecology residents.,Obstetrics and gynecology residents matching into a gynecologic surgery fellowship did not perform better than their peers on the written or skills portion of the FLS exam.,33907807,4.17,FALSE,42,0.238,0,1,0,2,0,0,0.67,0,0.5,0,Learning Fundamentals of Laparoscopic Surgery Manual Skills: An Institutional Experience With Remote Coaching and Assessment.,Military medicine,10.1093/milmed/usab170
AAGL2020_072,Perioperative Antibiotic Prophylaxis in Myomectomy Surgery,banerjee D,We aim to evaluate antibiotic use in myomectomy surgeries and its association with the incidence of surgical site infection (SSI).,"ACOG guidelines do not recommend use of prophylactic antibiotics for myomectomies. However, our study demonstrates that the majority of surgeons elect to use antibiotics prophylactically. Additionally, our study suggests that antibiotic use decreases SSI in abdominal myomectomy, but does not decrease SSI in laparoscopic myomectomy. These findings contribute to the limited data informing guidelines regarding antibiotic use in myomectomy surgery.",41788033,0.7599999999999998,TRUE,58,0.05,0,0,0,2,0,0,0.76,0,0,-2,Integrating Artificial Intelligence in Periodontal Diagnosis: A Comparative Evaluation of ChatGPT-4 and Dental Educators.,Journal of dental education,10.1002/jdd.70197
AAGL2020_073,Three Ways of Approach for Uterine Cervical Myoma during Laparoscopic Hysterectomy,aiko K,To show surgical strategy during laparoscopic hysterectomy for cervical myomas.,"Using these three methods step by step customizing the surgery to best address each case, safe laparoscopic surgery is possible, and open surgery can be avoided.",35522730,4.17,FALSE,8,0.038,0,1,0,2,0,0,0.67,0,0.5,0,Study on Hydration and Dehydration of Ezetimibe by Terahertz Spectroscopy with Humidity-Controlled Measurements and Theoretical Analysis.,The journal of physical chemistry. A,10.1021/acs.jpca.2c00301
AAGL2020_074,The Novel Application of Transvaginal Notes for Hysteroscopic Polypectomy and Cervicalmyomectomy,zhang C,To demonstrate the advantages of using transvaginal natural orifice transluminal endoscopic surgery (vNOTES) for both hysteroscopic polypectomy and cervical myomectomy.,"For patients with cervical polyps and/or myomas who cannot be operated by conventional methods, NOTES hysteroscopy and myomectomy may be an attractive option and lead to less surgical complications, reduced pain, and faster recovery.",41850423,4,FALSE,60,0.053,0,1,0,2,0,0,1,0,0,0,SP Robot-Assisted vNOTES for a Right Ovarian Cystectomy.,Journal of minimally invasive gynecology,10.1016/j.jmig.2026.03.015
AAGL2020_075,Relugolix Combination Therapy Improves Hemoglobin Levels in Anemic Women with Uterine Fibroids: Results from the Liberty Phase 3 Program,venturella R,To evaluate the effect of Relugolix combination therapy (Rel-CT) on hemoglobin in women with uterine fibroids (UF) and anemia.,"In women with UF, HMB, and anemia at baseline, Rel-CT significantly improved hemoglobin concentrations, demonstrating how reductions in MBL volume translate into clinically meaningful improvement in anemia.",37634528,4.6899999999999995,FALSE,53,0.481,1,1,2,0,0,0,0.69,0,0,0,Relugolix combination therapy in European women with symptomatic uterine fibroids: a subgroup analysis from the randomized phase 3 LIBERTY pivotal trials.,Gynecological endocrinology : the official journal of the International Society of Gynecological Endocrinology,10.1080/09513590.2023.2249107
AAGL2020_076,Use of Transcervical Radiofrequency Ablation for Treatment of Uterine Fibroids,michel L,The purpose of this video is to demonstrate the use of transcervical radiofrequency ablation (RFA) of uterine fibroids utilizing the Sonata Procedure.,Transcervical radiofrequency ablation is a safe and effective alternative treatment option for management of uterine fibroids. It should be considered in patients who wish to avoid major surgery or are poor surgical candidates.,37522105,3.21,FALSE,43,0,0,0,2,2,0,0,0.71,0,0.5,-2,Gynecology Resident Experience with Office Hysteroscopy Training.,JSLS : Journal of the Society of Laparoendoscopic Surgeons,10.4293/JSLS.2023.00009
AAGL2020_078,"Upper Vaginectomy for Fibroid Recurrence at the Vaginal Cuff in a Patient with ER/PR Positive, HER2/Neu Negative Breast Cancer",boyd S,"To present an unusual case of fibroid recurrence at the vaginal cuff, and a unique approach to safely perform an upper vaginectomy",Robotic assisted upper vaginectomy is a safe approach for a removal of a mass at the vaginal cuff and allows the surgeon to easily perform ureterolysis to the level of the insertion of the ureters at the bladder.,40131593,3.63,FALSE,45,0.1,0,1,2,0,0,0,0.63,0,0,0,Echocardiography Training Pathway for Intensive Care Trainees: A Comparison with International Guidelines.,Irish medical journal,NA
AAGL2020_083,Resection of a Complete Uterine and Cervical Septum,zeni G,This video demonstrates a technique for the surgical correction of a complete uterine and cervical septum.,This video clearly demonstrates a technique for the hysteroscopic correction of a complete uterine and cervical septum under laparoscopic guidance. The septum is delineated by using a Foley catheter balloon in the contralateral uterine cavity to create a bulge at the level of the fibrous septum.,36033023,4.68,FALSE,45,0.111,0,1,0,2,0,0,0.68,0,1,0,Leveraging a multidimensional linguistic analysis of constructed responses produced by college readers.,Frontiers in psychology,10.3389/fpsyg.2022.936162
AAGL2020_084,Hysteroscopic Approaches to the Removal of Malpositioned Intrauterine Devices (IUDs),young R,"The objectives of this video are to (1) demonstrate both common and uncommon clinical presentations of a malpositioned intrauterine device (IUD) and (2) demonstrate appropriate removal techniques, including those ideal for both the office and operating room setting.",This video reviews the clinical approach to the removal of malposition.,35086789,4.76,FALSE,42,0.04,0,1,0,2,0,0,0.76,0,1,0,Impact of Question Bank Use for In-Training Examination Preparation by OBGYN Residents - A Multicenter Study.,Journal of surgical education,10.1016/j.jsurg.2021.12.014
AAGL2020_085,Retrograde Bladder Dissection for Prevention of Bladder Injury during Robotic-Assisted Laparoscopic Hysterectomy,benabou K,To demonstrate a technique for retrograde bladder dissection in a patient with extensive adhesive disease of the pelvis.,Retrograde bladder dissection is a useful technique to safely restore anatomy in patients with dense adhesive disease and obliterated anterior cul-de-sac. Knowledge of anatomical landmarks is essential for this technique.,34248328,3.71,FALSE,6,0.038,0,0,2,2,0,0,0.71,0,1,-2,Response to Letter to the Editor: Laparoscopic Posterior Versus Lateral Transversus Abdominis Plane Block in Gynecology.,JSLS : Journal of the Society of Laparoendoscopic Surgeons,10.4293/JSLS.2021.00030
AAGL2020_089,Hepatic Endometriosis,mohling S,Robotic assisted laparoscopic surgery may be used to excise endometriosis of the anterior hepatic lobe and overlying abdominal wall endometrioma.,Robotic assisted laparoscopy for surgical excision of hepatic and upper abdominal wall endometriosis is a straight-forward and effective way to treat extra-pelvic disease.,35819664,4.16,FALSE,21,1,3,0,0,0,0,0,0.66,0,0.5,0,Hepatic Endometriosis.,Journal of gastrointestinal surgery : official journal of the Society for Surgery of the Alimentary Tract,10.1007/s11605-021-05156-1
AAGL2020_091,Resection of Bladder Mass,kharoufeh A,To illustrate surgical techniques and anatomic considerations involved in the resection of urinary bladder wall mullerianosis.,The surgical techniques highlighted in this video can aid in the safe and complete resection of bladder wall lesions.,34917488,4.65,FALSE,649,0.083,0,1,0,2,0,0,0.65,0,1,0,A rare gynecologic presentation of proteus syndrome: A case report.,Case reports in women's health,10.1016/j.crwh.2021.e00373
AAGL2020_092,"Robotic Port Closure: An Efficient, Safe, Novel Technique for Fascial Suturing",shu M,"Minilaparotomy can be closed effectively with an intra-abdominal, robotic-assisted technique.","Robotic-assisted intra-abdominal fascial closure is efficient and safe. With proper closure of the abdominal wall fascia at these small and difficult incision sites, including minilaparotomy, we may be able to reduce the risks of immediate and delayed incisional hernia.",36816460,4.59,FALSE,44,0,0,1,0,2,0,0,0.59,0,1,0,Renal Hilum Injury with Veress Needle.,CRSLS : MIS case reports from SLS,10.4293/CRSLS.2022.00019
AAGL2020_094,Cesarean Section Scar Ectopic: Laparoscopic and Hysteroscopic Surgical Management,brunn E,To present a case of resection of cesarean section scar ectopic pregnancy with isthmocele repair using both laparoscopic and hysteroscopic techniques.,"There is currently no standard of care for management of cesarean section scar ectopic. When opting for surgical management it is important to anticipate possible complications, including dense adhesions and hemorrhage. In this video we provide a detailed combined hysteroscopic and laparoscopic approach to removal of cesarean scar ectopic. Techniques to minimize blood loss and reduce injury to surrounding organs are highlighted; including bladder distension, laparoscopic tourniquet, and uterine artery skeletonization. Anticipating and mitigating potential complications with these techniques leads to an optimal outcome.",40597336,3.62,FALSE,44,0.032,0,1,0,2,0,0,0.62,0,0,0,"An evaluation of the feasibility, value and impact of using participatory modelling to inform the development of a regional system dynamics model for youth suicide prevention.",Health research policy and systems,10.1186/s12961-025-01360-6
AAGL2020_095,Outpatient Operative Hysteroscopy for Retained Products of Conception,tanvir T,"To determine the feasibility, time taken, completeness of removal of the retained products conception (RPOC) by outpatient hysteroscopy (OH)",Outpatient hysteroscopy with complete removal of retained products is feasible without any form of anesthesia and negligible complications. Preoperative assessment of the size and type of RPOC by a transvaginal doppler ultrasound adds to the success of this technique.,33589138,5,FALSE,37,0.067,0,1,2,0,0,0,1,0,1,0,Endometriosis presenting as vaginal polyps: outpatient vaginoscopic treatment.,Fertility and sterility,10.1016/j.fertnstert.2020.11.021
AAGL2021_003,Does Gas Insufflation during Gynecologic or Urologic Oncologic Laparoscopy Cause Dissemination of Malignant Cells,tzur Y,To investigate whether benign or malignant cells are found in evacuated gas during laparoscopy for gynecological or urological malignancies.,"In contrast to previous concerns, in all cases where the tumor was confined to its' organ, we found no evidence of benign or malignant cell spread in the gas evacuated from the abdominal or retroperitoneal cavity during laparoscopy. The single event of malignant cells from aerosolized gas was in a case with a macroscopic, extra-organ involvement. Our study confirms the safety of performing laparoscopic surgery for gynecologic and urologic malignancies with regard to aerosolized gas. The explanation for malignant cells found in evacuated gas could be both aerosolization of cells or cells that adhered to surgical instruments. The clinical significance of this finding in the setting of macroscopic, extra-organ tumor spread is unclear.",35752301,4,FALSE,46,0.034,0,0,2,2,0,0,1,0,1,-2,Expectant vs medical management for retained products of conception after medical termination of pregnancy: a randomized controlled study.,American journal of obstetrics and gynecology,10.1016/j.ajog.2022.06.025
AAGL2021_005,Laparoscopic Management of Cesarean Scar Pregnancy,crihfield E,To present a case and surgical video of a laparoscopic excision of a cesarean scar pregnancy at 12 weeks and review the literature regarding cesarean scar pregnancy management.,Laparoscopic excision of a cesarean scar pregnancy can be accomplished successfully with good outcomes when preventative measures to achieve good hemostasis such as pre-operative uterine artery embolization and fetal intra-cardiac KCl injection are used.,38636771,4,TRUE,36,0.625,2,1,0,0,0,0,1,0,0,0,Laparoscopic removal of heterotopic cesarean scar pregnancy.,Fertility and sterility,10.1016/j.fertnstert.2024.04.018
AAGL2021_009,Minimally Invasive Management of Second Trimester Placenta Percreta,mathur S,To describe the diagnostic and surgical challenges in the management of second trimester placenta percreta.,Placenta accrete spectrum disorders pose significant challenges in diagnosis and management. A minimally invasive approach has not been described in the literature. We demonstrate that a minimally invasive approach to hysterectomy in management of midtrimester placenta percreta is a feasible option.,41490433,3.59,FALSE,73,0,0,1,0,2,0,0,0.59,0,0,0,Implementing a cost-effective inpatient virtual nursing program.,Nursing management,10.1097/nmg.0000000000000330
AAGL2021_012,"Lymphadenectomy, Sentinel Node Mapping Plus Backup Lymphadenectomy and Sentinel Node Mapping Alone in Endometrial Cancer",bogani G,"Sentinel node mapping (SNM) has replaced lymphadenectomy for staging surgery in apparent early-stage endometrial cancer (EC). Here, we evaluate the long-term survival of three different approaches of nodal assessment.",Our study highlighted that SNM provides similar long-term oncologic outcomes than lymphadenectomy. Further evidence is warranted to assess the prognostic value of low-volume disease detected by ultrastaging and the role of molecular/genomic profiling.,35598492,6.8100000000000005,FALSE,62,0.167,0,1,2,2,0,0,0.81,0,1,0,Assessing the role of low volume disease in endometrial cancer.,"European journal of obstetrics, gynecology, and reproductive biology",10.1016/j.ejogrb.2022.05.014
AAGL2021_013,Minimally Invasive Surgery in High-Grade Endometrial Carcinoma and Risk for Local Recurrence: An Israeli Gynecology Oncology Group Study,levin G,To compare oncological outcomes of women with high-grade endometrial carcinoma (HGEC) who underwent surgery by minimally invasive surgery (MIS) versus laparotomy.,"In women with HGEC, MIS is associated with higher rates of local recurrence as compared to laparotomy.",36041694,3.78,TRUE,85,0.233,0,0,0,2,0,0,0.78,0,1,0,Prediction of endometrial cancer recurrence by using a novel machine learning algorithm: An Israeli gynecologic oncology group study.,Journal of gynecology obstetrics and human reproduction,10.1016/j.jogoh.2022.102466
